Sheet: Sheet1
A1: of:= 5 -> 5 | B1: of:= [.A1] + 1 -> 6 | C1: of:= [.B1] + 1 -> 7 | D1: of:= [.C1] + 1 -> 8 | E1: of:= [.D1] + 1 -> 9 | F1: of:= [.E1] + 1 -> 10 | G1: of:= [.F1] + 1 -> 11 | H1: of:= [.G1] + 1 -> 12 | I1: of:= [.H1] + 1 -> 13 | J1: of:= [.I1] + 1 -> 14 | K1: of:= [.J1] + 1 -> 15 | L1: of:= [.K1] + 1 -> 16 | M1: of:= [.L1] + 1 -> 17 | N1: of:= [.M1] + 1 -> 18 | O1: of:= [.N1] + 1 -> 19 | P1: of:= [.O1] + 1 -> 20 | Q1: of:= [.P1] + 1 -> 21 | R1: of:= [.Q1] + 1 -> 22 | S1: of:= [.R1] + 1 -> 23 | T1: of:= [.S1] + 1 -> 24 | U1: of:= [.T1] + 1 -> 25 | V1: of:= [.U1] + 1 -> 26 | W1: of:= [.V1] + 1 -> 27 | X1: of:= [.W1] + 1 -> 28 | Y1: of:= [.X1] + 1 -> 29 | Z1: of:= [.Y1] + 1 -> 30 | AA1: of:= [.Z1] + 1 -> 31 | AB1: of:= [.AA1] + 1 -> 32 | AC1: of:= [.AB1] + 1 -> 33 | AD1: of:= [.AC1] + 1 -> 34 | AE1: of:= [.AD1] + 1 -> 35 | AF1: of:= [.AE1] + 1 -> 36 | AG1: of:= [.AF1] + 1 -> 37 | AH1: of:= [.AG1] + 1 -> 38 | AI1: of:= [.AH1] + 1 -> 39 | AJ1: of:= [.AI1] + 1 -> 40 | AK1: of:= [.AJ1] + 1 -> 41 | AL1: of:= [.AK1] + 1 -> 42 | AM1: of:= [.AL1] + 1 -> 43 | AN1: of:= [.AM1] + 1 -> 44
A2: of:= [.A1] + 1 -> 6 | B2: of:= [.A2] + 1 -> 7 | C2: of:= [.B2] + 1 -> 8 | D2: of:= [.C2] + 1 -> 9 | E2: of:= [.D2] + 1 -> 10 | F2: of:= [.E2] + 1 -> 11 | G2: of:= [.F2] + 1 -> 12 | H2: of:= [.G2] + 1 -> 13 | I2: of:= [.H2] + 1 -> 14 | J2: of:= [.I2] + 1 -> 15 | K2: of:= [.J2] + 1 -> 16 | L2: of:= [.K2] + 1 -> 17 | M2: of:= [.L2] + 1 -> 18 | N2: of:= [.M2] + 1 -> 19 | O2: of:= [.N2] + 1 -> 20 | P2: of:= [.O2] + 1 -> 21 | Q2: of:= [.P2] + 1 -> 22 | R2: of:= [.Q2] + 1 -> 23 | S2: of:= [.R2] + 1 -> 24 | T2: of:= [.S2] + 1 -> 25 | U2: of:= [.T2] + 1 -> 26 | V2: of:= [.U2] + 1 -> 27 | W2: of:= [.V2] + 1 -> 28 | X2: of:= [.W2] + 1 -> 29 | Y2: of:= [.X2] + 1 -> 30 | Z2: of:= [.Y2] + 1 -> 31 | AA2: of:= [.Z2] + 1 -> 32 | AB2: of:= [.AA2] + 1 -> 33 | AC2: of:= [.AB2] + 1 -> 34 | AD2: of:= [.AC2] + 1 -> 35 | AE2: of:= [.AD2] + 1 -> 36 | AF2: of:= [.AE2] + 1 -> 37 | AG2: of:= [.AF2] + 1 -> 38 | AH2: of:= [.AG2] + 1 -> 39 | AI2: of:= [.AH2] + 1 -> 40 | AJ2: of:= [.AI2] + 1 -> 41 | AK2: of:= [.AJ2] + 1 -> 42 | AL2: of:= [.AK2] + 1 -> 43 | AM2: of:= [.AL2] + 1 -> 44 | AN2: of:= [.AM2] + 1 -> 45
A3: of:= [.A2] + 1 -> 7 | B3: of:= [.A3] + 1 -> 8 | C3: of:= [.B3] + 1 -> 9 | D3: of:= [.C3] + 1 -> 10 | E3: of:= [.D3] + 1 -> 11 | F3: of:= [.E3] + 1 -> 12 | G3: of:= [.F3] + 1 -> 13 | H3: of:= [.G3] + 1 -> 14 | I3: of:= [.H3] + 1 -> 15 | J3: of:= [.I3] + 1 -> 16 | K3: of:= [.J3] + 1 -> 17 | L3: of:= [.K3] + 1 -> 18 | M3: of:= [.L3] + 1 -> 19 | N3: of:= [.M3] + 1 -> 20 | O3: of:= [.N3] + 1 -> 21 | P3: of:= [.O3] + 1 -> 22 | Q3: of:= [.P3] + 1 -> 23 | R3: of:= [.Q3] + 1 -> 24 | S3: of:= [.R3] + 1 -> 25 | T3: of:= [.S3] + 1 -> 26 | U3: of:= [.T3] + 1 -> 27 | V3: of:= [.U3] + 1 -> 28 | W3: of:= [.V3] + 1 -> 29 | X3: of:= [.W3] + 1 -> 30 | Y3: of:= [.X3] + 1 -> 31 | Z3: of:= [.Y3] + 1 -> 32 | AA3: of:= [.Z3] + 1 -> 33 | AB3: of:= [.AA3] + 1 -> 34 | AC3: of:= [.AB3] + 1 -> 35 | AD3: of:= [.AC3] + 1 -> 36 | AE3: of:= [.AD3] + 1 -> 37 | AF3: of:= [.AE3] + 1 -> 38 | AG3: of:= [.AF3] + 1 -> 39 | AH3: of:= [.AG3] + 1 -> 40 | AI3: of:= [.AH3] + 1 -> 41 | AJ3: of:= [.AI3] + 1 -> 42 | AK3: of:= [.AJ3] + 1 -> 43 | AL3: of:= [.AK3] + 1 -> 44 | AM3: of:= [.AL3] + 1 -> 45 | AN3: of:= [.AM3] + 1 -> 46
A4: of:= [.A3] + 1 -> 8 | B4: of:= [.A4] + 1 -> 9 | C4: of:= [.B4] + 1 -> 10 | D4: of:= [.C4] + 1 -> 11 | E4: of:= [.D4] + 1 -> 12 | F4: of:= [.E4] + 1 -> 13 | G4: of:= [.F4] + 1 -> 14 | H4: of:= [.G4] + 1 -> 15 | I4: of:= [.H4] + 1 -> 16 | J4: of:= [.I4] + 1 -> 17 | K4: of:= [.J4] + 1 -> 18 | L4: of:= [.K4] + 1 -> 19 | M4: of:= [.L4] + 1 -> 20 | N4: of:= [.M4] + 1 -> 21 | O4: of:= [.N4] + 1 -> 22 | P4: of:= [.O4] + 1 -> 23 | Q4: of:= [.P4] + 1 -> 24 | R4: of:= [.Q4] + 1 -> 25 | S4: of:= [.R4] + 1 -> 26 | T4: of:= [.S4] + 1 -> 27 | U4: of:= [.T4] + 1 -> 28 | V4: of:= [.U4] + 1 -> 29 | W4: of:= [.V4] + 1 -> 30 | X4: of:= [.W4] + 1 -> 31 | Y4: of:= [.X4] + 1 -> 32 | Z4: of:= [.Y4] + 1 -> 33 | AA4: of:= [.Z4] + 1 -> 34 | AB4: of:= [.AA4] + 1 -> 35 | AC4: of:= [.AB4] + 1 -> 36 | AD4: of:= [.AC4] + 1 -> 37 | AE4: of:= [.AD4] + 1 -> 38 | AF4: of:= [.AE4] + 1 -> 39 | AG4: of:= [.AF4] + 1 -> 40 | AH4: of:= [.AG4] + 1 -> 41 | AI4: of:= [.AH4] + 1 -> 42 | AJ4: of:= [.AI4] + 1 -> 43 | AK4: of:= [.AJ4] + 1 -> 44 | AL4: of:= [.AK4] + 1 -> 45 | AM4: of:= [.AL4] + 1 -> 46 | AN4: of:= [.AM4] + 1 -> 47
A5: of:= [.A4] + 1 -> 9 | B5: of:= [.A5] + 1 -> 10 | C5: of:= [.B5] + 1 -> 11 | D5: of:= [.C5] + 1 -> 12 | E5: of:= [.D5] + 1 -> 13 | F5: of:= [.E5] + 1 -> 14 | G5: of:= [.F5] + 1 -> 15 | H5: of:= [.G5] + 1 -> 16 | I5: of:= [.H5] + 1 -> 17 | J5: of:= [.I5] + 1 -> 18 | K5: of:= [.J5] + 1 -> 19 | L5: of:= [.K5] + 1 -> 20 | M5: of:= [.L5] + 1 -> 21 | N5: of:= [.M5] + 1 -> 22 | O5: of:= [.N5] + 1 -> 23 | P5: of:= [.O5] + 1 -> 24 | Q5: of:= [.P5] + 1 -> 25 | R5: of:= [.Q5] + 1 -> 26 | S5: of:= [.R5] + 1 -> 27 | T5: of:= [.S5] + 1 -> 28 | U5: of:= [.T5] + 1 -> 29 | V5: of:= [.U5] + 1 -> 30 | W5: of:= [.V5] + 1 -> 31 | X5: of:= [.W5] + 1 -> 32 | Y5: of:= [.X5] + 1 -> 33 | Z5: of:= [.Y5] + 1 -> 34 | AA5: of:= [.Z5] + 1 -> 35 | AB5: of:= [.AA5] + 1 -> 36 | AC5: of:= [.AB5] + 1 -> 37 | AD5: of:= [.AC5] + 1 -> 38 | AE5: of:= [.AD5] + 1 -> 39 | AF5: of:= [.AE5] + 1 -> 40 | AG5: of:= [.AF5] + 1 -> 41 | AH5: of:= [.AG5] + 1 -> 42 | AI5: of:= [.AH5] + 1 -> 43 | AJ5: of:= [.AI5] + 1 -> 44 | AK5: of:= [.AJ5] + 1 -> 45 | AL5: of:= [.AK5] + 1 -> 46 | AM5: of:= [.AL5] + 1 -> 47 | AN5: of:= [.AM5] + 1 -> 48
A6: of:= [.A5] + 1 -> 10 | B6: of:= [.A6] + 1 -> 11 | C6: of:= [.B6] + 1 -> 12 | D6: of:= [.C6] + 1 -> 13 | E6: of:= [.D6] + 1 -> 14 | F6: of:= [.E6] + 1 -> 15 | G6: of:= [.F6] + 1 -> 16 | H6: of:= [.G6] + 1 -> 17 | I6: of:= [.H6] + 1 -> 18 | J6: of:= [.I6] + 1 -> 19 | K6: of:= [.J6] + 1 -> 20 | L6: of:= [.K6] + 1 -> 21 | M6: of:= [.L6] + 1 -> 22 | N6: of:= [.M6] + 1 -> 23 | O6: of:= [.N6] + 1 -> 24 | P6: of:= [.O6] + 1 -> 25 | Q6: of:= [.P6] + 1 -> 26 | R6: of:= [.Q6] + 1 -> 27 | S6: of:= [.R6] + 1 -> 28 | T6: of:= [.S6] + 1 -> 29 | U6: of:= [.T6] + 1 -> 30 | V6: of:= [.U6] + 1 -> 31 | W6: of:= [.V6] + 1 -> 32 | X6: of:= [.W6] + 1 -> 33 | Y6: of:= [.X6] + 1 -> 34 | Z6: of:= [.Y6] + 1 -> 35 | AA6: of:= [.Z6] + 1 -> 36 | AB6: of:= [.AA6] + 1 -> 37 | AC6: of:= [.AB6] + 1 -> 38 | AD6: of:= [.AC6] + 1 -> 39 | AE6: of:= [.AD6] + 1 -> 40 | AF6: of:= [.AE6] + 1 -> 41 | AG6: of:= [.AF6] + 1 -> 42 | AH6: of:= [.AG6] + 1 -> 43 | AI6: of:= [.AH6] + 1 -> 44 | AJ6: of:= [.AI6] + 1 -> 45 | AK6: of:= [.AJ6] + 1 -> 46 | AL6: of:= [.AK6] + 1 -> 47 | AM6: of:= [.AL6] + 1 -> 48 | AN6: of:= [.AM6] + 1 -> 49
A7: of:= [.A6] + 1 -> 11 | B7: of:= [.A7] + 1 -> 12 | C7: of:= [.B7] + 1 -> 13 | D7: of:= [.C7] + 1 -> 14 | E7: of:= [.D7] + 1 -> 15 | F7: of:= [.E7] + 1 -> 16 | G7: of:= [.F7] + 1 -> 17 | H7: of:= [.G7] + 1 -> 18 | I7: of:= [.H7] + 1 -> 19 | J7: of:= [.I7] + 1 -> 20 | K7: of:= [.J7] + 1 -> 21 | L7: of:= [.K7] + 1 -> 22 | M7: of:= [.L7] + 1 -> 23 | N7: of:= [.M7] + 1 -> 24 | O7: of:= [.N7] + 1 -> 25 | P7: of:= [.O7] + 1 -> 26 | Q7: of:= [.P7] + 1 -> 27 | R7: of:= [.Q7] + 1 -> 28 | S7: of:= [.R7] + 1 -> 29 | T7: of:= [.S7] + 1 -> 30 | U7: of:= [.T7] + 1 -> 31 | V7: of:= [.U7] + 1 -> 32 | W7: of:= [.V7] + 1 -> 33 | X7: of:= [.W7] + 1 -> 34 | Y7: of:= [.X7] + 1 -> 35 | Z7: of:= [.Y7] + 1 -> 36 | AA7: of:= [.Z7] + 1 -> 37 | AB7: of:= [.AA7] + 1 -> 38 | AC7: of:= [.AB7] + 1 -> 39 | AD7: of:= [.AC7] + 1 -> 40 | AE7: of:= [.AD7] + 1 -> 41 | AF7: of:= [.AE7] + 1 -> 42 | AG7: of:= [.AF7] + 1 -> 43 | AH7: of:= [.AG7] + 1 -> 44 | AI7: of:= [.AH7] + 1 -> 45 | AJ7: of:= [.AI7] + 1 -> 46 | AK7: of:= [.AJ7] + 1 -> 47 | AL7: of:= [.AK7] + 1 -> 48 | AM7: of:= [.AL7] + 1 -> 49 | AN7: of:= [.AM7] + 1 -> 50
A8: of:= [.A7] + 1 -> 12 | B8: of:= [.A8] + 1 -> 13 | C8: of:= [.B8] + 1 -> 14 | D8: of:= [.C8] + 1 -> 15 | E8: of:= [.D8] + 1 -> 16 | F8: of:= [.E8] + 1 -> 17 | G8: of:= [.F8] + 1 -> 18 | H8: of:= [.G8] + 1 -> 19 | I8: of:= [.H8] + 1 -> 20 | J8: of:= [.I8] + 1 -> 21 | K8: of:= [.J8] + 1 -> 22 | L8: of:= [.K8] + 1 -> 23 | M8: of:= [.L8] + 1 -> 24 | N8: of:= [.M8] + 1 -> 25 | O8: of:= [.N8] + 1 -> 26 | P8: of:= [.O8] + 1 -> 27 | Q8: of:= [.P8] + 1 -> 28 | R8: of:= [.Q8] + 1 -> 29 | S8: of:= [.R8] + 1 -> 30 | T8: of:= [.S8] + 1 -> 31 | U8: of:= [.T8] + 1 -> 32 | V8: of:= [.U8] + 1 -> 33 | W8: of:= [.V8] + 1 -> 34 | X8: of:= [.W8] + 1 -> 35 | Y8: of:= [.X8] + 1 -> 36 | Z8: of:= [.Y8] + 1 -> 37 | AA8: of:= [.Z8] + 1 -> 38 | AB8: of:= [.AA8] + 1 -> 39 | AC8: of:= [.AB8] + 1 -> 40 | AD8: of:= [.AC8] + 1 -> 41 | AE8: of:= [.AD8] + 1 -> 42 | AF8: of:= [.AE8] + 1 -> 43 | AG8: of:= [.AF8] + 1 -> 44 | AH8: of:= [.AG8] + 1 -> 45 | AI8: of:= [.AH8] + 1 -> 46 | AJ8: of:= [.AI8] + 1 -> 47 | AK8: of:= [.AJ8] + 1 -> 48 | AL8: of:= [.AK8] + 1 -> 49 | AM8: of:= [.AL8] + 1 -> 50 | AN8: of:= [.AM8] + 1 -> 51
A9: of:= [.A8] + 1 -> 13 | B9: of:= [.A9] + 1 -> 14 | C9: of:= [.B9] + 1 -> 15 | D9: of:= [.C9] + 1 -> 16 | E9: of:= [.D9] + 1 -> 17 | F9: of:= [.E9] + 1 -> 18 | G9: of:= [.F9] + 1 -> 19 | H9: of:= [.G9] + 1 -> 20 | I9: of:= [.H9] + 1 -> 21 | J9: of:= [.I9] + 1 -> 22 | K9: of:= [.J9] + 1 -> 23 | L9: of:= [.K9] + 1 -> 24 | M9: of:= [.L9] + 1 -> 25 | N9: of:= [.M9] + 1 -> 26 | O9: of:= [.N9] + 1 -> 27 | P9: of:= [.O9] + 1 -> 28 | Q9: of:= [.P9] + 1 -> 29 | R9: of:= [.Q9] + 1 -> 30 | S9: of:= [.R9] + 1 -> 31 | T9: of:= [.S9] + 1 -> 32 | U9: of:= [.T9] + 1 -> 33 | V9: of:= [.U9] + 1 -> 34 | W9: of:= [.V9] + 1 -> 35 | X9: of:= [.W9] + 1 -> 36 | Y9: of:= [.X9] + 1 -> 37 | Z9: of:= [.Y9] + 1 -> 38 | AA9: of:= [.Z9] + 1 -> 39 | AB9: of:= [.AA9] + 1 -> 40 | AC9: of:= [.AB9] + 1 -> 41 | AD9: of:= [.AC9] + 1 -> 42 | AE9: of:= [.AD9] + 1 -> 43 | AF9: of:= [.AE9] + 1 -> 44 | AG9: of:= [.AF9] + 1 -> 45 | AH9: of:= [.AG9] + 1 -> 46 | AI9: of:= [.AH9] + 1 -> 47 | AJ9: of:= [.AI9] + 1 -> 48 | AK9: of:= [.AJ9] + 1 -> 49 | AL9: of:= [.AK9] + 1 -> 50 | AM9: of:= [.AL9] + 1 -> 51 | AN9: of:= [.AM9] + 1 -> 52
A10: of:= [.A9] + 1 -> 14 | B10: of:= [.A10] + 1 -> 15 | C10: of:= [.B10] + 1 -> 16 | D10: of:= [.C10] + 1 -> 17 | E10: of:= [.D10] + 1 -> 18 | F10: of:= [.E10] + 1 -> 19 | G10: of:= [.F10] + 1 -> 20 | H10: of:= [.G10] + 1 -> 21 | I10: of:= [.H10] + 1 -> 22 | J10: of:= [.I10] + 1 -> 23 | K10: of:= [.J10] + 1 -> 24 | L10: of:= [.K10] + 1 -> 25 | M10: of:= [.L10] + 1 -> 26 | N10: of:= [.M10] + 1 -> 27 | O10: of:= [.N10] + 1 -> 28 | P10: of:= [.O10] + 1 -> 29 | Q10: of:= [.P10] + 1 -> 30 | R10: of:= [.Q10] + 1 -> 31 | S10: of:= [.R10] + 1 -> 32 | T10: of:= [.S10] + 1 -> 33 | U10: of:= [.T10] + 1 -> 34 | V10: of:= [.U10] + 1 -> 35 | W10: of:= [.V10] + 1 -> 36 | X10: of:= [.W10] + 1 -> 37 | Y10: of:= [.X10] + 1 -> 38 | Z10: of:= [.Y10] + 1 -> 39 | AA10: of:= [.Z10] + 1 -> 40 | AB10: of:= [.AA10] + 1 -> 41 | AC10: of:= [.AB10] + 1 -> 42 | AD10: of:= [.AC10] + 1 -> 43 | AE10: of:= [.AD10] + 1 -> 44 | AF10: of:= [.AE10] + 1 -> 45 | AG10: of:= [.AF10] + 1 -> 46 | AH10: of:= [.AG10] + 1 -> 47 | AI10: of:= [.AH10] + 1 -> 48 | AJ10: of:= [.AI10] + 1 -> 49 | AK10: of:= [.AJ10] + 1 -> 50 | AL10: of:= [.AK10] + 1 -> 51 | AM10: of:= [.AL10] + 1 -> 52 | AN10: of:= [.AM10] + 1 -> 53
A11: of:= [.A10] + 1 -> 15 | B11: of:= [.A11] + 1 -> 16 | C11: of:= [.B11] + 1 -> 17 | D11: of:= [.C11] + 1 -> 18 | E11: of:= [.D11] + 1 -> 19 | F11: of:= [.E11] + 1 -> 20 | G11: of:= [.F11] + 1 -> 21 | H11: of:= [.G11] + 1 -> 22 | I11: of:= [.H11] + 1 -> 23 | J11: of:= [.I11] + 1 -> 24 | K11: of:= [.J11] + 1 -> 25 | L11: of:= [.K11] + 1 -> 26 | M11: of:= [.L11] + 1 -> 27 | N11: of:= [.M11] + 1 -> 28 | O11: of:= [.N11] + 1 -> 29 | P11: of:= [.O11] + 1 -> 30 | Q11: of:= [.P11] + 1 -> 31 | R11: of:= [.Q11] + 1 -> 32 | S11: of:= [.R11] + 1 -> 33 | T11: of:= [.S11] + 1 -> 34 | U11: of:= [.T11] + 1 -> 35 | V11: of:= [.U11] + 1 -> 36 | W11: of:= [.V11] + 1 -> 37 | X11: of:= [.W11] + 1 -> 38 | Y11: of:= [.X11] + 1 -> 39 | Z11: of:= [.Y11] + 1 -> 40 | AA11: of:= [.Z11] + 1 -> 41 | AB11: of:= [.AA11] + 1 -> 42 | AC11: of:= [.AB11] + 1 -> 43 | AD11: of:= [.AC11] + 1 -> 44 | AE11: of:= [.AD11] + 1 -> 45 | AF11: of:= [.AE11] + 1 -> 46 | AG11: of:= [.AF11] + 1 -> 47 | AH11: of:= [.AG11] + 1 -> 48 | AI11: of:= [.AH11] + 1 -> 49 | AJ11: of:= [.AI11] + 1 -> 50 | AK11: of:= [.AJ11] + 1 -> 51 | AL11: of:= [.AK11] + 1 -> 52 | AM11: of:= [.AL11] + 1 -> 53 | AN11: of:= [.AM11] + 1 -> 54
A12: of:= [.A11] + 1 -> 16 | B12: of:= [.A12] + 1 -> 17 | C12: of:= [.B12] + 1 -> 18 | D12: of:= [.C12] + 1 -> 19 | E12: of:= [.D12] + 1 -> 20 | F12: of:= [.E12] + 1 -> 21 | G12: of:= [.F12] + 1 -> 22 | H12: of:= [.G12] + 1 -> 23 | I12: of:= [.H12] + 1 -> 24 | J12: of:= [.I12] + 1 -> 25 | K12: of:= [.J12] + 1 -> 26 | L12: of:= [.K12] + 1 -> 27 | M12: of:= [.L12] + 1 -> 28 | N12: of:= [.M12] + 1 -> 29 | O12: of:= [.N12] + 1 -> 30 | P12: of:= [.O12] + 1 -> 31 | Q12: of:= [.P12] + 1 -> 32 | R12: of:= [.Q12] + 1 -> 33 | S12: of:= [.R12] + 1 -> 34 | T12: of:= [.S12] + 1 -> 35 | U12: of:= [.T12] + 1 -> 36 | V12: of:= [.U12] + 1 -> 37 | W12: of:= [.V12] + 1 -> 38 | X12: of:= [.W12] + 1 -> 39 | Y12: of:= [.X12] + 1 -> 40 | Z12: of:= [.Y12] + 1 -> 41 | AA12: of:= [.Z12] + 1 -> 42 | AB12: of:= [.AA12] + 1 -> 43 | AC12: of:= [.AB12] + 1 -> 44 | AD12: of:= [.AC12] + 1 -> 45 | AE12: of:= [.AD12] + 1 -> 46 | AF12: of:= [.AE12] + 1 -> 47 | AG12: of:= [.AF12] + 1 -> 48 | AH12: of:= [.AG12] + 1 -> 49 | AI12: of:= [.AH12] + 1 -> 50 | AJ12: of:= [.AI12] + 1 -> 51 | AK12: of:= [.AJ12] + 1 -> 52 | AL12: of:= [.AK12] + 1 -> 53 | AM12: of:= [.AL12] + 1 -> 54 | AN12: of:= [.AM12] + 1 -> 55
A13: of:= [.A12] + 1 -> 17 | B13: of:= [.A13] + 1 -> 18 | C13: of:= [.B13] + 1 -> 19 | D13: of:= [.C13] + 1 -> 20 | E13: of:= [.D13] + 1 -> 21 | F13: of:= [.E13] + 1 -> 22 | G13: of:= [.F13] + 1 -> 23 | H13: of:= [.G13] + 1 -> 24 | I13: of:= [.H13] + 1 -> 25 | J13: of:= [.I13] + 1 -> 26 | K13: of:= [.J13] + 1 -> 27 | L13: of:= [.K13] + 1 -> 28 | M13: of:= [.L13] + 1 -> 29 | N13: of:= [.M13] + 1 -> 30 | O13: of:= [.N13] + 1 -> 31 | P13: of:= [.O13] + 1 -> 32 | Q13: of:= [.P13] + 1 -> 33 | R13: of:= [.Q13] + 1 -> 34 | S13: of:= [.R13] + 1 -> 35 | T13: of:= [.S13] + 1 -> 36 | U13: of:= [.T13] + 1 -> 37 | V13: of:= [.U13] + 1 -> 38 | W13: of:= [.V13] + 1 -> 39 | X13: of:= [.W13] + 1 -> 40 | Y13: of:= [.X13] + 1 -> 41 | Z13: of:= [.Y13] + 1 -> 42 | AA13: of:= [.Z13] + 1 -> 43 | AB13: of:= [.AA13] + 1 -> 44 | AC13: of:= [.AB13] + 1 -> 45 | AD13: of:= [.AC13] + 1 -> 46 | AE13: of:= [.AD13] + 1 -> 47 | AF13: of:= [.AE13] + 1 -> 48 | AG13: of:= [.AF13] + 1 -> 49 | AH13: of:= [.AG13] + 1 -> 50 | AI13: of:= [.AH13] + 1 -> 51 | AJ13: of:= [.AI13] + 1 -> 52 | AK13: of:= [.AJ13] + 1 -> 53 | AL13: of:= [.AK13] + 1 -> 54 | AM13: of:= [.AL13] + 1 -> 55 | AN13: of:= [.AM13] + 1 -> 56
A14: of:= [.A13] + 1 -> 18 | B14: of:= [.A14] + 1 -> 19 | C14: of:= [.B14] + 1 -> 20 | D14: of:= [.C14] + 1 -> 21 | E14: of:= [.D14] + 1 -> 22 | F14: of:= [.E14] + 1 -> 23 | G14: of:= [.F14] + 1 -> 24 | H14: of:= [.G14] + 1 -> 25 | I14: of:= [.H14] + 1 -> 26 | J14: of:= [.I14] + 1 -> 27 | K14: of:= [.J14] + 1 -> 28 | L14: of:= [.K14] + 1 -> 29 | M14: of:= [.L14] + 1 -> 30 | N14: of:= [.M14] + 1 -> 31 | O14: of:= [.N14] + 1 -> 32 | P14: of:= [.O14] + 1 -> 33 | Q14: of:= [.P14] + 1 -> 34 | R14: of:= [.Q14] + 1 -> 35 | S14: of:= [.R14] + 1 -> 36 | T14: of:= [.S14] + 1 -> 37 | U14: of:= [.T14] + 1 -> 38 | V14: of:= [.U14] + 1 -> 39 | W14: of:= [.V14] + 1 -> 40 | X14: of:= [.W14] + 1 -> 41 | Y14: of:= [.X14] + 1 -> 42 | Z14: of:= [.Y14] + 1 -> 43 | AA14: of:= [.Z14] + 1 -> 44 | AB14: of:= [.AA14] + 1 -> 45 | AC14: of:= [.AB14] + 1 -> 46 | AD14: of:= [.AC14] + 1 -> 47 | AE14: of:= [.AD14] + 1 -> 48 | AF14: of:= [.AE14] + 1 -> 49 | AG14: of:= [.AF14] + 1 -> 50 | AH14: of:= [.AG14] + 1 -> 51 | AI14: of:= [.AH14] + 1 -> 52 | AJ14: of:= [.AI14] + 1 -> 53 | AK14: of:= [.AJ14] + 1 -> 54 | AL14: of:= [.AK14] + 1 -> 55 | AM14: of:= [.AL14] + 1 -> 56 | AN14: of:= [.AM14] + 1 -> 57
A15: of:= [.A14] + 1 -> 19 | B15: of:= [.A15] + 1 -> 20 | C15: of:= [.B15] + 1 -> 21 | D15: of:= [.C15] + 1 -> 22 | E15: of:= [.D15] + 1 -> 23 | F15: of:= [.E15] + 1 -> 24 | G15: of:= [.F15] + 1 -> 25 | H15: of:= [.G15] + 1 -> 26 | I15: of:= [.H15] + 1 -> 27 | J15: of:= [.I15] + 1 -> 28 | K15: of:= [.J15] + 1 -> 29 | L15: of:= [.K15] + 1 -> 30 | M15: of:= [.L15] + 1 -> 31 | N15: of:= [.M15] + 1 -> 32 | O15: of:= [.N15] + 1 -> 33 | P15: of:= [.O15] + 1 -> 34 | Q15: of:= [.P15] + 1 -> 35 | R15: of:= [.Q15] + 1 -> 36 | S15: of:= [.R15] + 1 -> 37 | T15: of:= [.S15] + 1 -> 38 | U15: of:= [.T15] + 1 -> 39 | V15: of:= [.U15] + 1 -> 40 | W15: of:= [.V15] + 1 -> 41 | X15: of:= [.W15] + 1 -> 42 | Y15: of:= [.X15] + 1 -> 43 | Z15: of:= [.Y15] + 1 -> 44 | AA15: of:= [.Z15] + 1 -> 45 | AB15: of:= [.AA15] + 1 -> 46 | AC15: of:= [.AB15] + 1 -> 47 | AD15: of:= [.AC15] + 1 -> 48 | AE15: of:= [.AD15] + 1 -> 49 | AF15: of:= [.AE15] + 1 -> 50 | AG15: of:= [.AF15] + 1 -> 51 | AH15: of:= [.AG15] + 1 -> 52 | AI15: of:= [.AH15] + 1 -> 53 | AJ15: of:= [.AI15] + 1 -> 54 | AK15: of:= [.AJ15] + 1 -> 55 | AL15: of:= [.AK15] + 1 -> 56 | AM15: of:= [.AL15] + 1 -> 57 | AN15: of:= [.AM15] + 1 -> 58
A16: of:= [.A15] + 1 -> 20 | B16: of:= [.A16] + 1 -> 21 | C16: of:= [.B16] + 1 -> 22 | D16: of:= [.C16] + 1 -> 23 | E16: of:= [.D16] + 1 -> 24 | F16: of:= [.E16] + 1 -> 25 | G16: of:= [.F16] + 1 -> 26 | H16: of:= [.G16] + 1 -> 27 | I16: of:= [.H16] + 1 -> 28 | J16: of:= [.I16] + 1 -> 29 | K16: of:= [.J16] + 1 -> 30 | L16: of:= [.K16] + 1 -> 31 | M16: of:= [.L16] + 1 -> 32 | N16: of:= [.M16] + 1 -> 33 | O16: of:= [.N16] + 1 -> 34 | P16: of:= [.O16] + 1 -> 35 | Q16: of:= [.P16] + 1 -> 36 | R16: of:= [.Q16] + 1 -> 37 | S16: of:= [.R16] + 1 -> 38 | T16: of:= [.S16] + 1 -> 39 | U16: of:= [.T16] + 1 -> 40 | V16: of:= [.U16] + 1 -> 41 | W16: of:= [.V16] + 1 -> 42 | X16: of:= [.W16] + 1 -> 43 | Y16: of:= [.X16] + 1 -> 44 | Z16: of:= [.Y16] + 1 -> 45 | AA16: of:= [.Z16] + 1 -> 46 | AB16: of:= [.AA16] + 1 -> 47 | AC16: of:= [.AB16] + 1 -> 48 | AD16: of:= [.AC16] + 1 -> 49 | AE16: of:= [.AD16] + 1 -> 50 | AF16: of:= [.AE16] + 1 -> 51 | AG16: of:= [.AF16] + 1 -> 52 | AH16: of:= [.AG16] + 1 -> 53 | AI16: of:= [.AH16] + 1 -> 54 | AJ16: of:= [.AI16] + 1 -> 55 | AK16: of:= [.AJ16] + 1 -> 56 | AL16: of:= [.AK16] + 1 -> 57 | AM16: of:= [.AL16] + 1 -> 58 | AN16: of:= [.AM16] + 1 -> 59
A17: of:= [.A16] + 1 -> 21 | B17: of:= [.B16] + 1 -> 22 | C17: of:= [.C16] + 1 -> 23 | D17: of:= [.D16] + 1 -> 24 | E17: of:= [.E16] + 1 -> 25 | F17: of:= [.F16] + 1 -> 26 | G17: of:= [.G16] + 1 -> 27 | H17: of:= [.H16] + 1 -> 28 | I17: of:= [.I16] + 1 -> 29 | J17: of:= [.J16] + 1 -> 30 | K17: of:= [.K16] + 1 -> 31 | L17: of:= [.L16] + 1 -> 32 | M17: of:= [.M16] + 1 -> 33 | N17: of:= [.N16] + 1 -> 34 | O17: of:= [.O16] + 1 -> 35 | P17: of:= [.P16] + 1 -> 36 | Q17: of:= [.Q16] + 1 -> 37 | R17: of:= [.R16] + 1 -> 38 | S17: of:= [.S16] + 1 -> 39 | T17: of:= [.T16] + 1 -> 40 | U17: of:= [.U16] + 1 -> 41 | V17: of:= [.V16] + 1 -> 42 | W17: of:= [.W16] + 1 -> 43 | X17: of:= [.X16] + 1 -> 44 | Y17: of:= [.Y16] + 1 -> 45 | Z17: of:= [.Z16] + 1 -> 46 | AA17: of:= [.AA16] + 1 -> 47 | AB17: of:= [.AB16] + 1 -> 48 | AC17: of:= [.AC16] + 1 -> 49 | AD17: of:= [.AD16] + 1 -> 50 | AE17: of:= [.AE16] + 1 -> 51 | AF17: of:= [.AF16] + 1 -> 52 | AG17: of:= [.AG16] + 1 -> 53 | AH17: of:= [.AH16] + 1 -> 54 | AI17: of:= [.AI16] + 1 -> 55 | AJ17: of:= [.AJ16] + 1 -> 56 | AK17: of:= [.AK16] + 1 -> 57 | AL17: of:= [.AL16] + 1 -> 58 | AM17: of:= [.AM16] + 1 -> 59 | AN17: of:= [.AN16] + 1 -> 60
A18: of:= [.A17] + 1 -> 22 | B18: of:= [.B17] + 1 -> 23 | C18: of:= [.C17] + 1 -> 24 | D18: of:= [.D17] + 1 -> 25 | E18: of:= [.E17] + 1 -> 26 | F18: of:= [.F17] + 1 -> 27 | G18: of:= [.G17] + 1 -> 28 | H18: of:= [.H17] + 1 -> 29 | I18: of:= [.I17] + 1 -> 30 | J18: of:= [.J17] + 1 -> 31 | K18: of:= [.K17] + 1 -> 32 | L18: of:= [.L17] + 1 -> 33 | M18: of:= [.M17] + 1 -> 34 | N18: of:= [.N17] + 1 -> 35 | O18: of:= [.O17] + 1 -> 36 | P18: of:= [.P17] + 1 -> 37 | Q18: of:= [.Q17] + 1 -> 38 | R18: of:= [.R17] + 1 -> 39 | S18: of:= [.S17] + 1 -> 40 | T18: of:= [.T17] + 1 -> 41 | U18: of:= [.U17] + 1 -> 42 | V18: of:= [.V17] + 1 -> 43 | W18: of:= [.W17] + 1 -> 44 | X18: of:= [.X17] + 1 -> 45 | Y18: of:= [.Y17] + 1 -> 46 | Z18: of:= [.Z17] + 1 -> 47 | AA18: of:= [.AA17] + 1 -> 48 | AB18: of:= [.AB17] + 1 -> 49 | AC18: of:= [.AC17] + 1 -> 50 | AD18: of:= [.AD17] + 1 -> 51 | AE18: of:= [.AE17] + 1 -> 52 | AF18: of:= [.AF17] + 1 -> 53 | AG18: of:= [.AG17] + 1 -> 54 | AH18: of:= [.AH17] + 1 -> 55 | AI18: of:= [.AI17] + 1 -> 56 | AJ18: of:= [.AJ17] + 1 -> 57 | AK18: of:= [.AK17] + 1 -> 58 | AL18: of:= [.AL17] + 1 -> 59 | AM18: of:= [.AM17] + 1 -> 60 | AN18: of:= [.AN17] + 1 -> 61
A19: of:= [.A18] + 1 -> 23 | B19: of:= [.B18] + 1 -> 24 | C19: of:= [.C18] + 1 -> 25 | D19: of:= [.D18] + 1 -> 26 | E19: of:= [.E18] + 1 -> 27 | F19: of:= [.F18] + 1 -> 28 | G19: of:= [.G18] + 1 -> 29 | H19: of:= [.H18] + 1 -> 30 | I19: of:= [.I18] + 1 -> 31 | J19: of:= [.J18] + 1 -> 32 | K19: of:= [.K18] + 1 -> 33 | L19: of:= [.L18] + 1 -> 34 | M19: of:= [.M18] + 1 -> 35 | N19: of:= [.N18] + 1 -> 36 | O19: of:= [.O18] + 1 -> 37 | P19: of:= [.P18] + 1 -> 38 | Q19: of:= [.Q18] + 1 -> 39 | R19: of:= [.R18] + 1 -> 40 | S19: of:= [.S18] + 1 -> 41 | T19: of:= [.T18] + 1 -> 42 | U19: of:= [.U18] + 1 -> 43 | V19: of:= [.V18] + 1 -> 44 | W19: of:= [.W18] + 1 -> 45 | X19: of:= [.X18] + 1 -> 46 | Y19: of:= [.Y18] + 1 -> 47 | Z19: of:= [.Z18] + 1 -> 48 | AA19: of:= [.AA18] + 1 -> 49 | AB19: of:= [.AB18] + 1 -> 50 | AC19: of:= [.AC18] + 1 -> 51 | AD19: of:= [.AD18] + 1 -> 52 | AE19: of:= [.AE18] + 1 -> 53 | AF19: of:= [.AF18] + 1 -> 54 | AG19: of:= [.AG18] + 1 -> 55 | AH19: of:= [.AH18] + 1 -> 56 | AI19: of:= [.AI18] + 1 -> 57 | AJ19: of:= [.AJ18] + 1 -> 58 | AK19: of:= [.AK18] + 1 -> 59 | AL19: of:= [.AL18] + 1 -> 60 | AM19: of:= [.AM18] + 1 -> 61 | AN19: of:= [.AN18] + 1 -> 62
A20: of:= [.A19] + 1 -> 24 | B20: of:= [.B19] + 1 -> 25 | C20: of:= [.C19] + 1 -> 26 | D20: of:= [.D19] + 1 -> 27 | E20: of:= [.E19] + 1 -> 28 | F20: of:= [.F19] + 1 -> 29 | G20: of:= [.G19] + 1 -> 30 | H20: of:= [.H19] + 1 -> 31 | I20: of:= [.I19] + 1 -> 32 | J20: of:= [.J19] + 1 -> 33 | K20: of:= [.K19] + 1 -> 34 | L20: of:= [.L19] + 1 -> 35 | M20: of:= [.M19] + 1 -> 36 | N20: of:= [.N19] + 1 -> 37 | O20: of:= [.O19] + 1 -> 38 | P20: of:= [.P19] + 1 -> 39 | Q20: of:= [.Q19] + 1 -> 40 | R20: of:= [.R19] + 1 -> 41 | S20: of:= [.S19] + 1 -> 42 | T20: of:= [.T19] + 1 -> 43 | U20: of:= [.U19] + 1 -> 44 | V20: of:= [.V19] + 1 -> 45 | W20: of:= [.W19] + 1 -> 46 | X20: of:= [.X19] + 1 -> 47 | Y20: of:= [.Y19] + 1 -> 48 | Z20: of:= [.Z19] + 1 -> 49 | AA20: of:= [.AA19] + 1 -> 50 | AB20: of:= [.AB19] + 1 -> 51 | AC20: of:= [.AC19] + 1 -> 52 | AD20: of:= [.AD19] + 1 -> 53 | AE20: of:= [.AE19] + 1 -> 54 | AF20: of:= [.AF19] + 1 -> 55 | AG20: of:= [.AG19] + 1 -> 56 | AH20: of:= [.AH19] + 1 -> 57 | AI20: of:= [.AI19] + 1 -> 58 | AJ20: of:= [.AJ19] + 1 -> 59 | AK20: of:= [.AK19] + 1 -> 60 | AL20: of:= [.AL19] + 1 -> 61 | AM20: of:= [.AM19] + 1 -> 62 | AN20: of:= [.AN19] + 1 -> 63
A21: of:= [.A20] + 1 -> 25 | B21: of:= [.B20] + 1 -> 26 | C21: of:= [.C20] + 1 -> 27 | D21: of:= [.D20] + 1 -> 28 | E21: of:= [.E20] + 1 -> 29 | F21: of:= [.F20] + 1 -> 30 | G21: of:= [.G20] + 1 -> 31 | H21: of:= [.H20] + 1 -> 32 | I21: of:= [.I20] + 1 -> 33 | J21: of:= [.J20] + 1 -> 34 | K21: of:= [.K20] + 1 -> 35 | L21: of:= [.L20] + 1 -> 36 | M21: of:= [.M20] + 1 -> 37 | N21: of:= [.N20] + 1 -> 38 | O21: of:= [.O20] + 1 -> 39 | P21: of:= [.P20] + 1 -> 40 | Q21: of:= [.Q20] + 1 -> 41 | R21: of:= [.R20] + 1 -> 42 | S21: of:= [.S20] + 1 -> 43 | T21: of:= [.T20] + 1 -> 44 | U21: of:= [.U20] + 1 -> 45 | V21: of:= [.V20] + 1 -> 46 | W21: of:= [.W20] + 1 -> 47 | X21: of:= [.X20] + 1 -> 48 | Y21: of:= [.Y20] + 1 -> 49 | Z21: of:= [.Z20] + 1 -> 50 | AA21: of:= [.AA20] + 1 -> 51 | AB21: of:= [.AB20] + 1 -> 52 | AC21: of:= [.AC20] + 1 -> 53 | AD21: of:= [.AD20] + 1 -> 54 | AE21: of:= [.AE20] + 1 -> 55 | AF21: of:= [.AF20] + 1 -> 56 | AG21: of:= [.AG20] + 1 -> 57 | AH21: of:= [.AH20] + 1 -> 58 | AI21: of:= [.AI20] + 1 -> 59 | AJ21: of:= [.AJ20] + 1 -> 60 | AK21: of:= [.AK20] + 1 -> 61 | AL21: of:= [.AL20] + 1 -> 62 | AM21: of:= [.AM20] + 1 -> 63 | AN21: of:= [.AN20] + 1 -> 64
A22: of:= [.A21] + 1 -> 26 | B22: of:= [.B21] + 1 -> 27 | C22: of:= [.C21] + 1 -> 28 | D22: of:= [.D21] + 1 -> 29 | E22: of:= [.E21] + 1 -> 30 | F22: of:= [.F21] + 1 -> 31 | G22: of:= [.G21] + 1 -> 32 | H22: of:= [.H21] + 1 -> 33 | I22: of:= [.I21] + 1 -> 34 | J22: of:= [.J21] + 1 -> 35 | K22: of:= [.K21] + 1 -> 36 | L22: of:= [.L21] + 1 -> 37 | M22: of:= [.M21] + 1 -> 38 | N22: of:= [.N21] + 1 -> 39 | O22: of:= [.O21] + 1 -> 40 | P22: of:= [.P21] + 1 -> 41 | Q22: of:= [.Q21] + 1 -> 42 | R22: of:= [.R21] + 1 -> 43 | S22: of:= [.S21] + 1 -> 44 | T22: of:= [.T21] + 1 -> 45 | U22: of:= [.U21] + 1 -> 46 | V22: of:= [.V21] + 1 -> 47 | W22: of:= [.W21] + 1 -> 48 | X22: of:= [.X21] + 1 -> 49 | Y22: of:= [.Y21] + 1 -> 50 | Z22: of:= [.Z21] + 1 -> 51 | AA22: of:= [.AA21] + 1 -> 52 | AB22: of:= [.AB21] + 1 -> 53 | AC22: of:= [.AC21] + 1 -> 54 | AD22: of:= [.AD21] + 1 -> 55 | AE22: of:= [.AE21] + 1 -> 56 | AF22: of:= [.AF21] + 1 -> 57 | AG22: of:= [.AG21] + 1 -> 58 | AH22: of:= [.AH21] + 1 -> 59 | AI22: of:= [.AI21] + 1 -> 60 | AJ22: of:= [.AJ21] + 1 -> 61 | AK22: of:= [.AK21] + 1 -> 62 | AL22: of:= [.AL21] + 1 -> 63 | AM22: of:= [.AM21] + 1 -> 64 | AN22: of:= [.AN21] + 1 -> 65
A23: of:= [.A22] + 1 -> 27 | B23: of:= [.B22] + 1 -> 28 | C23: of:= [.C22] + 1 -> 29 | D23: of:= [.D22] + 1 -> 30 | E23: of:= [.E22] + 1 -> 31 | F23: of:= [.F22] + 1 -> 32 | G23: of:= [.G22] + 1 -> 33 | H23: of:= [.H22] + 1 -> 34 | I23: of:= [.I22] + 1 -> 35 | J23: of:= [.J22] + 1 -> 36 | K23: of:= [.K22] + 1 -> 37 | L23: of:= [.L22] + 1 -> 38 | M23: of:= [.M22] + 1 -> 39 | N23: of:= [.N22] + 1 -> 40 | O23: of:= [.O22] + 1 -> 41 | P23: of:= [.P22] + 1 -> 42 | Q23: of:= [.Q22] + 1 -> 43 | R23: of:= [.R22] + 1 -> 44 | S23: of:= [.S22] + 1 -> 45 | T23: of:= [.T22] + 1 -> 46 | U23: of:= [.U22] + 1 -> 47 | V23: of:= [.V22] + 1 -> 48 | W23: of:= [.W22] + 1 -> 49 | X23: of:= [.X22] + 1 -> 50 | Y23: of:= [.Y22] + 1 -> 51 | Z23: of:= [.Z22] + 1 -> 52 | AA23: of:= [.AA22] + 1 -> 53 | AB23: of:= [.AB22] + 1 -> 54 | AC23: of:= [.AC22] + 1 -> 55 | AD23: of:= [.AD22] + 1 -> 56 | AE23: of:= [.AE22] + 1 -> 57 | AF23: of:= [.AF22] + 1 -> 58 | AG23: of:= [.AG22] + 1 -> 59 | AH23: of:= [.AH22] + 1 -> 60 | AI23: of:= [.AI22] + 1 -> 61 | AJ23: of:= [.AJ22] + 1 -> 62 | AK23: of:= [.AK22] + 1 -> 63 | AL23: of:= [.AL22] + 1 -> 64 | AM23: of:= [.AM22] + 1 -> 65 | AN23: of:= [.AN22] + 1 -> 66
A24: of:= [.A23] + 1 -> 28 | B24: of:= [.B23] + 1 -> 29 | C24: of:= [.C23] + 1 -> 30 | D24: of:= [.D23] + 1 -> 31 | E24: of:= [.E23] + 1 -> 32 | F24: of:= [.F23] + 1 -> 33 | G24: of:= [.G23] + 1 -> 34 | H24: of:= [.H23] + 1 -> 35 | I24: of:= [.I23] + 1 -> 36 | J24: of:= [.J23] + 1 -> 37 | K24: of:= [.K23] + 1 -> 38 | L24: of:= [.L23] + 1 -> 39 | M24: of:= [.M23] + 1 -> 40 | N24: of:= [.N23] + 1 -> 41 | O24: of:= [.O23] + 1 -> 42 | P24: of:= [.P23] + 1 -> 43 | Q24: of:= [.Q23] + 1 -> 44 | R24: of:= [.R23] + 1 -> 45 | S24: of:= [.S23] + 1 -> 46 | T24: of:= [.T23] + 1 -> 47 | U24: of:= [.U23] + 1 -> 48 | V24: of:= [.V23] + 1 -> 49 | W24: of:= [.W23] + 1 -> 50 | X24: of:= [.X23] + 1 -> 51 | Y24: of:= [.Y23] + 1 -> 52 | Z24: of:= [.Z23] + 1 -> 53 | AA24: of:= [.AA23] + 1 -> 54 | AB24: of:= [.AB23] + 1 -> 55 | AC24: of:= [.AC23] + 1 -> 56 | AD24: of:= [.AD23] + 1 -> 57 | AE24: of:= [.AE23] + 1 -> 58 | AF24: of:= [.AF23] + 1 -> 59 | AG24: of:= [.AG23] + 1 -> 60 | AH24: of:= [.AH23] + 1 -> 61 | AI24: of:= [.AI23] + 1 -> 62 | AJ24: of:= [.AJ23] + 1 -> 63 | AK24: of:= [.AK23] + 1 -> 64 | AL24: of:= [.AL23] + 1 -> 65 | AM24: of:= [.AM23] + 1 -> 66 | AN24: of:= [.AN23] + 1 -> 67
A25: of:= [.A24] + 1 -> 29 | B25: of:= [.B24] + 1 -> 30 | C25: of:= [.C24] + 1 -> 31 | D25: of:= [.D24] + 1 -> 32 | E25: of:= [.E24] + 1 -> 33 | F25: of:= [.F24] + 1 -> 34 | G25: of:= [.G24] + 1 -> 35 | H25: of:= [.H24] + 1 -> 36 | I25: of:= [.I24] + 1 -> 37 | J25: of:= [.J24] + 1 -> 38 | K25: of:= [.K24] + 1 -> 39 | L25: of:= [.L24] + 1 -> 40 | M25: of:= [.M24] + 1 -> 41 | N25: of:= [.N24] + 1 -> 42 | O25: of:= [.O24] + 1 -> 43 | P25: of:= [.P24] + 1 -> 44 | Q25: of:= [.Q24] + 1 -> 45 | R25: of:= [.R24] + 1 -> 46 | S25: of:= [.S24] + 1 -> 47 | T25: of:= [.T24] + 1 -> 48 | U25: of:= [.U24] + 1 -> 49 | V25: of:= [.V24] + 1 -> 50 | W25: of:= [.W24] + 1 -> 51 | X25: of:= [.X24] + 1 -> 52 | Y25: of:= [.Y24] + 1 -> 53 | Z25: of:= [.Z24] + 1 -> 54 | AA25: of:= [.AA24] + 1 -> 55 | AB25: of:= [.AB24] + 1 -> 56 | AC25: of:= [.AC24] + 1 -> 57 | AD25: of:= [.AD24] + 1 -> 58 | AE25: of:= [.AE24] + 1 -> 59 | AF25: of:= [.AF24] + 1 -> 60 | AG25: of:= [.AG24] + 1 -> 61 | AH25: of:= [.AH24] + 1 -> 62 | AI25: of:= [.AI24] + 1 -> 63 | AJ25: of:= [.AJ24] + 1 -> 64 | AK25: of:= [.AK24] + 1 -> 65 | AL25: of:= [.AL24] + 1 -> 66 | AM25: of:= [.AM24] + 1 -> 67 | AN25: of:= [.AN24] + 1 -> 68
A26: of:= [.A25] + 1 -> 30 | B26: of:= [.B25] + 1 -> 31 | C26: of:= [.C25] + 1 -> 32 | D26: of:= [.D25] + 1 -> 33 | E26: of:= [.E25] + 1 -> 34 | F26: of:= [.F25] + 1 -> 35 | G26: of:= [.G25] + 1 -> 36 | H26: of:= [.H25] + 1 -> 37 | I26: of:= [.I25] + 1 -> 38 | J26: of:= [.J25] + 1 -> 39 | K26: of:= [.K25] + 1 -> 40 | L26: of:= [.L25] + 1 -> 41 | M26: of:= [.M25] + 1 -> 42 | N26: of:= [.N25] + 1 -> 43 | O26: of:= [.O25] + 1 -> 44 | P26: of:= [.P25] + 1 -> 45 | Q26: of:= [.Q25] + 1 -> 46 | R26: of:= [.R25] + 1 -> 47 | S26: of:= [.S25] + 1 -> 48 | T26: of:= [.T25] + 1 -> 49 | U26: of:= [.U25] + 1 -> 50 | V26: of:= [.V25] + 1 -> 51 | W26: of:= [.W25] + 1 -> 52 | X26: of:= [.X25] + 1 -> 53 | Y26: of:= [.Y25] + 1 -> 54 | Z26: of:= [.Z25] + 1 -> 55 | AA26: of:= [.AA25] + 1 -> 56 | AB26: of:= [.AB25] + 1 -> 57 | AC26: of:= [.AC25] + 1 -> 58 | AD26: of:= [.AD25] + 1 -> 59 | AE26: of:= [.AE25] + 1 -> 60 | AF26: of:= [.AF25] + 1 -> 61 | AG26: of:= [.AG25] + 1 -> 62 | AH26: of:= [.AH25] + 1 -> 63 | AI26: of:= [.AI25] + 1 -> 64 | AJ26: of:= [.AJ25] + 1 -> 65 | AK26: of:= [.AK25] + 1 -> 66 | AL26: of:= [.AL25] + 1 -> 67 | AM26: of:= [.AM25] + 1 -> 68 | AN26: of:= [.AN25] + 1 -> 69
A27: of:= [.A26] + 1 -> 31 | B27: of:= [.B26] + 1 -> 32 | C27: of:= [.C26] + 1 -> 33 | D27: of:= [.D26] + 1 -> 34 | E27: of:= [.E26] + 1 -> 35 | F27: of:= [.F26] + 1 -> 36 | G27: of:= [.G26] + 1 -> 37 | H27: of:= [.H26] + 1 -> 38 | I27: of:= [.I26] + 1 -> 39 | J27: of:= [.J26] + 1 -> 40 | K27: of:= [.K26] + 1 -> 41 | L27: of:= [.L26] + 1 -> 42 | M27: of:= [.M26] + 1 -> 43 | N27: of:= [.N26] + 1 -> 44 | O27: of:= [.O26] + 1 -> 45 | P27: of:= [.P26] + 1 -> 46 | Q27: of:= [.Q26] + 1 -> 47 | R27: of:= [.R26] + 1 -> 48 | S27: of:= [.S26] + 1 -> 49 | T27: of:= [.T26] + 1 -> 50 | U27: of:= [.U26] + 1 -> 51 | V27: of:= [.V26] + 1 -> 52 | W27: of:= [.W26] + 1 -> 53 | X27: of:= [.X26] + 1 -> 54 | Y27: of:= [.Y26] + 1 -> 55 | Z27: of:= [.Z26] + 1 -> 56 | AA27: of:= [.AA26] + 1 -> 57 | AB27: of:= [.AB26] + 1 -> 58 | AC27: of:= [.AC26] + 1 -> 59 | AD27: of:= [.AD26] + 1 -> 60 | AE27: of:= [.AE26] + 1 -> 61 | AF27: of:= [.AF26] + 1 -> 62 | AG27: of:= [.AG26] + 1 -> 63 | AH27: of:= [.AH26] + 1 -> 64 | AI27: of:= [.AI26] + 1 -> 65 | AJ27: of:= [.AJ26] + 1 -> 66 | AK27: of:= [.AK26] + 1 -> 67 | AL27: of:= [.AL26] + 1 -> 68 | AM27: of:= [.AM26] + 1 -> 69 | AN27: of:= [.AN26] + 1 -> 70
A28: of:= [.A27] + 1 -> 32 | B28: of:= [.B27] + 1 -> 33 | C28: of:= [.C27] + 1 -> 34 | D28: of:= [.D27] + 1 -> 35 | E28: of:= [.E27] + 1 -> 36 | F28: of:= [.F27] + 1 -> 37 | G28: of:= [.G27] + 1 -> 38 | H28: of:= [.H27] + 1 -> 39 | I28: of:= [.I27] + 1 -> 40 | J28: of:= [.J27] + 1 -> 41 | K28: of:= [.K27] + 1 -> 42 | L28: of:= [.L27] + 1 -> 43 | M28: of:= [.M27] + 1 -> 44 | N28: of:= [.N27] + 1 -> 45 | O28: of:= [.O27] + 1 -> 46 | P28: of:= [.P27] + 1 -> 47 | Q28: of:= [.Q27] + 1 -> 48 | R28: of:= [.R27] + 1 -> 49 | S28: of:= [.S27] + 1 -> 50 | T28: of:= [.T27] + 1 -> 51 | U28: of:= [.U27] + 1 -> 52 | V28: of:= [.V27] + 1 -> 53 | W28: of:= [.W27] + 1 -> 54 | X28: of:= [.X27] + 1 -> 55 | Y28: of:= [.Y27] + 1 -> 56 | Z28: of:= [.Z27] + 1 -> 57 | AA28: of:= [.AA27] + 1 -> 58 | AB28: of:= [.AB27] + 1 -> 59 | AC28: of:= [.AC27] + 1 -> 60 | AD28: of:= [.AD27] + 1 -> 61 | AE28: of:= [.AE27] + 1 -> 62 | AF28: of:= [.AF27] + 1 -> 63 | AG28: of:= [.AG27] + 1 -> 64 | AH28: of:= [.AH27] + 1 -> 65 | AI28: of:= [.AI27] + 1 -> 66 | AJ28: of:= [.AJ27] + 1 -> 67 | AK28: of:= [.AK27] + 1 -> 68 | AL28: of:= [.AL27] + 1 -> 69 | AM28: of:= [.AM27] + 1 -> 70 | AN28: of:= [.AN27] + 1 -> 71
A29: of:= [.A28] + 1 -> 33 | B29: of:= [.B28] + 1 -> 34 | C29: of:= [.C28] + 1 -> 35 | D29: of:= [.D28] + 1 -> 36 | E29: of:= [.E28] + 1 -> 37 | F29: of:= [.F28] + 1 -> 38 | G29: of:= [.G28] + 1 -> 39 | H29: of:= [.H28] + 1 -> 40 | I29: of:= [.I28] + 1 -> 41 | J29: of:= [.J28] + 1 -> 42 | K29: of:= [.K28] + 1 -> 43 | L29: of:= [.L28] + 1 -> 44 | M29: of:= [.M28] + 1 -> 45 | N29: of:= [.N28] + 1 -> 46 | O29: of:= [.O28] + 1 -> 47 | P29: of:= [.P28] + 1 -> 48 | Q29: of:= [.Q28] + 1 -> 49 | R29: of:= [.R28] + 1 -> 50 | S29: of:= [.S28] + 1 -> 51 | T29: of:= [.T28] + 1 -> 52 | U29: of:= [.U28] + 1 -> 53 | V29: of:= [.V28] + 1 -> 54 | W29: of:= [.W28] + 1 -> 55 | X29: of:= [.X28] + 1 -> 56 | Y29: of:= [.Y28] + 1 -> 57 | Z29: of:= [.Z28] + 1 -> 58 | AA29: of:= [.AA28] + 1 -> 59 | AB29: of:= [.AB28] + 1 -> 60 | AC29: of:= [.AC28] + 1 -> 61 | AD29: of:= [.AD28] + 1 -> 62 | AE29: of:= [.AE28] + 1 -> 63 | AF29: of:= [.AF28] + 1 -> 64 | AG29: of:= [.AG28] + 1 -> 65 | AH29: of:= [.AH28] + 1 -> 66 | AI29: of:= [.AI28] + 1 -> 67 | AJ29: of:= [.AJ28] + 1 -> 68 | AK29: of:= [.AK28] + 1 -> 69 | AL29: of:= [.AL28] + 1 -> 70 | AM29: of:= [.AM28] + 1 -> 71 | AN29: of:= [.AN28] + 1 -> 72
A30: of:= [.A29] + 1 -> 34 | B30: of:= [.B29] + 1 -> 35 | C30: of:= [.C29] + 1 -> 36 | D30: of:= [.D29] + 1 -> 37 | E30: of:= [.E29] + 1 -> 38 | F30: of:= [.F29] + 1 -> 39 | G30: of:= [.G29] + 1 -> 40 | H30: of:= [.H29] + 1 -> 41 | I30: of:= [.I29] + 1 -> 42 | J30: of:= [.J29] + 1 -> 43 | K30: of:= [.K29] + 1 -> 44 | L30: of:= [.L29] + 1 -> 45 | M30: of:= [.M29] + 1 -> 46 | N30: of:= [.N29] + 1 -> 47 | O30: of:= [.O29] + 1 -> 48 | P30: of:= [.P29] + 1 -> 49 | Q30: of:= [.Q29] + 1 -> 50 | R30: of:= [.R29] + 1 -> 51 | S30: of:= [.S29] + 1 -> 52 | T30: of:= [.T29] + 1 -> 53 | U30: of:= [.U29] + 1 -> 54 | V30: of:= [.V29] + 1 -> 55 | W30: of:= [.W29] + 1 -> 56 | X30: of:= [.X29] + 1 -> 57 | Y30: of:= [.Y29] + 1 -> 58 | Z30: of:= [.Z29] + 1 -> 59 | AA30: of:= [.AA29] + 1 -> 60 | AB30: of:= [.AB29] + 1 -> 61 | AC30: of:= [.AC29] + 1 -> 62 | AD30: of:= [.AD29] + 1 -> 63 | AE30: of:= [.AE29] + 1 -> 64 | AF30: of:= [.AF29] + 1 -> 65 | AG30: of:= [.AG29] + 1 -> 66 | AH30: of:= [.AH29] + 1 -> 67 | AI30: of:= [.AI29] + 1 -> 68 | AJ30: of:= [.AJ29] + 1 -> 69 | AK30: of:= [.AK29] + 1 -> 70 | AL30: of:= [.AL29] + 1 -> 71 | AM30: of:= [.AM29] + 1 -> 72 | AN30: of:= [.AN29] + 1 -> 73
A31: of:= [.A30] + 1 -> 35 | B31: of:= [.B30] + 1 -> 36 | C31: of:= [.C30] + 1 -> 37 | D31: of:= [.D30] + 1 -> 38 | E31: of:= [.E30] + 1 -> 39 | F31: of:= [.F30] + 1 -> 40 | G31: of:= [.G30] + 1 -> 41 | H31: of:= [.H30] + 1 -> 42 | I31: of:= [.I30] + 1 -> 43 | J31: of:= [.J30] + 1 -> 44 | K31: of:= [.K30] + 1 -> 45 | L31: of:= [.L30] + 1 -> 46 | M31: of:= [.M30] + 1 -> 47 | N31: of:= [.N30] + 1 -> 48 | O31: of:= [.O30] + 1 -> 49 | P31: of:= [.P30] + 1 -> 50 | Q31: of:= [.Q30] + 1 -> 51 | R31: of:= [.R30] + 1 -> 52 | S31: of:= [.S30] + 1 -> 53 | T31: of:= [.T30] + 1 -> 54 | U31: of:= [.U30] + 1 -> 55 | V31: of:= [.V30] + 1 -> 56 | W31: of:= [.W30] + 1 -> 57 | X31: of:= [.X30] + 1 -> 58 | Y31: of:= [.Y30] + 1 -> 59 | Z31: of:= [.Z30] + 1 -> 60 | AA31: of:= [.AA30] + 1 -> 61 | AB31: of:= [.AB30] + 1 -> 62 | AC31: of:= [.AC30] + 1 -> 63 | AD31: of:= [.AD30] + 1 -> 64 | AE31: of:= [.AE30] + 1 -> 65 | AF31: of:= [.AF30] + 1 -> 66 | AG31: of:= [.AG30] + 1 -> 67 | AH31: of:= [.AH30] + 1 -> 68 | AI31: of:= [.AI30] + 1 -> 69 | AJ31: of:= [.AJ30] + 1 -> 70 | AK31: of:= [.AK30] + 1 -> 71 | AL31: of:= [.AL30] + 1 -> 72 | AM31: of:= [.AM30] + 1 -> 73 | AN31: of:= [.AN30] + 1 -> 74
A32: of:= [.A31] + 1 -> 36 | B32: of:= [.B31] + 1 -> 37 | C32: of:= [.C31] + 1 -> 38 | D32: of:= [.D31] + 1 -> 39 | E32: of:= [.E31] + 1 -> 40 | F32: of:= [.F31] + 1 -> 41 | G32: of:= [.G31] + 1 -> 42 | H32: of:= [.H31] + 1 -> 43 | I32: of:= [.I31] + 1 -> 44 | J32: of:= [.J31] + 1 -> 45 | K32: of:= [.K31] + 1 -> 46 | L32: of:= [.L31] + 1 -> 47 | M32: of:= [.M31] + 1 -> 48 | N32: of:= [.N31] + 1 -> 49 | O32: of:= [.O31] + 1 -> 50 | P32: of:= [.P31] + 1 -> 51 | Q32: of:= [.Q31] + 1 -> 52 | R32: of:= [.R31] + 1 -> 53 | S32: of:= [.S31] + 1 -> 54 | T32: of:= [.T31] + 1 -> 55 | U32: of:= [.U31] + 1 -> 56 | V32: of:= [.V31] + 1 -> 57 | W32: of:= [.W31] + 1 -> 58 | X32: of:= [.X31] + 1 -> 59 | Y32: of:= [.Y31] + 1 -> 60 | Z32: of:= [.Z31] + 1 -> 61 | AA32: of:= [.AA31] + 1 -> 62 | AB32: of:= [.AB31] + 1 -> 63 | AC32: of:= [.AC31] + 1 -> 64 | AD32: of:= [.AD31] + 1 -> 65 | AE32: of:= [.AE31] + 1 -> 66 | AF32: of:= [.AF31] + 1 -> 67 | AG32: of:= [.AG31] + 1 -> 68 | AH32: of:= [.AH31] + 1 -> 69 | AI32: of:= [.AI31] + 1 -> 70 | AJ32: of:= [.AJ31] + 1 -> 71 | AK32: of:= [.AK31] + 1 -> 72 | AL32: of:= [.AL31] + 1 -> 73 | AM32: of:= [.AM31] + 1 -> 74 | AN32: of:= [.AN31] + 1 -> 75