Sheet: Sheet1
A1: of:= 5 -> 5 | B1: of:= [.A1] + 1 -> 6 | C1: of:= [.B1] + 1 -> 7 | D1: of:= [.C1] + 1 -> 8 | E1: of:= [.D1] + 1 -> 9 | F1: of:= [.E1] + 1 -> 10 | G1: of:= [.F1] + 1 -> 11 | H1: of:= [.G1] + 1 -> 12 | I1: of:= [.H1] + 1 -> 13 | J1: of:= [.I1] + 1 -> 14 | K1: of:= [.J1] + 1 -> 15 | L1: of:= [.K1] + 1 -> 16 | M1: of:= [.L1] + 1 -> 17 | N1: of:= [.M1] + 1 -> 18 | O1: of:= [.N1] + 1 -> 19 | P1: of:= [.O1] + 1 -> 20 | Q1: of:= [.P1] + 1 -> 21 | R1: of:= [.Q1] + 1 -> 22 | S1: of:= [.R1] + 1 -> 23 | T1: of:= [.S1] + 1 -> 24 | U1: of:= [.T1] + 1 -> 25 | V1: of:= [.U1] + 1 -> 26 | W1: of:= [.V1] + 1 -> 27 | X1: of:= [.W1] + 1 -> 28 | Y1: of:= [.X1] + 1 -> 29 | Z1: of:= [.Y1] + 1 -> 30 | AA1: of:= [.Z1] + 1 -> 31 | AB1: of:= [.AA1] + 1 -> 32 | AC1: of:= [.AB1] + 1 -> 33 | AD1: of:= [.AC1] + 1 -> 34 | AE1: of:= [.AD1] + 1 -> 35 | AF1: of:= [.AE1] + 1 -> 36 | AG1: of:= [.AF1] + 1 -> 37 | AH1: of:= [.AG1] + 1 -> 38 | AI1: of:= [.AH1] + 1 -> 39 | AJ1: of:= [.AI1] + 1 -> 40 | AK1: of:= [.AJ1] + 1 -> 41 | AL1: of:= [.AK1] + 1 -> 42 | AM1: of:= [.AL1] + 1 -> 43 | AN1: of:= [.AM1] + 1 -> 44 | AO1: of:= [.AN1] + 1 -> 45 | AP1: of:= [.AO1] + 1 -> 46 | AQ1: of:= [.AP1] + 1 -> 47 | AR1: of:= [.AQ1] + 1 -> 48 | AS1: of:= [.AR1] + 1 -> 49 | AT1: of:= [.AS1] + 1 -> 50 | AU1: of:= [.AT1] + 1 -> 51 | AV1: of:= [.AU1] + 1 -> 52 | AW1: of:= [.AV1] + 1 -> 53 | AX1: of:= [.AW1] + 1 -> 54 | AY1: of:= [.AX1] + 1 -> 55 | AZ1: of:= [.AY1] + 1 -> 56 | BA1: of:= [.AZ1] + 1 -> 57 | BB1: of:= [.BA1] + 1 -> 58 | BC1: of:= [.BB1] + 1 -> 59 | BD1: of:= [.BC1] + 1 -> 60 | BE1: of:= [.BD1] + 1 -> 61 | BF1: of:= [.BE1] + 1 -> 62 | BG1: of:= [.BF1] + 1 -> 63 | BH1: of:= [.BG1] + 1 -> 64 | BI1: of:= [.BH1] + 1 -> 65 | BJ1: of:= [.BI1] + 1 -> 66 | BK1: of:= [.BJ1] + 1 -> 67 | BL1: of:= [.BK1] + 1 -> 68
A2: of:= [.A1] + 1 -> 6 | B2: of:= [.A2] + 1 -> 7 | C2: of:= [.B2] + 1 -> 8 | D2: of:= [.C2] + 1 -> 9 | E2: of:= [.D2] + 1 -> 10 | F2: of:= [.E2] + 1 -> 11 | G2: of:= [.F2] + 1 -> 12 | H2: of:= [.G2] + 1 -> 13 | I2: of:= [.H2] + 1 -> 14 | J2: of:= [.I2] + 1 -> 15 | K2: of:= [.J2] + 1 -> 16 | L2: of:= [.K2] + 1 -> 17 | M2: of:= [.L2] + 1 -> 18 | N2: of:= [.M2] + 1 -> 19 | O2: of:= [.N2] + 1 -> 20 | P2: of:= [.O2] + 1 -> 21 | Q2: of:= [.P2] + 1 -> 22 | R2: of:= [.Q2] + 1 -> 23 | S2: of:= [.R2] + 1 -> 24 | T2: of:= [.S2] + 1 -> 25 | U2: of:= [.T2] + 1 -> 26 | V2: of:= [.U2] + 1 -> 27 | W2: of:= [.V2] + 1 -> 28 | X2: of:= [.W2] + 1 -> 29 | Y2: of:= [.X2] + 1 -> 30 | Z2: of:= [.Y2] + 1 -> 31 | AA2: of:= [.Z2] + 1 -> 32 | AB2: of:= [.AA2] + 1 -> 33 | AC2: of:= [.AB2] + 1 -> 34 | AD2: of:= [.AC2] + 1 -> 35 | AE2: of:= [.AD2] + 1 -> 36 | AF2: of:= [.AE2] + 1 -> 37 | AG2: of:= [.AF2] + 1 -> 38 | AH2: of:= [.AG2] + 1 -> 39 | AI2: of:= [.AH2] + 1 -> 40 | AJ2: of:= [.AI2] + 1 -> 41 | AK2: of:= [.AJ2] + 1 -> 42 | AL2: of:= [.AK2] + 1 -> 43 | AM2: of:= [.AL2] + 1 -> 44 | AN2: of:= [.AM2] + 1 -> 45 | AO2: of:= [.AN2] + 1 -> 46 | AP2: of:= [.AO2] + 1 -> 47 | AQ2: of:= [.AP2] + 1 -> 48 | AR2: of:= [.AQ2] + 1 -> 49 | AS2: of:= [.AR2] + 1 -> 50 | AT2: of:= [.AS2] + 1 -> 51 | AU2: of:= [.AT2] + 1 -> 52 | AV2: of:= [.AU2] + 1 -> 53 | AW2: of:= [.AV2] + 1 -> 54 | AX2: of:= [.AW2] + 1 -> 55 | AY2: of:= [.AX2] + 1 -> 56 | AZ2: of:= [.AY2] + 1 -> 57 | BA2: of:= [.AZ2] + 1 -> 58 | BB2: of:= [.BA2] + 1 -> 59 | BC2: of:= [.BB2] + 1 -> 60 | BD2: of:= [.BC2] + 1 -> 61 | BE2: of:= [.BD2] + 1 -> 62 | BF2: of:= [.BE2] + 1 -> 63 | BG2: of:= [.BF2] + 1 -> 64 | BH2: of:= [.BG2] + 1 -> 65 | BI2: of:= [.BH2] + 1 -> 66 | BJ2: of:= [.BI2] + 1 -> 67 | BK2: of:= [.BJ2] + 1 -> 68 | BL2: of:= [.BK2] + 1 -> 69
A3: of:= [.A2] + 1 -> 7 | B3: of:= [.A3] + 1 -> 8 | C3: of:= [.B3] + 1 -> 9 | D3: of:= [.C3] + 1 -> 10 | E3: of:= [.D3] + 1 -> 11 | F3: of:= [.E3] + 1 -> 12 | G3: of:= [.F3] + 1 -> 13 | H3: of:= [.G3] + 1 -> 14 | I3: of:= [.H3] + 1 -> 15 | J3: of:= [.I3] + 1 -> 16 | K3: of:= [.J3] + 1 -> 17 | L3: of:= [.K3] + 1 -> 18 | M3: of:= [.L3] + 1 -> 19 | N3: of:= [.M3] + 1 -> 20 | O3: of:= [.N3] + 1 -> 21 | P3: of:= [.O3] + 1 -> 22 | Q3: of:= [.P3] + 1 -> 23 | R3: of:= [.Q3] + 1 -> 24 | S3: of:= [.R3] + 1 -> 25 | T3: of:= [.S3] + 1 -> 26 | U3: of:= [.T3] + 1 -> 27 | V3: of:= [.U3] + 1 -> 28 | W3: of:= [.V3] + 1 -> 29 | X3: of:= [.W3] + 1 -> 30 | Y3: of:= [.X3] + 1 -> 31 | Z3: of:= [.Y3] + 1 -> 32 | AA3: of:= [.Z3] + 1 -> 33 | AB3: of:= [.AA3] + 1 -> 34 | AC3: of:= [.AB3] + 1 -> 35 | AD3: of:= [.AC3] + 1 -> 36 | AE3: of:= [.AD3] + 1 -> 37 | AF3: of:= [.AE3] + 1 -> 38 | AG3: of:= [.AF3] + 1 -> 39 | AH3: of:= [.AG3] + 1 -> 40 | AI3: of:= [.AH3] + 1 -> 41 | AJ3: of:= [.AI3] + 1 -> 42 | AK3: of:= [.AJ3] + 1 -> 43 | AL3: of:= [.AK3] + 1 -> 44 | AM3: of:= [.AL3] + 1 -> 45 | AN3: of:= [.AM3] + 1 -> 46 | AO3: of:= [.AN3] + 1 -> 47 | AP3: of:= [.AO3] + 1 -> 48 | AQ3: of:= [.AP3] + 1 -> 49 | AR3: of:= [.AQ3] + 1 -> 50 | AS3: of:= [.AR3] + 1 -> 51 | AT3: of:= [.AS3] + 1 -> 52 | AU3: of:= [.AT3] + 1 -> 53 | AV3: of:= [.AU3] + 1 -> 54 | AW3: of:= [.AV3] + 1 -> 55 | AX3: of:= [.AW3] + 1 -> 56 | AY3: of:= [.AX3] + 1 -> 57 | AZ3: of:= [.AY3] + 1 -> 58 | BA3: of:= [.AZ3] + 1 -> 59 | BB3: of:= [.BA3] + 1 -> 60 | BC3: of:= [.BB3] + 1 -> 61 | BD3: of:= [.BC3] + 1 -> 62 | BE3: of:= [.BD3] + 1 -> 63 | BF3: of:= [.BE3] + 1 -> 64 | BG3: of:= [.BF3] + 1 -> 65 | BH3: of:= [.BG3] + 1 -> 66 | BI3: of:= [.BH3] + 1 -> 67 | BJ3: of:= [.BI3] + 1 -> 68 | BK3: of:= [.BJ3] + 1 -> 69 | BL3: of:= [.BK3] + 1 -> 70
A4: of:= [.A3] + 1 -> 8 | B4: of:= [.A4] + 1 -> 9 | C4: of:= [.B4] + 1 -> 10 | D4: of:= [.C4] + 1 -> 11 | E4: of:= [.D4] + 1 -> 12 | F4: of:= [.E4] + 1 -> 13 | G4: of:= [.F4] + 1 -> 14 | H4: of:= [.G4] + 1 -> 15 | I4: of:= [.H4] + 1 -> 16 | J4: of:= [.I4] + 1 -> 17 | K4: of:= [.J4] + 1 -> 18 | L4: of:= [.K4] + 1 -> 19 | M4: of:= [.L4] + 1 -> 20 | N4: of:= [.M4] + 1 -> 21 | O4: of:= [.N4] + 1 -> 22 | P4: of:= [.O4] + 1 -> 23 | Q4: of:= [.P4] + 1 -> 24 | R4: of:= [.Q4] + 1 -> 25 | S4: of:= [.R4] + 1 -> 26 | T4: of:= [.S4] + 1 -> 27 | U4: of:= [.T4] + 1 -> 28 | V4: of:= [.U4] + 1 -> 29 | W4: of:= [.V4] + 1 -> 30 | X4: of:= [.W4] + 1 -> 31 | Y4: of:= [.X4] + 1 -> 32 | Z4: of:= [.Y4] + 1 -> 33 | AA4: of:= [.Z4] + 1 -> 34 | AB4: of:= [.AA4] + 1 -> 35 | AC4: of:= [.AB4] + 1 -> 36 | AD4: of:= [.AC4] + 1 -> 37 | AE4: of:= [.AD4] + 1 -> 38 | AF4: of:= [.AE4] + 1 -> 39 | AG4: of:= [.AF4] + 1 -> 40 | AH4: of:= [.AG4] + 1 -> 41 | AI4: of:= [.AH4] + 1 -> 42 | AJ4: of:= [.AI4] + 1 -> 43 | AK4: of:= [.AJ4] + 1 -> 44 | AL4: of:= [.AK4] + 1 -> 45 | AM4: of:= [.AL4] + 1 -> 46 | AN4: of:= [.AM4] + 1 -> 47 | AO4: of:= [.AN4] + 1 -> 48 | AP4: of:= [.AO4] + 1 -> 49 | AQ4: of:= [.AP4] + 1 -> 50 | AR4: of:= [.AQ4] + 1 -> 51 | AS4: of:= [.AR4] + 1 -> 52 | AT4: of:= [.AS4] + 1 -> 53 | AU4: of:= [.AT4] + 1 -> 54 | AV4: of:= [.AU4] + 1 -> 55 | AW4: of:= [.AV4] + 1 -> 56 | AX4: of:= [.AW4] + 1 -> 57 | AY4: of:= [.AX4] + 1 -> 58 | AZ4: of:= [.AY4] + 1 -> 59 | BA4: of:= [.AZ4] + 1 -> 60 | BB4: of:= [.BA4] + 1 -> 61 | BC4: of:= [.BB4] + 1 -> 62 | BD4: of:= [.BC4] + 1 -> 63 | BE4: of:= [.BD4] + 1 -> 64 | BF4: of:= [.BE4] + 1 -> 65 | BG4: of:= [.BF4] + 1 -> 66 | BH4: of:= [.BG4] + 1 -> 67 | BI4: of:= [.BH4] + 1 -> 68 | BJ4: of:= [.BI4] + 1 -> 69 | BK4: of:= [.BJ4] + 1 -> 70 | BL4: of:= [.BK4] + 1 -> 71
A5: of:= [.A4] + 1 -> 9 | B5: of:= [.A5] + 1 -> 10 | C5: of:= [.B5] + 1 -> 11 | D5: of:= [.C5] + 1 -> 12 | E5: of:= [.D5] + 1 -> 13 | F5: of:= [.E5] + 1 -> 14 | G5: of:= [.F5] + 1 -> 15 | H5: of:= [.G5] + 1 -> 16 | I5: of:= [.H5] + 1 -> 17 | J5: of:= [.I5] + 1 -> 18 | K5: of:= [.J5] + 1 -> 19 | L5: of:= [.K5] + 1 -> 20 | M5: of:= [.L5] + 1 -> 21 | N5: of:= [.M5] + 1 -> 22 | O5: of:= [.N5] + 1 -> 23 | P5: of:= [.O5] + 1 -> 24 | Q5: of:= [.P5] + 1 -> 25 | R5: of:= [.Q5] + 1 -> 26 | S5: of:= [.R5] + 1 -> 27 | T5: of:= [.S5] + 1 -> 28 | U5: of:= [.T5] + 1 -> 29 | V5: of:= [.U5] + 1 -> 30 | W5: of:= [.V5] + 1 -> 31 | X5: of:= [.W5] + 1 -> 32 | Y5: of:= [.X5] + 1 -> 33 | Z5: of:= [.Y5] + 1 -> 34 | AA5: of:= [.Z5] + 1 -> 35 | AB5: of:= [.AA5] + 1 -> 36 | AC5: of:= [.AB5] + 1 -> 37 | AD5: of:= [.AC5] + 1 -> 38 | AE5: of:= [.AD5] + 1 -> 39 | AF5: of:= [.AE5] + 1 -> 40 | AG5: of:= [.AF5] + 1 -> 41 | AH5: of:= [.AG5] + 1 -> 42 | AI5: of:= [.AH5] + 1 -> 43 | AJ5: of:= [.AI5] + 1 -> 44 | AK5: of:= [.AJ5] + 1 -> 45 | AL5: of:= [.AK5] + 1 -> 46 | AM5: of:= [.AL5] + 1 -> 47 | AN5: of:= [.AM5] + 1 -> 48 | AO5: of:= [.AN5] + 1 -> 49 | AP5: of:= [.AO5] + 1 -> 50 | AQ5: of:= [.AP5] + 1 -> 51 | AR5: of:= [.AQ5] + 1 -> 52 | AS5: of:= [.AR5] + 1 -> 53 | AT5: of:= [.AS5] + 1 -> 54 | AU5: of:= [.AT5] + 1 -> 55 | AV5: of:= [.AU5] + 1 -> 56 | AW5: of:= [.AV5] + 1 -> 57 | AX5: of:= [.AW5] + 1 -> 58 | AY5: of:= [.AX5] + 1 -> 59 | AZ5: of:= [.AY5] + 1 -> 60 | BA5: of:= [.AZ5] + 1 -> 61 | BB5: of:= [.BA5] + 1 -> 62 | BC5: of:= [.BB5] + 1 -> 63 | BD5: of:= [.BC5] + 1 -> 64 | BE5: of:= [.BD5] + 1 -> 65 | BF5: of:= [.BE5] + 1 -> 66 | BG5: of:= [.BF5] + 1 -> 67 | BH5: of:= [.BG5] + 1 -> 68 | BI5: of:= [.BH5] + 1 -> 69 | BJ5: of:= [.BI5] + 1 -> 70 | BK5: of:= [.BJ5] + 1 -> 71 | BL5: of:= [.BK5] + 1 -> 72
A6: of:= [.A5] + 1 -> 10 | B6: of:= [.A6] + 1 -> 11 | C6: of:= [.B6] + 1 -> 12 | D6: of:= [.C6] + 1 -> 13 | E6: of:= [.D6] + 1 -> 14 | F6: of:= [.E6] + 1 -> 15 | G6: of:= [.F6] + 1 -> 16 | H6: of:= [.G6] + 1 -> 17 | I6: of:= [.H6] + 1 -> 18 | J6: of:= [.I6] + 1 -> 19 | K6: of:= [.J6] + 1 -> 20 | L6: of:= [.K6] + 1 -> 21 | M6: of:= [.L6] + 1 -> 22 | N6: of:= [.M6] + 1 -> 23 | O6: of:= [.N6] + 1 -> 24 | P6: of:= [.O6] + 1 -> 25 | Q6: of:= [.P6] + 1 -> 26 | R6: of:= [.Q6] + 1 -> 27 | S6: of:= [.R6] + 1 -> 28 | T6: of:= [.S6] + 1 -> 29 | U6: of:= [.T6] + 1 -> 30 | V6: of:= [.U6] + 1 -> 31 | W6: of:= [.V6] + 1 -> 32 | X6: of:= [.W6] + 1 -> 33 | Y6: of:= [.X6] + 1 -> 34 | Z6: of:= [.Y6] + 1 -> 35 | AA6: of:= [.Z6] + 1 -> 36 | AB6: of:= [.AA6] + 1 -> 37 | AC6: of:= [.AB6] + 1 -> 38 | AD6: of:= [.AC6] + 1 -> 39 | AE6: of:= [.AD6] + 1 -> 40 | AF6: of:= [.AE6] + 1 -> 41 | AG6: of:= [.AF6] + 1 -> 42 | AH6: of:= [.AG6] + 1 -> 43 | AI6: of:= [.AH6] + 1 -> 44 | AJ6: of:= [.AI6] + 1 -> 45 | AK6: of:= [.AJ6] + 1 -> 46 | AL6: of:= [.AK6] + 1 -> 47 | AM6: of:= [.AL6] + 1 -> 48 | AN6: of:= [.AM6] + 1 -> 49 | AO6: of:= [.AN6] + 1 -> 50 | AP6: of:= [.AO6] + 1 -> 51 | AQ6: of:= [.AP6] + 1 -> 52 | AR6: of:= [.AQ6] + 1 -> 53 | AS6: of:= [.AR6] + 1 -> 54 | AT6: of:= [.AS6] + 1 -> 55 | AU6: of:= [.AT6] + 1 -> 56 | AV6: of:= [.AU6] + 1 -> 57 | AW6: of:= [.AV6] + 1 -> 58 | AX6: of:= [.AW6] + 1 -> 59 | AY6: of:= [.AX6] + 1 -> 60 | AZ6: of:= [.AY6] + 1 -> 61 | BA6: of:= [.AZ6] + 1 -> 62 | BB6: of:= [.BA6] + 1 -> 63 | BC6: of:= [.BB6] + 1 -> 64 | BD6: of:= [.BC6] + 1 -> 65 | BE6: of:= [.BD6] + 1 -> 66 | BF6: of:= [.BE6] + 1 -> 67 | BG6: of:= [.BF6] + 1 -> 68 | BH6: of:= [.BG6] + 1 -> 69 | BI6: of:= [.BH6] + 1 -> 70 | BJ6: of:= [.BI6] + 1 -> 71 | BK6: of:= [.BJ6] + 1 -> 72 | BL6: of:= [.BK6] + 1 -> 73
A7: of:= [.A6] + 1 -> 11 | B7: of:= [.A7] + 1 -> 12 | C7: of:= [.B7] + 1 -> 13 | D7: of:= [.C7] + 1 -> 14 | E7: of:= [.D7] + 1 -> 15 | F7: of:= [.E7] + 1 -> 16 | G7: of:= [.F7] + 1 -> 17 | H7: of:= [.G7] + 1 -> 18 | I7: of:= [.H7] + 1 -> 19 | J7: of:= [.I7] + 1 -> 20 | K7: of:= [.J7] + 1 -> 21 | L7: of:= [.K7] + 1 -> 22 | M7: of:= [.L7] + 1 -> 23 | N7: of:= [.M7] + 1 -> 24 | O7: of:= [.N7] + 1 -> 25 | P7: of:= [.O7] + 1 -> 26 | Q7: of:= [.P7] + 1 -> 27 | R7: of:= [.Q7] + 1 -> 28 | S7: of:= [.R7] + 1 -> 29 | T7: of:= [.S7] + 1 -> 30 | U7: of:= [.T7] + 1 -> 31 | V7: of:= [.U7] + 1 -> 32 | W7: of:= [.V7] + 1 -> 33 | X7: of:= [.W7] + 1 -> 34 | Y7: of:= [.X7] + 1 -> 35 | Z7: of:= [.Y7] + 1 -> 36 | AA7: of:= [.Z7] + 1 -> 37 | AB7: of:= [.AA7] + 1 -> 38 | AC7: of:= [.AB7] + 1 -> 39 | AD7: of:= [.AC7] + 1 -> 40 | AE7: of:= [.AD7] + 1 -> 41 | AF7: of:= [.AE7] + 1 -> 42 | AG7: of:= [.AF7] + 1 -> 43 | AH7: of:= [.AG7] + 1 -> 44 | AI7: of:= [.AH7] + 1 -> 45 | AJ7: of:= [.AI7] + 1 -> 46 | AK7: of:= [.AJ7] + 1 -> 47 | AL7: of:= [.AK7] + 1 -> 48 | AM7: of:= [.AL7] + 1 -> 49 | AN7: of:= [.AM7] + 1 -> 50 | AO7: of:= [.AN7] + 1 -> 51 | AP7: of:= [.AO7] + 1 -> 52 | AQ7: of:= [.AP7] + 1 -> 53 | AR7: of:= [.AQ7] + 1 -> 54 | AS7: of:= [.AR7] + 1 -> 55 | AT7: of:= [.AS7] + 1 -> 56 | AU7: of:= [.AT7] + 1 -> 57 | AV7: of:= [.AU7] + 1 -> 58 | AW7: of:= [.AV7] + 1 -> 59 | AX7: of:= [.AW7] + 1 -> 60 | AY7: of:= [.AX7] + 1 -> 61 | AZ7: of:= [.AY7] + 1 -> 62 | BA7: of:= [.AZ7] + 1 -> 63 | BB7: of:= [.BA7] + 1 -> 64 | BC7: of:= [.BB7] + 1 -> 65 | BD7: of:= [.BC7] + 1 -> 66 | BE7: of:= [.BD7] + 1 -> 67 | BF7: of:= [.BE7] + 1 -> 68 | BG7: of:= [.BF7] + 1 -> 69 | BH7: of:= [.BG7] + 1 -> 70 | BI7: of:= [.BH7] + 1 -> 71 | BJ7: of:= [.BI7] + 1 -> 72 | BK7: of:= [.BJ7] + 1 -> 73 | BL7: of:= [.BK7] + 1 -> 74
A8: of:= [.A7] + 1 -> 12 | B8: of:= [.A8] + 1 -> 13 | C8: of:= [.B8] + 1 -> 14 | D8: of:= [.C8] + 1 -> 15 | E8: of:= [.D8] + 1 -> 16 | F8: of:= [.E8] + 1 -> 17 | G8: of:= [.F8] + 1 -> 18 | H8: of:= [.G8] + 1 -> 19 | I8: of:= [.H8] + 1 -> 20 | J8: of:= [.I8] + 1 -> 21 | K8: of:= [.J8] + 1 -> 22 | L8: of:= [.K8] + 1 -> 23 | M8: of:= [.L8] + 1 -> 24 | N8: of:= [.M8] + 1 -> 25 | O8: of:= [.N8] + 1 -> 26 | P8: of:= [.O8] + 1 -> 27 | Q8: of:= [.P8] + 1 -> 28 | R8: of:= [.Q8] + 1 -> 29 | S8: of:= [.R8] + 1 -> 30 | T8: of:= [.S8] + 1 -> 31 | U8: of:= [.T8] + 1 -> 32 | V8: of:= [.U8] + 1 -> 33 | W8: of:= [.V8] + 1 -> 34 | X8: of:= [.W8] + 1 -> 35 | Y8: of:= [.X8] + 1 -> 36 | Z8: of:= [.Y8] + 1 -> 37 | AA8: of:= [.Z8] + 1 -> 38 | AB8: of:= [.AA8] + 1 -> 39 | AC8: of:= [.AB8] + 1 -> 40 | AD8: of:= [.AC8] + 1 -> 41 | AE8: of:= [.AD8] + 1 -> 42 | AF8: of:= [.AE8] + 1 -> 43 | AG8: of:= [.AF8] + 1 -> 44 | AH8: of:= [.AG8] + 1 -> 45 | AI8: of:= [.AH8] + 1 -> 46 | AJ8: of:= [.AI8] + 1 -> 47 | AK8: of:= [.AJ8] + 1 -> 48 | AL8: of:= [.AK8] + 1 -> 49 | AM8: of:= [.AL8] + 1 -> 50 | AN8: of:= [.AM8] + 1 -> 51 | AO8: of:= [.AN8] + 1 -> 52 | AP8: of:= [.AO8] + 1 -> 53 | AQ8: of:= [.AP8] + 1 -> 54 | AR8: of:= [.AQ8] + 1 -> 55 | AS8: of:= [.AR8] + 1 -> 56 | AT8: of:= [.AS8] + 1 -> 57 | AU8: of:= [.AT8] + 1 -> 58 | AV8: of:= [.AU8] + 1 -> 59 | AW8: of:= [.AV8] + 1 -> 60 | AX8: of:= [.AW8] + 1 -> 61 | AY8: of:= [.AX8] + 1 -> 62 | AZ8: of:= [.AY8] + 1 -> 63 | BA8: of:= [.AZ8] + 1 -> 64 | BB8: of:= [.BA8] + 1 -> 65 | BC8: of:= [.BB8] + 1 -> 66 | BD8: of:= [.BC8] + 1 -> 67 | BE8: of:= [.BD8] + 1 -> 68 | BF8: of:= [.BE8] + 1 -> 69 | BG8: of:= [.BF8] + 1 -> 70 | BH8: of:= [.BG8] + 1 -> 71 | BI8: of:= [.BH8] + 1 -> 72 | BJ8: of:= [.BI8] + 1 -> 73 | BK8: of:= [.BJ8] + 1 -> 74 | BL8: of:= [.BK8] + 1 -> 75
A9: of:= [.A8] + 1 -> 13 | B9: of:= [.A9] + 1 -> 14 | C9: of:= [.B9] + 1 -> 15 | D9: of:= [.C9] + 1 -> 16 | E9: of:= [.D9] + 1 -> 17 | F9: of:= [.E9] + 1 -> 18 | G9: of:= [.F9] + 1 -> 19 | H9: of:= [.G9] + 1 -> 20 | I9: of:= [.H9] + 1 -> 21 | J9: of:= [.I9] + 1 -> 22 | K9: of:= [.J9] + 1 -> 23 | L9: of:= [.K9] + 1 -> 24 | M9: of:= [.L9] + 1 -> 25 | N9: of:= [.M9] + 1 -> 26 | O9: of:= [.N9] + 1 -> 27 | P9: of:= [.O9] + 1 -> 28 | Q9: of:= [.P9] + 1 -> 29 | R9: of:= [.Q9] + 1 -> 30 | S9: of:= [.R9] + 1 -> 31 | T9: of:= [.S9] + 1 -> 32 | U9: of:= [.T9] + 1 -> 33 | V9: of:= [.U9] + 1 -> 34 | W9: of:= [.V9] + 1 -> 35 | X9: of:= [.W9] + 1 -> 36 | Y9: of:= [.X9] + 1 -> 37 | Z9: of:= [.Y9] + 1 -> 38 | AA9: of:= [.Z9] + 1 -> 39 | AB9: of:= [.AA9] + 1 -> 40 | AC9: of:= [.AB9] + 1 -> 41 | AD9: of:= [.AC9] + 1 -> 42 | AE9: of:= [.AD9] + 1 -> 43 | AF9: of:= [.AE9] + 1 -> 44 | AG9: of:= [.AF9] + 1 -> 45 | AH9: of:= [.AG9] + 1 -> 46 | AI9: of:= [.AH9] + 1 -> 47 | AJ9: of:= [.AI9] + 1 -> 48 | AK9: of:= [.AJ9] + 1 -> 49 | AL9: of:= [.AK9] + 1 -> 50 | AM9: of:= [.AL9] + 1 -> 51 | AN9: of:= [.AM9] + 1 -> 52 | AO9: of:= [.AN9] + 1 -> 53 | AP9: of:= [.AO9] + 1 -> 54 | AQ9: of:= [.AP9] + 1 -> 55 | AR9: of:= [.AQ9] + 1 -> 56 | AS9: of:= [.AR9] + 1 -> 57 | AT9: of:= [.AS9] + 1 -> 58 | AU9: of:= [.AT9] + 1 -> 59 | AV9: of:= [.AU9] + 1 -> 60 | AW9: of:= [.AV9] + 1 -> 61 | AX9: of:= [.AW9] + 1 -> 62 | AY9: of:= [.AX9] + 1 -> 63 | AZ9: of:= [.AY9] + 1 -> 64 | BA9: of:= [.AZ9] + 1 -> 65 | BB9: of:= [.BA9] + 1 -> 66 | BC9: of:= [.BB9] + 1 -> 67 | BD9: of:= [.BC9] + 1 -> 68 | BE9: of:= [.BD9] + 1 -> 69 | BF9: of:= [.BE9] + 1 -> 70 | BG9: of:= [.BF9] + 1 -> 71 | BH9: of:= [.BG9] + 1 -> 72 | BI9: of:= [.BH9] + 1 -> 73 | BJ9: of:= [.BI9] + 1 -> 74 | BK9: of:= [.BJ9] + 1 -> 75 | BL9: of:= [.BK9] + 1 -> 76
A10: of:= [.A9] + 1 -> 14 | B10: of:= [.A10] + 1 -> 15 | C10: of:= [.B10] + 1 -> 16 | D10: of:= [.C10] + 1 -> 17 | E10: of:= [.D10] + 1 -> 18 | F10: of:= [.E10] + 1 -> 19 | G10: of:= [.F10] + 1 -> 20 | H10: of:= [.G10] + 1 -> 21 | I10: of:= [.H10] + 1 -> 22 | J10: of:= [.I10] + 1 -> 23 | K10: of:= [.J10] + 1 -> 24 | L10: of:= [.K10] + 1 -> 25 | M10: of:= [.L10] + 1 -> 26 | N10: of:= [.M10] + 1 -> 27 | O10: of:= [.N10] + 1 -> 28 | P10: of:= [.O10] + 1 -> 29 | Q10: of:= [.P10] + 1 -> 30 | R10: of:= [.Q10] + 1 -> 31 | S10: of:= [.R10] + 1 -> 32 | T10: of:= [.S10] + 1 -> 33 | U10: of:= [.T10] + 1 -> 34 | V10: of:= [.U10] + 1 -> 35 | W10: of:= [.V10] + 1 -> 36 | X10: of:= [.W10] + 1 -> 37 | Y10: of:= [.X10] + 1 -> 38 | Z10: of:= [.Y10] + 1 -> 39 | AA10: of:= [.Z10] + 1 -> 40 | AB10: of:= [.AA10] + 1 -> 41 | AC10: of:= [.AB10] + 1 -> 42 | AD10: of:= [.AC10] + 1 -> 43 | AE10: of:= [.AD10] + 1 -> 44 | AF10: of:= [.AE10] + 1 -> 45 | AG10: of:= [.AF10] + 1 -> 46 | AH10: of:= [.AG10] + 1 -> 47 | AI10: of:= [.AH10] + 1 -> 48 | AJ10: of:= [.AI10] + 1 -> 49 | AK10: of:= [.AJ10] + 1 -> 50 | AL10: of:= [.AK10] + 1 -> 51 | AM10: of:= [.AL10] + 1 -> 52 | AN10: of:= [.AM10] + 1 -> 53 | AO10: of:= [.AN10] + 1 -> 54 | AP10: of:= [.AO10] + 1 -> 55 | AQ10: of:= [.AP10] + 1 -> 56 | AR10: of:= [.AQ10] + 1 -> 57 | AS10: of:= [.AR10] + 1 -> 58 | AT10: of:= [.AS10] + 1 -> 59 | AU10: of:= [.AT10] + 1 -> 60 | AV10: of:= [.AU10] + 1 -> 61 | AW10: of:= [.AV10] + 1 -> 62 | AX10: of:= [.AW10] + 1 -> 63 | AY10: of:= [.AX10] + 1 -> 64 | AZ10: of:= [.AY10] + 1 -> 65 | BA10: of:= [.AZ10] + 1 -> 66 | BB10: of:= [.BA10] + 1 -> 67 | BC10: of:= [.BB10] + 1 -> 68 | BD10: of:= [.BC10] + 1 -> 69 | BE10: of:= [.BD10] + 1 -> 70 | BF10: of:= [.BE10] + 1 -> 71 | BG10: of:= [.BF10] + 1 -> 72 | BH10: of:= [.BG10] + 1 -> 73 | BI10: of:= [.BH10] + 1 -> 74 | BJ10: of:= [.BI10] + 1 -> 75 | BK10: of:= [.BJ10] + 1 -> 76 | BL10: of:= [.BK10] + 1 -> 77
A11: of:= [.A10] + 1 -> 15 | B11: of:= [.A11] + 1 -> 16 | C11: of:= [.B11] + 1 -> 17 | D11: of:= [.C11] + 1 -> 18 | E11: of:= [.D11] + 1 -> 19 | F11: of:= [.E11] + 1 -> 20 | G11: of:= [.F11] + 1 -> 21 | H11: of:= [.G11] + 1 -> 22 | I11: of:= [.H11] + 1 -> 23 | J11: of:= [.I11] + 1 -> 24 | K11: of:= [.J11] + 1 -> 25 | L11: of:= [.K11] + 1 -> 26 | M11: of:= [.L11] + 1 -> 27 | N11: of:= [.M11] + 1 -> 28 | O11: of:= [.N11] + 1 -> 29 | P11: of:= [.O11] + 1 -> 30 | Q11: of:= [.P11] + 1 -> 31 | R11: of:= [.Q11] + 1 -> 32 | S11: of:= [.R11] + 1 -> 33 | T11: of:= [.S11] + 1 -> 34 | U11: of:= [.T11] + 1 -> 35 | V11: of:= [.U11] + 1 -> 36 | W11: of:= [.V11] + 1 -> 37 | X11: of:= [.W11] + 1 -> 38 | Y11: of:= [.X11] + 1 -> 39 | Z11: of:= [.Y11] + 1 -> 40 | AA11: of:= [.Z11] + 1 -> 41 | AB11: of:= [.AA11] + 1 -> 42 | AC11: of:= [.AB11] + 1 -> 43 | AD11: of:= [.AC11] + 1 -> 44 | AE11: of:= [.AD11] + 1 -> 45 | AF11: of:= [.AE11] + 1 -> 46 | AG11: of:= [.AF11] + 1 -> 47 | AH11: of:= [.AG11] + 1 -> 48 | AI11: of:= [.AH11] + 1 -> 49 | AJ11: of:= [.AI11] + 1 -> 50 | AK11: of:= [.AJ11] + 1 -> 51 | AL11: of:= [.AK11] + 1 -> 52 | AM11: of:= [.AL11] + 1 -> 53 | AN11: of:= [.AM11] + 1 -> 54 | AO11: of:= [.AN11] + 1 -> 55 | AP11: of:= [.AO11] + 1 -> 56 | AQ11: of:= [.AP11] + 1 -> 57 | AR11: of:= [.AQ11] + 1 -> 58 | AS11: of:= [.AR11] + 1 -> 59 | AT11: of:= [.AS11] + 1 -> 60 | AU11: of:= [.AT11] + 1 -> 61 | AV11: of:= [.AU11] + 1 -> 62 | AW11: of:= [.AV11] + 1 -> 63 | AX11: of:= [.AW11] + 1 -> 64 | AY11: of:= [.AX11] + 1 -> 65 | AZ11: of:= [.AY11] + 1 -> 66 | BA11: of:= [.AZ11] + 1 -> 67 | BB11: of:= [.BA11] + 1 -> 68 | BC11: of:= [.BB11] + 1 -> 69 | BD11: of:= [.BC11] + 1 -> 70 | BE11: of:= [.BD11] + 1 -> 71 | BF11: of:= [.BE11] + 1 -> 72 | BG11: of:= [.BF11] + 1 -> 73 | BH11: of:= [.BG11] + 1 -> 74 | BI11: of:= [.BH11] + 1 -> 75 | BJ11: of:= [.BI11] + 1 -> 76 | BK11: of:= [.BJ11] + 1 -> 77 | BL11: of:= [.BK11] + 1 -> 78
A12: of:= [.A11] + 1 -> 16 | B12: of:= [.A12] + 1 -> 17 | C12: of:= [.B12] + 1 -> 18 | D12: of:= [.C12] + 1 -> 19 | E12: of:= [.D12] + 1 -> 20 | F12: of:= [.E12] + 1 -> 21 | G12: of:= [.F12] + 1 -> 22 | H12: of:= [.G12] + 1 -> 23 | I12: of:= [.H12] + 1 -> 24 | J12: of:= [.I12] + 1 -> 25 | K12: of:= [.J12] + 1 -> 26 | L12: of:= [.K12] + 1 -> 27 | M12: of:= [.L12] + 1 -> 28 | N12: of:= [.M12] + 1 -> 29 | O12: of:= [.N12] + 1 -> 30 | P12: of:= [.O12] + 1 -> 31 | Q12: of:= [.P12] + 1 -> 32 | R12: of:= [.Q12] + 1 -> 33 | S12: of:= [.R12] + 1 -> 34 | T12: of:= [.S12] + 1 -> 35 | U12: of:= [.T12] + 1 -> 36 | V12: of:= [.U12] + 1 -> 37 | W12: of:= [.V12] + 1 -> 38 | X12: of:= [.W12] + 1 -> 39 | Y12: of:= [.X12] + 1 -> 40 | Z12: of:= [.Y12] + 1 -> 41 | AA12: of:= [.Z12] + 1 -> 42 | AB12: of:= [.AA12] + 1 -> 43 | AC12: of:= [.AB12] + 1 -> 44 | AD12: of:= [.AC12] + 1 -> 45 | AE12: of:= [.AD12] + 1 -> 46 | AF12: of:= [.AE12] + 1 -> 47 | AG12: of:= [.AF12] + 1 -> 48 | AH12: of:= [.AG12] + 1 -> 49 | AI12: of:= [.AH12] + 1 -> 50 | AJ12: of:= [.AI12] + 1 -> 51 | AK12: of:= [.AJ12] + 1 -> 52 | AL12: of:= [.AK12] + 1 -> 53 | AM12: of:= [.AL12] + 1 -> 54 | AN12: of:= [.AM12] + 1 -> 55 | AO12: of:= [.AN12] + 1 -> 56 | AP12: of:= [.AO12] + 1 -> 57 | AQ12: of:= [.AP12] + 1 -> 58 | AR12: of:= [.AQ12] + 1 -> 59 | AS12: of:= [.AR12] + 1 -> 60 | AT12: of:= [.AS12] + 1 -> 61 | AU12: of:= [.AT12] + 1 -> 62 | AV12: of:= [.AU12] + 1 -> 63 | AW12: of:= [.AV12] + 1 -> 64 | AX12: of:= [.AW12] + 1 -> 65 | AY12: of:= [.AX12] + 1 -> 66 | AZ12: of:= [.AY12] + 1 -> 67 | BA12: of:= [.AZ12] + 1 -> 68 | BB12: of:= [.BA12] + 1 -> 69 | BC12: of:= [.BB12] + 1 -> 70 | BD12: of:= [.BC12] + 1 -> 71 | BE12: of:= [.BD12] + 1 -> 72 | BF12: of:= [.BE12] + 1 -> 73 | BG12: of:= [.BF12] + 1 -> 74 | BH12: of:= [.BG12] + 1 -> 75 | BI12: of:= [.BH12] + 1 -> 76 | BJ12: of:= [.BI12] + 1 -> 77 | BK12: of:= [.BJ12] + 1 -> 78 | BL12: of:= [.BK12] + 1 -> 79
A13: of:= [.A12] + 1 -> 17 | B13: of:= [.A13] + 1 -> 18 | C13: of:= [.B13] + 1 -> 19 | D13: of:= [.C13] + 1 -> 20 | E13: of:= [.D13] + 1 -> 21 | F13: of:= [.E13] + 1 -> 22 | G13: of:= [.F13] + 1 -> 23 | H13: of:= [.G13] + 1 -> 24 | I13: of:= [.H13] + 1 -> 25 | J13: of:= [.I13] + 1 -> 26 | K13: of:= [.J13] + 1 -> 27 | L13: of:= [.K13] + 1 -> 28 | M13: of:= [.L13] + 1 -> 29 | N13: of:= [.M13] + 1 -> 30 | O13: of:= [.N13] + 1 -> 31 | P13: of:= [.O13] + 1 -> 32 | Q13: of:= [.P13] + 1 -> 33 | R13: of:= [.Q13] + 1 -> 34 | S13: of:= [.R13] + 1 -> 35 | T13: of:= [.S13] + 1 -> 36 | U13: of:= [.T13] + 1 -> 37 | V13: of:= [.U13] + 1 -> 38 | W13: of:= [.V13] + 1 -> 39 | X13: of:= [.W13] + 1 -> 40 | Y13: of:= [.X13] + 1 -> 41 | Z13: of:= [.Y13] + 1 -> 42 | AA13: of:= [.Z13] + 1 -> 43 | AB13: of:= [.AA13] + 1 -> 44 | AC13: of:= [.AB13] + 1 -> 45 | AD13: of:= [.AC13] + 1 -> 46 | AE13: of:= [.AD13] + 1 -> 47 | AF13: of:= [.AE13] + 1 -> 48 | AG13: of:= [.AF13] + 1 -> 49 | AH13: of:= [.AG13] + 1 -> 50 | AI13: of:= [.AH13] + 1 -> 51 | AJ13: of:= [.AI13] + 1 -> 52 | AK13: of:= [.AJ13] + 1 -> 53 | AL13: of:= [.AK13] + 1 -> 54 | AM13: of:= [.AL13] + 1 -> 55 | AN13: of:= [.AM13] + 1 -> 56 | AO13: of:= [.AN13] + 1 -> 57 | AP13: of:= [.AO13] + 1 -> 58 | AQ13: of:= [.AP13] + 1 -> 59 | AR13: of:= [.AQ13] + 1 -> 60 | AS13: of:= [.AR13] + 1 -> 61 | AT13: of:= [.AS13] + 1 -> 62 | AU13: of:= [.AT13] + 1 -> 63 | AV13: of:= [.AU13] + 1 -> 64 | AW13: of:= [.AV13] + 1 -> 65 | AX13: of:= [.AW13] + 1 -> 66 | AY13: of:= [.AX13] + 1 -> 67 | AZ13: of:= [.AY13] + 1 -> 68 | BA13: of:= [.AZ13] + 1 -> 69 | BB13: of:= [.BA13] + 1 -> 70 | BC13: of:= [.BB13] + 1 -> 71 | BD13: of:= [.BC13] + 1 -> 72 | BE13: of:= [.BD13] + 1 -> 73 | BF13: of:= [.BE13] + 1 -> 74 | BG13: of:= [.BF13] + 1 -> 75 | BH13: of:= [.BG13] + 1 -> 76 | BI13: of:= [.BH13] + 1 -> 77 | BJ13: of:= [.BI13] + 1 -> 78 | BK13: of:= [.BJ13] + 1 -> 79 | BL13: of:= [.BK13] + 1 -> 80
A14: of:= [.A13] + 1 -> 18 | B14: of:= [.A14] + 1 -> 19 | C14: of:= [.B14] + 1 -> 20 | D14: of:= [.C14] + 1 -> 21 | E14: of:= [.D14] + 1 -> 22 | F14: of:= [.E14] + 1 -> 23 | G14: of:= [.F14] + 1 -> 24 | H14: of:= [.G14] + 1 -> 25 | I14: of:= [.H14] + 1 -> 26 | J14: of:= [.I14] + 1 -> 27 | K14: of:= [.J14] + 1 -> 28 | L14: of:= [.K14] + 1 -> 29 | M14: of:= [.L14] + 1 -> 30 | N14: of:= [.M14] + 1 -> 31 | O14: of:= [.N14] + 1 -> 32 | P14: of:= [.O14] + 1 -> 33 | Q14: of:= [.P14] + 1 -> 34 | R14: of:= [.Q14] + 1 -> 35 | S14: of:= [.R14] + 1 -> 36 | T14: of:= [.S14] + 1 -> 37 | U14: of:= [.T14] + 1 -> 38 | V14: of:= [.U14] + 1 -> 39 | W14: of:= [.V14] + 1 -> 40 | X14: of:= [.W14] + 1 -> 41 | Y14: of:= [.X14] + 1 -> 42 | Z14: of:= [.Y14] + 1 -> 43 | AA14: of:= [.Z14] + 1 -> 44 | AB14: of:= [.AA14] + 1 -> 45 | AC14: of:= [.AB14] + 1 -> 46 | AD14: of:= [.AC14] + 1 -> 47 | AE14: of:= [.AD14] + 1 -> 48 | AF14: of:= [.AE14] + 1 -> 49 | AG14: of:= [.AF14] + 1 -> 50 | AH14: of:= [.AG14] + 1 -> 51 | AI14: of:= [.AH14] + 1 -> 52 | AJ14: of:= [.AI14] + 1 -> 53 | AK14: of:= [.AJ14] + 1 -> 54 | AL14: of:= [.AK14] + 1 -> 55 | AM14: of:= [.AL14] + 1 -> 56 | AN14: of:= [.AM14] + 1 -> 57 | AO14: of:= [.AN14] + 1 -> 58 | AP14: of:= [.AO14] + 1 -> 59 | AQ14: of:= [.AP14] + 1 -> 60 | AR14: of:= [.AQ14] + 1 -> 61 | AS14: of:= [.AR14] + 1 -> 62 | AT14: of:= [.AS14] + 1 -> 63 | AU14: of:= [.AT14] + 1 -> 64 | AV14: of:= [.AU14] + 1 -> 65 | AW14: of:= [.AV14] + 1 -> 66 | AX14: of:= [.AW14] + 1 -> 67 | AY14: of:= [.AX14] + 1 -> 68 | AZ14: of:= [.AY14] + 1 -> 69 | BA14: of:= [.AZ14] + 1 -> 70 | BB14: of:= [.BA14] + 1 -> 71 | BC14: of:= [.BB14] + 1 -> 72 | BD14: of:= [.BC14] + 1 -> 73 | BE14: of:= [.BD14] + 1 -> 74 | BF14: of:= [.BE14] + 1 -> 75 | BG14: of:= [.BF14] + 1 -> 76 | BH14: of:= [.BG14] + 1 -> 77 | BI14: of:= [.BH14] + 1 -> 78 | BJ14: of:= [.BI14] + 1 -> 79 | BK14: of:= [.BJ14] + 1 -> 80 | BL14: of:= [.BK14] + 1 -> 81
A15: of:= [.A14] + 1 -> 19 | B15: of:= [.A15] + 1 -> 20 | C15: of:= [.B15] + 1 -> 21 | D15: of:= [.C15] + 1 -> 22 | E15: of:= [.D15] + 1 -> 23 | F15: of:= [.E15] + 1 -> 24 | G15: of:= [.F15] + 1 -> 25 | H15: of:= [.G15] + 1 -> 26 | I15: of:= [.H15] + 1 -> 27 | J15: of:= [.I15] + 1 -> 28 | K15: of:= [.J15] + 1 -> 29 | L15: of:= [.K15] + 1 -> 30 | M15: of:= [.L15] + 1 -> 31 | N15: of:= [.M15] + 1 -> 32 | O15: of:= [.N15] + 1 -> 33 | P15: of:= [.O15] + 1 -> 34 | Q15: of:= [.P15] + 1 -> 35 | R15: of:= [.Q15] + 1 -> 36 | S15: of:= [.R15] + 1 -> 37 | T15: of:= [.S15] + 1 -> 38 | U15: of:= [.T15] + 1 -> 39 | V15: of:= [.U15] + 1 -> 40 | W15: of:= [.V15] + 1 -> 41 | X15: of:= [.W15] + 1 -> 42 | Y15: of:= [.X15] + 1 -> 43 | Z15: of:= [.Y15] + 1 -> 44 | AA15: of:= [.Z15] + 1 -> 45 | AB15: of:= [.AA15] + 1 -> 46 | AC15: of:= [.AB15] + 1 -> 47 | AD15: of:= [.AC15] + 1 -> 48 | AE15: of:= [.AD15] + 1 -> 49 | AF15: of:= [.AE15] + 1 -> 50 | AG15: of:= [.AF15] + 1 -> 51 | AH15: of:= [.AG15] + 1 -> 52 | AI15: of:= [.AH15] + 1 -> 53 | AJ15: of:= [.AI15] + 1 -> 54 | AK15: of:= [.AJ15] + 1 -> 55 | AL15: of:= [.AK15] + 1 -> 56 | AM15: of:= [.AL15] + 1 -> 57 | AN15: of:= [.AM15] + 1 -> 58 | AO15: of:= [.AN15] + 1 -> 59 | AP15: of:= [.AO15] + 1 -> 60 | AQ15: of:= [.AP15] + 1 -> 61 | AR15: of:= [.AQ15] + 1 -> 62 | AS15: of:= [.AR15] + 1 -> 63 | AT15: of:= [.AS15] + 1 -> 64 | AU15: of:= [.AT15] + 1 -> 65 | AV15: of:= [.AU15] + 1 -> 66 | AW15: of:= [.AV15] + 1 -> 67 | AX15: of:= [.AW15] + 1 -> 68 | AY15: of:= [.AX15] + 1 -> 69 | AZ15: of:= [.AY15] + 1 -> 70 | BA15: of:= [.AZ15] + 1 -> 71 | BB15: of:= [.BA15] + 1 -> 72 | BC15: of:= [.BB15] + 1 -> 73 | BD15: of:= [.BC15] + 1 -> 74 | BE15: of:= [.BD15] + 1 -> 75 | BF15: of:= [.BE15] + 1 -> 76 | BG15: of:= [.BF15] + 1 -> 77 | BH15: of:= [.BG15] + 1 -> 78 | BI15: of:= [.BH15] + 1 -> 79 | BJ15: of:= [.BI15] + 1 -> 80 | BK15: of:= [.BJ15] + 1 -> 81 | BL15: of:= [.BK15] + 1 -> 82
A16: of:= [.A15] + 1 -> 20 | B16: of:= [.A16] + 1 -> 21 | C16: of:= [.B16] + 1 -> 22 | D16: of:= [.C16] + 1 -> 23 | E16: of:= [.D16] + 1 -> 24 | F16: of:= [.E16] + 1 -> 25 | G16: of:= [.F16] + 1 -> 26 | H16: of:= [.G16] + 1 -> 27 | I16: of:= [.H16] + 1 -> 28 | J16: of:= [.I16] + 1 -> 29 | K16: of:= [.J16] + 1 -> 30 | L16: of:= [.K16] + 1 -> 31 | M16: of:= [.L16] + 1 -> 32 | N16: of:= [.M16] + 1 -> 33 | O16: of:= [.N16] + 1 -> 34 | P16: of:= [.O16] + 1 -> 35 | Q16: of:= [.P16] + 1 -> 36 | R16: of:= [.Q16] + 1 -> 37 | S16: of:= [.R16] + 1 -> 38 | T16: of:= [.S16] + 1 -> 39 | U16: of:= [.T16] + 1 -> 40 | V16: of:= [.U16] + 1 -> 41 | W16: of:= [.V16] + 1 -> 42 | X16: of:= [.W16] + 1 -> 43 | Y16: of:= [.X16] + 1 -> 44 | Z16: of:= [.Y16] + 1 -> 45 | AA16: of:= [.Z16] + 1 -> 46 | AB16: of:= [.AA16] + 1 -> 47 | AC16: of:= [.AB16] + 1 -> 48 | AD16: of:= [.AC16] + 1 -> 49 | AE16: of:= [.AD16] + 1 -> 50 | AF16: of:= [.AE16] + 1 -> 51 | AG16: of:= [.AF16] + 1 -> 52 | AH16: of:= [.AG16] + 1 -> 53 | AI16: of:= [.AH16] + 1 -> 54 | AJ16: of:= [.AI16] + 1 -> 55 | AK16: of:= [.AJ16] + 1 -> 56 | AL16: of:= [.AK16] + 1 -> 57 | AM16: of:= [.AL16] + 1 -> 58 | AN16: of:= [.AM16] + 1 -> 59 | AO16: of:= [.AN16] + 1 -> 60 | AP16: of:= [.AO16] + 1 -> 61 | AQ16: of:= [.AP16] + 1 -> 62 | AR16: of:= [.AQ16] + 1 -> 63 | AS16: of:= [.AR16] + 1 -> 64 | AT16: of:= [.AS16] + 1 -> 65 | AU16: of:= [.AT16] + 1 -> 66 | AV16: of:= [.AU16] + 1 -> 67 | AW16: of:= [.AV16] + 1 -> 68 | AX16: of:= [.AW16] + 1 -> 69 | AY16: of:= [.AX16] + 1 -> 70 | AZ16: of:= [.AY16] + 1 -> 71 | BA16: of:= [.AZ16] + 1 -> 72 | BB16: of:= [.BA16] + 1 -> 73 | BC16: of:= [.BB16] + 1 -> 74 | BD16: of:= [.BC16] + 1 -> 75 | BE16: of:= [.BD16] + 1 -> 76 | BF16: of:= [.BE16] + 1 -> 77 | BG16: of:= [.BF16] + 1 -> 78 | BH16: of:= [.BG16] + 1 -> 79 | BI16: of:= [.BH16] + 1 -> 80 | BJ16: of:= [.BI16] + 1 -> 81 | BK16: of:= [.BJ16] + 1 -> 82 | BL16: of:= [.BK16] + 1 -> 83
A17: of:= 5 -> 5 | B17: of:= [.A17] + 1 -> 6 | C17: of:= [.B17] + 1 -> 7 | D17: of:= [.C17] + 1 -> 8 | E17: of:= [.D17] + 1 -> 9 | F17: of:= [.E17] + 1 -> 10 | G17: of:= [.F17] + 1 -> 11 | H17: of:= [.G17] + 1 -> 12 | I17: of:= [.H17] + 1 -> 13 | J17: of:= [.I17] + 1 -> 14 | K17: of:= [.J17] + 1 -> 15 | L17: of:= [.K17] + 1 -> 16 | M17: of:= [.L17] + 1 -> 17 | N17: of:= [.M17] + 1 -> 18 | O17: of:= [.N17] + 1 -> 19 | P17: of:= [.O17] + 1 -> 20 | Q17: of:= [.P17] + 1 -> 21 | R17: of:= [.Q17] + 1 -> 22 | S17: of:= [.R17] + 1 -> 23 | T17: of:= [.S17] + 1 -> 24 | U17: of:= [.T17] + 1 -> 25 | V17: of:= [.U17] + 1 -> 26 | W17: of:= [.V17] + 1 -> 27 | X17: of:= [.W17] + 1 -> 28 | Y17: of:= [.X17] + 1 -> 29 | Z17: of:= [.Y17] + 1 -> 30 | AA17: of:= [.Z17] + 1 -> 31 | AB17: of:= [.AA17] + 1 -> 32 | AC17: of:= [.AB17] + 1 -> 33 | AD17: of:= [.AC17] + 1 -> 34 | AE17: of:= [.AD17] + 1 -> 35 | AF17: of:= [.AE17] + 1 -> 36 | AG17: of:= [.AF17] + 1 -> 37 | AH17: of:= [.AG17] + 1 -> 38 | AI17: of:= [.AH17] + 1 -> 39 | AJ17: of:= [.AI17] + 1 -> 40 | AK17: of:= [.AJ17] + 1 -> 41 | AL17: of:= [.AK17] + 1 -> 42 | AM17: of:= [.AL17] + 1 -> 43 | AN17: of:= [.AM17] + 1 -> 44 | AO17: of:= [.AN17] + 1 -> 45 | AP17: of:= [.AO17] + 1 -> 46 | AQ17: of:= [.AP17] + 1 -> 47 | AR17: of:= [.AQ17] + 1 -> 48 | AS17: of:= [.AR17] + 1 -> 49 | AT17: of:= [.AS17] + 1 -> 50 | AU17: of:= [.AT17] + 1 -> 51 | AV17: of:= [.AU17] + 1 -> 52 | AW17: of:= [.AV17] + 1 -> 53 | AX17: of:= [.AW17] + 1 -> 54 | AY17: of:= [.AX17] + 1 -> 55 | AZ17: of:= [.AY17] + 1 -> 56 | BA17: of:= [.AZ17] + 1 -> 57 | BB17: of:= [.BA17] + 1 -> 58 | BC17: of:= [.BB17] + 1 -> 59 | BD17: of:= [.BC17] + 1 -> 60 | BE17: of:= [.BD17] + 1 -> 61 | BF17: of:= [.BE17] + 1 -> 62 | BG17: of:= [.BF17] + 1 -> 63 | BH17: of:= [.BG17] + 1 -> 64 | BI17: of:= [.BH17] + 1 -> 65 | BJ17: of:= [.BI17] + 1 -> 66 | BK17: of:= [.BJ17] + 1 -> 67 | BL17: of:= [.BK17] + 1 -> 68
A18: of:= [.A17] + 1 -> 6 | B18: of:= [.A18] + 1 -> 7 | C18: of:= [.B18] + 1 -> 8 | D18: of:= [.C18] + 1 -> 9 | E18: of:= [.D18] + 1 -> 10 | F18: of:= [.E18] + 1 -> 11 | G18: of:= [.F18] + 1 -> 12 | H18: of:= [.G18] + 1 -> 13 | I18: of:= [.H18] + 1 -> 14 | J18: of:= [.I18] + 1 -> 15 | K18: of:= [.J18] + 1 -> 16 | L18: of:= [.K18] + 1 -> 17 | M18: of:= [.L18] + 1 -> 18 | N18: of:= [.M18] + 1 -> 19 | O18: of:= [.N18] + 1 -> 20 | P18: of:= [.O18] + 1 -> 21 | Q18: of:= [.P18] + 1 -> 22 | R18: of:= [.Q18] + 1 -> 23 | S18: of:= [.R18] + 1 -> 24 | T18: of:= [.S18] + 1 -> 25 | U18: of:= [.T18] + 1 -> 26 | V18: of:= [.U18] + 1 -> 27 | W18: of:= [.V18] + 1 -> 28 | X18: of:= [.W18] + 1 -> 29 | Y18: of:= [.X18] + 1 -> 30 | Z18: of:= [.Y18] + 1 -> 31 | AA18: of:= [.Z18] + 1 -> 32 | AB18: of:= [.AA18] + 1 -> 33 | AC18: of:= [.AB18] + 1 -> 34 | AD18: of:= [.AC18] + 1 -> 35 | AE18: of:= [.AD18] + 1 -> 36 | AF18: of:= [.AE18] + 1 -> 37 | AG18: of:= [.AF18] + 1 -> 38 | AH18: of:= [.AG18] + 1 -> 39 | AI18: of:= [.AH18] + 1 -> 40 | AJ18: of:= [.AI18] + 1 -> 41 | AK18: of:= [.AJ18] + 1 -> 42 | AL18: of:= [.AK18] + 1 -> 43 | AM18: of:= [.AL18] + 1 -> 44 | AN18: of:= [.AM18] + 1 -> 45 | AO18: of:= [.AN18] + 1 -> 46 | AP18: of:= [.AO18] + 1 -> 47 | AQ18: of:= [.AP18] + 1 -> 48 | AR18: of:= [.AQ18] + 1 -> 49 | AS18: of:= [.AR18] + 1 -> 50 | AT18: of:= [.AS18] + 1 -> 51 | AU18: of:= [.AT18] + 1 -> 52 | AV18: of:= [.AU18] + 1 -> 53 | AW18: of:= [.AV18] + 1 -> 54 | AX18: of:= [.AW18] + 1 -> 55 | AY18: of:= [.AX18] + 1 -> 56 | AZ18: of:= [.AY18] + 1 -> 57 | BA18: of:= [.AZ18] + 1 -> 58 | BB18: of:= [.BA18] + 1 -> 59 | BC18: of:= [.BB18] + 1 -> 60 | BD18: of:= [.BC18] + 1 -> 61 | BE18: of:= [.BD18] + 1 -> 62 | BF18: of:= [.BE18] + 1 -> 63 | BG18: of:= [.BF18] + 1 -> 64 | BH18: of:= [.BG18] + 1 -> 65 | BI18: of:= [.BH18] + 1 -> 66 | BJ18: of:= [.BI18] + 1 -> 67 | BK18: of:= [.BJ18] + 1 -> 68 | BL18: of:= [.BK18] + 1 -> 69
A19: of:= [.A18] + 1 -> 7 | B19: of:= [.A19] + 1 -> 8 | C19: of:= [.B19] + 1 -> 9 | D19: of:= [.C19] + 1 -> 10 | E19: of:= [.D19] + 1 -> 11 | F19: of:= [.E19] + 1 -> 12 | G19: of:= [.F19] + 1 -> 13 | H19: of:= [.G19] + 1 -> 14 | I19: of:= [.H19] + 1 -> 15 | J19: of:= [.I19] + 1 -> 16 | K19: of:= [.J19] + 1 -> 17 | L19: of:= [.K19] + 1 -> 18 | M19: of:= [.L19] + 1 -> 19 | N19: of:= [.M19] + 1 -> 20 | O19: of:= [.N19] + 1 -> 21 | P19: of:= [.O19] + 1 -> 22 | Q19: of:= [.P19] + 1 -> 23 | R19: of:= [.Q19] + 1 -> 24 | S19: of:= [.R19] + 1 -> 25 | T19: of:= [.S19] + 1 -> 26 | U19: of:= [.T19] + 1 -> 27 | V19: of:= [.U19] + 1 -> 28 | W19: of:= [.V19] + 1 -> 29 | X19: of:= [.W19] + 1 -> 30 | Y19: of:= [.X19] + 1 -> 31 | Z19: of:= [.Y19] + 1 -> 32 | AA19: of:= [.Z19] + 1 -> 33 | AB19: of:= [.AA19] + 1 -> 34 | AC19: of:= [.AB19] + 1 -> 35 | AD19: of:= [.AC19] + 1 -> 36 | AE19: of:= [.AD19] + 1 -> 37 | AF19: of:= [.AE19] + 1 -> 38 | AG19: of:= [.AF19] + 1 -> 39 | AH19: of:= [.AG19] + 1 -> 40 | AI19: of:= [.AH19] + 1 -> 41 | AJ19: of:= [.AI19] + 1 -> 42 | AK19: of:= [.AJ19] + 1 -> 43 | AL19: of:= [.AK19] + 1 -> 44 | AM19: of:= [.AL19] + 1 -> 45 | AN19: of:= [.AM19] + 1 -> 46 | AO19: of:= [.AN19] + 1 -> 47 | AP19: of:= [.AO19] + 1 -> 48 | AQ19: of:= [.AP19] + 1 -> 49 | AR19: of:= [.AQ19] + 1 -> 50 | AS19: of:= [.AR19] + 1 -> 51 | AT19: of:= [.AS19] + 1 -> 52 | AU19: of:= [.AT19] + 1 -> 53 | AV19: of:= [.AU19] + 1 -> 54 | AW19: of:= [.AV19] + 1 -> 55 | AX19: of:= [.AW19] + 1 -> 56 | AY19: of:= [.AX19] + 1 -> 57 | AZ19: of:= [.AY19] + 1 -> 58 | BA19: of:= [.AZ19] + 1 -> 59 | BB19: of:= [.BA19] + 1 -> 60 | BC19: of:= [.BB19] + 1 -> 61 | BD19: of:= [.BC19] + 1 -> 62 | BE19: of:= [.BD19] + 1 -> 63 | BF19: of:= [.BE19] + 1 -> 64 | BG19: of:= [.BF19] + 1 -> 65 | BH19: of:= [.BG19] + 1 -> 66 | BI19: of:= [.BH19] + 1 -> 67 | BJ19: of:= [.BI19] + 1 -> 68 | BK19: of:= [.BJ19] + 1 -> 69 | BL19: of:= [.BK19] + 1 -> 70
A20: of:= [.A19] + 1 -> 8 | B20: of:= [.A20] + 1 -> 9 | C20: of:= [.B20] + 1 -> 10 | D20: of:= [.C20] + 1 -> 11 | E20: of:= [.D20] + 1 -> 12 | F20: of:= [.E20] + 1 -> 13 | G20: of:= [.F20] + 1 -> 14 | H20: of:= [.G20] + 1 -> 15 | I20: of:= [.H20] + 1 -> 16 | J20: of:= [.I20] + 1 -> 17 | K20: of:= [.J20] + 1 -> 18 | L20: of:= [.K20] + 1 -> 19 | M20: of:= [.L20] + 1 -> 20 | N20: of:= [.M20] + 1 -> 21 | O20: of:= [.N20] + 1 -> 22 | P20: of:= [.O20] + 1 -> 23 | Q20: of:= [.P20] + 1 -> 24 | R20: of:= [.Q20] + 1 -> 25 | S20: of:= [.R20] + 1 -> 26 | T20: of:= [.S20] + 1 -> 27 | U20: of:= [.T20] + 1 -> 28 | V20: of:= [.U20] + 1 -> 29 | W20: of:= [.V20] + 1 -> 30 | X20: of:= [.W20] + 1 -> 31 | Y20: of:= [.X20] + 1 -> 32 | Z20: of:= [.Y20] + 1 -> 33 | AA20: of:= [.Z20] + 1 -> 34 | AB20: of:= [.AA20] + 1 -> 35 | AC20: of:= [.AB20] + 1 -> 36 | AD20: of:= [.AC20] + 1 -> 37 | AE20: of:= [.AD20] + 1 -> 38 | AF20: of:= [.AE20] + 1 -> 39 | AG20: of:= [.AF20] + 1 -> 40 | AH20: of:= [.AG20] + 1 -> 41 | AI20: of:= [.AH20] + 1 -> 42 | AJ20: of:= [.AI20] + 1 -> 43 | AK20: of:= [.AJ20] + 1 -> 44 | AL20: of:= [.AK20] + 1 -> 45 | AM20: of:= [.AL20] + 1 -> 46 | AN20: of:= [.AM20] + 1 -> 47 | AO20: of:= [.AN20] + 1 -> 48 | AP20: of:= [.AO20] + 1 -> 49 | AQ20: of:= [.AP20] + 1 -> 50 | AR20: of:= [.AQ20] + 1 -> 51 | AS20: of:= [.AR20] + 1 -> 52 | AT20: of:= [.AS20] + 1 -> 53 | AU20: of:= [.AT20] + 1 -> 54 | AV20: of:= [.AU20] + 1 -> 55 | AW20: of:= [.AV20] + 1 -> 56 | AX20: of:= [.AW20] + 1 -> 57 | AY20: of:= [.AX20] + 1 -> 58 | AZ20: of:= [.AY20] + 1 -> 59 | BA20: of:= [.AZ20] + 1 -> 60 | BB20: of:= [.BA20] + 1 -> 61 | BC20: of:= [.BB20] + 1 -> 62 | BD20: of:= [.BC20] + 1 -> 63 | BE20: of:= [.BD20] + 1 -> 64 | BF20: of:= [.BE20] + 1 -> 65 | BG20: of:= [.BF20] + 1 -> 66 | BH20: of:= [.BG20] + 1 -> 67 | BI20: of:= [.BH20] + 1 -> 68 | BJ20: of:= [.BI20] + 1 -> 69 | BK20: of:= [.BJ20] + 1 -> 70 | BL20: of:= [.BK20] + 1 -> 71
A21: of:= [.A20] + 1 -> 9 | B21: of:= [.A21] + 1 -> 10 | C21: of:= [.B21] + 1 -> 11 | D21: of:= [.C21] + 1 -> 12 | E21: of:= [.D21] + 1 -> 13 | F21: of:= [.E21] + 1 -> 14 | G21: of:= [.F21] + 1 -> 15 | H21: of:= [.G21] + 1 -> 16 | I21: of:= [.H21] + 1 -> 17 | J21: of:= [.I21] + 1 -> 18 | K21: of:= [.J21] + 1 -> 19 | L21: of:= [.K21] + 1 -> 20 | M21: of:= [.L21] + 1 -> 21 | N21: of:= [.M21] + 1 -> 22 | O21: of:= [.N21] + 1 -> 23 | P21: of:= [.O21] + 1 -> 24 | Q21: of:= [.P21] + 1 -> 25 | R21: of:= [.Q21] + 1 -> 26 | S21: of:= [.R21] + 1 -> 27 | T21: of:= [.S21] + 1 -> 28 | U21: of:= [.T21] + 1 -> 29 | V21: of:= [.U21] + 1 -> 30 | W21: of:= [.V21] + 1 -> 31 | X21: of:= [.W21] + 1 -> 32 | Y21: of:= [.X21] + 1 -> 33 | Z21: of:= [.Y21] + 1 -> 34 | AA21: of:= [.Z21] + 1 -> 35 | AB21: of:= [.AA21] + 1 -> 36 | AC21: of:= [.AB21] + 1 -> 37 | AD21: of:= [.AC21] + 1 -> 38 | AE21: of:= [.AD21] + 1 -> 39 | AF21: of:= [.AE21] + 1 -> 40 | AG21: of:= [.AF21] + 1 -> 41 | AH21: of:= [.AG21] + 1 -> 42 | AI21: of:= [.AH21] + 1 -> 43 | AJ21: of:= [.AI21] + 1 -> 44 | AK21: of:= [.AJ21] + 1 -> 45 | AL21: of:= [.AK21] + 1 -> 46 | AM21: of:= [.AL21] + 1 -> 47 | AN21: of:= [.AM21] + 1 -> 48 | AO21: of:= [.AN21] + 1 -> 49 | AP21: of:= [.AO21] + 1 -> 50 | AQ21: of:= [.AP21] + 1 -> 51 | AR21: of:= [.AQ21] + 1 -> 52 | AS21: of:= [.AR21] + 1 -> 53 | AT21: of:= [.AS21] + 1 -> 54 | AU21: of:= [.AT21] + 1 -> 55 | AV21: of:= [.AU21] + 1 -> 56 | AW21: of:= [.AV21] + 1 -> 57 | AX21: of:= [.AW21] + 1 -> 58 | AY21: of:= [.AX21] + 1 -> 59 | AZ21: of:= [.AY21] + 1 -> 60 | BA21: of:= [.AZ21] + 1 -> 61 | BB21: of:= [.BA21] + 1 -> 62 | BC21: of:= [.BB21] + 1 -> 63 | BD21: of:= [.BC21] + 1 -> 64 | BE21: of:= [.BD21] + 1 -> 65 | BF21: of:= [.BE21] + 1 -> 66 | BG21: of:= [.BF21] + 1 -> 67 | BH21: of:= [.BG21] + 1 -> 68 | BI21: of:= [.BH21] + 1 -> 69 | BJ21: of:= [.BI21] + 1 -> 70 | BK21: of:= [.BJ21] + 1 -> 71 | BL21: of:= [.BK21] + 1 -> 72
A22: of:= [.A21] + 1 -> 10 | B22: of:= [.A22] + 1 -> 11 | C22: of:= [.B22] + 1 -> 12 | D22: of:= [.C22] + 1 -> 13 | E22: of:= [.D22] + 1 -> 14 | F22: of:= [.E22] + 1 -> 15 | G22: of:= [.F22] + 1 -> 16 | H22: of:= [.G22] + 1 -> 17 | I22: of:= [.H22] + 1 -> 18 | J22: of:= [.I22] + 1 -> 19 | K22: of:= [.J22] + 1 -> 20 | L22: of:= [.K22] + 1 -> 21 | M22: of:= [.L22] + 1 -> 22 | N22: of:= [.M22] + 1 -> 23 | O22: of:= [.N22] + 1 -> 24 | P22: of:= [.O22] + 1 -> 25 | Q22: of:= [.P22] + 1 -> 26 | R22: of:= [.Q22] + 1 -> 27 | S22: of:= [.R22] + 1 -> 28 | T22: of:= [.S22] + 1 -> 29 | U22: of:= [.T22] + 1 -> 30 | V22: of:= [.U22] + 1 -> 31 | W22: of:= [.V22] + 1 -> 32 | X22: of:= [.W22] + 1 -> 33 | Y22: of:= [.X22] + 1 -> 34 | Z22: of:= [.Y22] + 1 -> 35 | AA22: of:= [.Z22] + 1 -> 36 | AB22: of:= [.AA22] + 1 -> 37 | AC22: of:= [.AB22] + 1 -> 38 | AD22: of:= [.AC22] + 1 -> 39 | AE22: of:= [.AD22] + 1 -> 40 | AF22: of:= [.AE22] + 1 -> 41 | AG22: of:= [.AF22] + 1 -> 42 | AH22: of:= [.AG22] + 1 -> 43 | AI22: of:= [.AH22] + 1 -> 44 | AJ22: of:= [.AI22] + 1 -> 45 | AK22: of:= [.AJ22] + 1 -> 46 | AL22: of:= [.AK22] + 1 -> 47 | AM22: of:= [.AL22] + 1 -> 48 | AN22: of:= [.AM22] + 1 -> 49 | AO22: of:= [.AN22] + 1 -> 50 | AP22: of:= [.AO22] + 1 -> 51 | AQ22: of:= [.AP22] + 1 -> 52 | AR22: of:= [.AQ22] + 1 -> 53 | AS22: of:= [.AR22] + 1 -> 54 | AT22: of:= [.AS22] + 1 -> 55 | AU22: of:= [.AT22] + 1 -> 56 | AV22: of:= [.AU22] + 1 -> 57 | AW22: of:= [.AV22] + 1 -> 58 | AX22: of:= [.AW22] + 1 -> 59 | AY22: of:= [.AX22] + 1 -> 60 | AZ22: of:= [.AY22] + 1 -> 61 | BA22: of:= [.AZ22] + 1 -> 62 | BB22: of:= [.BA22] + 1 -> 63 | BC22: of:= [.BB22] + 1 -> 64 | BD22: of:= [.BC22] + 1 -> 65 | BE22: of:= [.BD22] + 1 -> 66 | BF22: of:= [.BE22] + 1 -> 67 | BG22: of:= [.BF22] + 1 -> 68 | BH22: of:= [.BG22] + 1 -> 69 | BI22: of:= [.BH22] + 1 -> 70 | BJ22: of:= [.BI22] + 1 -> 71 | BK22: of:= [.BJ22] + 1 -> 72 | BL22: of:= [.BK22] + 1 -> 73
A23: of:= [.A22] + 1 -> 11 | B23: of:= [.A23] + 1 -> 12 | C23: of:= [.B23] + 1 -> 13 | D23: of:= [.C23] + 1 -> 14 | E23: of:= [.D23] + 1 -> 15 | F23: of:= [.E23] + 1 -> 16 | G23: of:= [.F23] + 1 -> 17 | H23: of:= [.G23] + 1 -> 18 | I23: of:= [.H23] + 1 -> 19 | J23: of:= [.I23] + 1 -> 20 | K23: of:= [.J23] + 1 -> 21 | L23: of:= [.K23] + 1 -> 22 | M23: of:= [.L23] + 1 -> 23 | N23: of:= [.M23] + 1 -> 24 | O23: of:= [.N23] + 1 -> 25 | P23: of:= [.O23] + 1 -> 26 | Q23: of:= [.P23] + 1 -> 27 | R23: of:= [.Q23] + 1 -> 28 | S23: of:= [.R23] + 1 -> 29 | T23: of:= [.S23] + 1 -> 30 | U23: of:= [.T23] + 1 -> 31 | V23: of:= [.U23] + 1 -> 32 | W23: of:= [.V23] + 1 -> 33 | X23: of:= [.W23] + 1 -> 34 | Y23: of:= [.X23] + 1 -> 35 | Z23: of:= [.Y23] + 1 -> 36 | AA23: of:= [.Z23] + 1 -> 37 | AB23: of:= [.AA23] + 1 -> 38 | AC23: of:= [.AB23] + 1 -> 39 | AD23: of:= [.AC23] + 1 -> 40 | AE23: of:= [.AD23] + 1 -> 41 | AF23: of:= [.AE23] + 1 -> 42 | AG23: of:= [.AF23] + 1 -> 43 | AH23: of:= [.AG23] + 1 -> 44 | AI23: of:= [.AH23] + 1 -> 45 | AJ23: of:= [.AI23] + 1 -> 46 | AK23: of:= [.AJ23] + 1 -> 47 | AL23: of:= [.AK23] + 1 -> 48 | AM23: of:= [.AL23] + 1 -> 49 | AN23: of:= [.AM23] + 1 -> 50 | AO23: of:= [.AN23] + 1 -> 51 | AP23: of:= [.AO23] + 1 -> 52 | AQ23: of:= [.AP23] + 1 -> 53 | AR23: of:= [.AQ23] + 1 -> 54 | AS23: of:= [.AR23] + 1 -> 55 | AT23: of:= [.AS23] + 1 -> 56 | AU23: of:= [.AT23] + 1 -> 57 | AV23: of:= [.AU23] + 1 -> 58 | AW23: of:= [.AV23] + 1 -> 59 | AX23: of:= [.AW23] + 1 -> 60 | AY23: of:= [.AX23] + 1 -> 61 | AZ23: of:= [.AY23] + 1 -> 62 | BA23: of:= [.AZ23] + 1 -> 63 | BB23: of:= [.BA23] + 1 -> 64 | BC23: of:= [.BB23] + 1 -> 65 | BD23: of:= [.BC23] + 1 -> 66 | BE23: of:= [.BD23] + 1 -> 67 | BF23: of:= [.BE23] + 1 -> 68 | BG23: of:= [.BF23] + 1 -> 69 | BH23: of:= [.BG23] + 1 -> 70 | BI23: of:= [.BH23] + 1 -> 71 | BJ23: of:= [.BI23] + 1 -> 72 | BK23: of:= [.BJ23] + 1 -> 73 | BL23: of:= [.BK23] + 1 -> 74
A24: of:= [.A23] + 1 -> 12 | B24: of:= [.A24] + 1 -> 13 | C24: of:= [.B24] + 1 -> 14 | D24: of:= [.C24] + 1 -> 15 | E24: of:= [.D24] + 1 -> 16 | F24: of:= [.E24] + 1 -> 17 | G24: of:= [.F24] + 1 -> 18 | H24: of:= [.G24] + 1 -> 19 | I24: of:= [.H24] + 1 -> 20 | J24: of:= [.I24] + 1 -> 21 | K24: of:= [.J24] + 1 -> 22 | L24: of:= [.K24] + 1 -> 23 | M24: of:= [.L24] + 1 -> 24 | N24: of:= [.M24] + 1 -> 25 | O24: of:= [.N24] + 1 -> 26 | P24: of:= [.O24] + 1 -> 27 | Q24: of:= [.P24] + 1 -> 28 | R24: of:= [.Q24] + 1 -> 29 | S24: of:= [.R24] + 1 -> 30 | T24: of:= [.S24] + 1 -> 31 | U24: of:= [.T24] + 1 -> 32 | V24: of:= [.U24] + 1 -> 33 | W24: of:= [.V24] + 1 -> 34 | X24: of:= [.W24] + 1 -> 35 | Y24: of:= [.X24] + 1 -> 36 | Z24: of:= [.Y24] + 1 -> 37 | AA24: of:= [.Z24] + 1 -> 38 | AB24: of:= [.AA24] + 1 -> 39 | AC24: of:= [.AB24] + 1 -> 40 | AD24: of:= [.AC24] + 1 -> 41 | AE24: of:= [.AD24] + 1 -> 42 | AF24: of:= [.AE24] + 1 -> 43 | AG24: of:= [.AF24] + 1 -> 44 | AH24: of:= [.AG24] + 1 -> 45 | AI24: of:= [.AH24] + 1 -> 46 | AJ24: of:= [.AI24] + 1 -> 47 | AK24: of:= [.AJ24] + 1 -> 48 | AL24: of:= [.AK24] + 1 -> 49 | AM24: of:= [.AL24] + 1 -> 50 | AN24: of:= [.AM24] + 1 -> 51 | AO24: of:= [.AN24] + 1 -> 52 | AP24: of:= [.AO24] + 1 -> 53 | AQ24: of:= [.AP24] + 1 -> 54 | AR24: of:= [.AQ24] + 1 -> 55 | AS24: of:= [.AR24] + 1 -> 56 | AT24: of:= [.AS24] + 1 -> 57 | AU24: of:= [.AT24] + 1 -> 58 | AV24: of:= [.AU24] + 1 -> 59 | AW24: of:= [.AV24] + 1 -> 60 | AX24: of:= [.AW24] + 1 -> 61 | AY24: of:= [.AX24] + 1 -> 62 | AZ24: of:= [.AY24] + 1 -> 63 | BA24: of:= [.AZ24] + 1 -> 64 | BB24: of:= [.BA24] + 1 -> 65 | BC24: of:= [.BB24] + 1 -> 66 | BD24: of:= [.BC24] + 1 -> 67 | BE24: of:= [.BD24] + 1 -> 68 | BF24: of:= [.BE24] + 1 -> 69 | BG24: of:= [.BF24] + 1 -> 70 | BH24: of:= [.BG24] + 1 -> 71 | BI24: of:= [.BH24] + 1 -> 72 | BJ24: of:= [.BI24] + 1 -> 73 | BK24: of:= [.BJ24] + 1 -> 74 | BL24: of:= [.BK24] + 1 -> 75
A25: of:= [.A24] + 1 -> 13 | B25: of:= [.A25] + 1 -> 14 | C25: of:= [.B25] + 1 -> 15 | D25: of:= [.C25] + 1 -> 16 | E25: of:= [.D25] + 1 -> 17 | F25: of:= [.E25] + 1 -> 18 | G25: of:= [.F25] + 1 -> 19 | H25: of:= [.G25] + 1 -> 20 | I25: of:= [.H25] + 1 -> 21 | J25: of:= [.I25] + 1 -> 22 | K25: of:= [.J25] + 1 -> 23 | L25: of:= [.K25] + 1 -> 24 | M25: of:= [.L25] + 1 -> 25 | N25: of:= [.M25] + 1 -> 26 | O25: of:= [.N25] + 1 -> 27 | P25: of:= [.O25] + 1 -> 28 | Q25: of:= [.P25] + 1 -> 29 | R25: of:= [.Q25] + 1 -> 30 | S25: of:= [.R25] + 1 -> 31 | T25: of:= [.S25] + 1 -> 32 | U25: of:= [.T25] + 1 -> 33 | V25: of:= [.U25] + 1 -> 34 | W25: of:= [.V25] + 1 -> 35 | X25: of:= [.W25] + 1 -> 36 | Y25: of:= [.X25] + 1 -> 37 | Z25: of:= [.Y25] + 1 -> 38 | AA25: of:= [.Z25] + 1 -> 39 | AB25: of:= [.AA25] + 1 -> 40 | AC25: of:= [.AB25] + 1 -> 41 | AD25: of:= [.AC25] + 1 -> 42 | AE25: of:= [.AD25] + 1 -> 43 | AF25: of:= [.AE25] + 1 -> 44 | AG25: of:= [.AF25] + 1 -> 45 | AH25: of:= [.AG25] + 1 -> 46 | AI25: of:= [.AH25] + 1 -> 47 | AJ25: of:= [.AI25] + 1 -> 48 | AK25: of:= [.AJ25] + 1 -> 49 | AL25: of:= [.AK25] + 1 -> 50 | AM25: of:= [.AL25] + 1 -> 51 | AN25: of:= [.AM25] + 1 -> 52 | AO25: of:= [.AN25] + 1 -> 53 | AP25: of:= [.AO25] + 1 -> 54 | AQ25: of:= [.AP25] + 1 -> 55 | AR25: of:= [.AQ25] + 1 -> 56 | AS25: of:= [.AR25] + 1 -> 57 | AT25: of:= [.AS25] + 1 -> 58 | AU25: of:= [.AT25] + 1 -> 59 | AV25: of:= [.AU25] + 1 -> 60 | AW25: of:= [.AV25] + 1 -> 61 | AX25: of:= [.AW25] + 1 -> 62 | AY25: of:= [.AX25] + 1 -> 63 | AZ25: of:= [.AY25] + 1 -> 64 | BA25: of:= [.AZ25] + 1 -> 65 | BB25: of:= [.BA25] + 1 -> 66 | BC25: of:= [.BB25] + 1 -> 67 | BD25: of:= [.BC25] + 1 -> 68 | BE25: of:= [.BD25] + 1 -> 69 | BF25: of:= [.BE25] + 1 -> 70 | BG25: of:= [.BF25] + 1 -> 71 | BH25: of:= [.BG25] + 1 -> 72 | BI25: of:= [.BH25] + 1 -> 73 | BJ25: of:= [.BI25] + 1 -> 74 | BK25: of:= [.BJ25] + 1 -> 75 | BL25: of:= [.BK25] + 1 -> 76
A26: of:= [.A25] + 1 -> 14 | B26: of:= [.A26] + 1 -> 15 | C26: of:= [.B26] + 1 -> 16 | D26: of:= [.C26] + 1 -> 17 | E26: of:= [.D26] + 1 -> 18 | F26: of:= [.E26] + 1 -> 19 | G26: of:= [.F26] + 1 -> 20 | H26: of:= [.G26] + 1 -> 21 | I26: of:= [.H26] + 1 -> 22 | J26: of:= [.I26] + 1 -> 23 | K26: of:= [.J26] + 1 -> 24 | L26: of:= [.K26] + 1 -> 25 | M26: of:= [.L26] + 1 -> 26 | N26: of:= [.M26] + 1 -> 27 | O26: of:= [.N26] + 1 -> 28 | P26: of:= [.O26] + 1 -> 29 | Q26: of:= [.P26] + 1 -> 30 | R26: of:= [.Q26] + 1 -> 31 | S26: of:= [.R26] + 1 -> 32 | T26: of:= [.S26] + 1 -> 33 | U26: of:= [.T26] + 1 -> 34 | V26: of:= [.U26] + 1 -> 35 | W26: of:= [.V26] + 1 -> 36 | X26: of:= [.W26] + 1 -> 37 | Y26: of:= [.X26] + 1 -> 38 | Z26: of:= [.Y26] + 1 -> 39 | AA26: of:= [.Z26] + 1 -> 40 | AB26: of:= [.AA26] + 1 -> 41 | AC26: of:= [.AB26] + 1 -> 42 | AD26: of:= [.AC26] + 1 -> 43 | AE26: of:= [.AD26] + 1 -> 44 | AF26: of:= [.AE26] + 1 -> 45 | AG26: of:= [.AF26] + 1 -> 46 | AH26: of:= [.AG26] + 1 -> 47 | AI26: of:= [.AH26] + 1 -> 48 | AJ26: of:= [.AI26] + 1 -> 49 | AK26: of:= [.AJ26] + 1 -> 50 | AL26: of:= [.AK26] + 1 -> 51 | AM26: of:= [.AL26] + 1 -> 52 | AN26: of:= [.AM26] + 1 -> 53 | AO26: of:= [.AN26] + 1 -> 54 | AP26: of:= [.AO26] + 1 -> 55 | AQ26: of:= [.AP26] + 1 -> 56 | AR26: of:= [.AQ26] + 1 -> 57 | AS26: of:= [.AR26] + 1 -> 58 | AT26: of:= [.AS26] + 1 -> 59 | AU26: of:= [.AT26] + 1 -> 60 | AV26: of:= [.AU26] + 1 -> 61 | AW26: of:= [.AV26] + 1 -> 62 | AX26: of:= [.AW26] + 1 -> 63 | AY26: of:= [.AX26] + 1 -> 64 | AZ26: of:= [.AY26] + 1 -> 65 | BA26: of:= [.AZ26] + 1 -> 66 | BB26: of:= [.BA26] + 1 -> 67 | BC26: of:= [.BB26] + 1 -> 68 | BD26: of:= [.BC26] + 1 -> 69 | BE26: of:= [.BD26] + 1 -> 70 | BF26: of:= [.BE26] + 1 -> 71 | BG26: of:= [.BF26] + 1 -> 72 | BH26: of:= [.BG26] + 1 -> 73 | BI26: of:= [.BH26] + 1 -> 74 | BJ26: of:= [.BI26] + 1 -> 75 | BK26: of:= [.BJ26] + 1 -> 76 | BL26: of:= [.BK26] + 1 -> 77
A27: of:= [.A26] + 1 -> 15 | B27: of:= [.A27] + 1 -> 16 | C27: of:= [.B27] + 1 -> 17 | D27: of:= [.C27] + 1 -> 18 | E27: of:= [.D27] + 1 -> 19 | F27: of:= [.E27] + 1 -> 20 | G27: of:= [.F27] + 1 -> 21 | H27: of:= [.G27] + 1 -> 22 | I27: of:= [.H27] + 1 -> 23 | J27: of:= [.I27] + 1 -> 24 | K27: of:= [.J27] + 1 -> 25 | L27: of:= [.K27] + 1 -> 26 | M27: of:= [.L27] + 1 -> 27 | N27: of:= [.M27] + 1 -> 28 | O27: of:= [.N27] + 1 -> 29 | P27: of:= [.O27] + 1 -> 30 | Q27: of:= [.P27] + 1 -> 31 | R27: of:= [.Q27] + 1 -> 32 | S27: of:= [.R27] + 1 -> 33 | T27: of:= [.S27] + 1 -> 34 | U27: of:= [.T27] + 1 -> 35 | V27: of:= [.U27] + 1 -> 36 | W27: of:= [.V27] + 1 -> 37 | X27: of:= [.W27] + 1 -> 38 | Y27: of:= [.X27] + 1 -> 39 | Z27: of:= [.Y27] + 1 -> 40 | AA27: of:= [.Z27] + 1 -> 41 | AB27: of:= [.AA27] + 1 -> 42 | AC27: of:= [.AB27] + 1 -> 43 | AD27: of:= [.AC27] + 1 -> 44 | AE27: of:= [.AD27] + 1 -> 45 | AF27: of:= [.AE27] + 1 -> 46 | AG27: of:= [.AF27] + 1 -> 47 | AH27: of:= [.AG27] + 1 -> 48 | AI27: of:= [.AH27] + 1 -> 49 | AJ27: of:= [.AI27] + 1 -> 50 | AK27: of:= [.AJ27] + 1 -> 51 | AL27: of:= [.AK27] + 1 -> 52 | AM27: of:= [.AL27] + 1 -> 53 | AN27: of:= [.AM27] + 1 -> 54 | AO27: of:= [.AN27] + 1 -> 55 | AP27: of:= [.AO27] + 1 -> 56 | AQ27: of:= [.AP27] + 1 -> 57 | AR27: of:= [.AQ27] + 1 -> 58 | AS27: of:= [.AR27] + 1 -> 59 | AT27: of:= [.AS27] + 1 -> 60 | AU27: of:= [.AT27] + 1 -> 61 | AV27: of:= [.AU27] + 1 -> 62 | AW27: of:= [.AV27] + 1 -> 63 | AX27: of:= [.AW27] + 1 -> 64 | AY27: of:= [.AX27] + 1 -> 65 | AZ27: of:= [.AY27] + 1 -> 66 | BA27: of:= [.AZ27] + 1 -> 67 | BB27: of:= [.BA27] + 1 -> 68 | BC27: of:= [.BB27] + 1 -> 69 | BD27: of:= [.BC27] + 1 -> 70 | BE27: of:= [.BD27] + 1 -> 71 | BF27: of:= [.BE27] + 1 -> 72 | BG27: of:= [.BF27] + 1 -> 73 | BH27: of:= [.BG27] + 1 -> 74 | BI27: of:= [.BH27] + 1 -> 75 | BJ27: of:= [.BI27] + 1 -> 76 | BK27: of:= [.BJ27] + 1 -> 77 | BL27: of:= [.BK27] + 1 -> 78
A28: of:= [.A27] + 1 -> 16 | B28: of:= [.A28] + 1 -> 17 | C28: of:= [.B28] + 1 -> 18 | D28: of:= [.C28] + 1 -> 19 | E28: of:= [.D28] + 1 -> 20 | F28: of:= [.E28] + 1 -> 21 | G28: of:= [.F28] + 1 -> 22 | H28: of:= [.G28] + 1 -> 23 | I28: of:= [.H28] + 1 -> 24 | J28: of:= [.I28] + 1 -> 25 | K28: of:= [.J28] + 1 -> 26 | L28: of:= [.K28] + 1 -> 27 | M28: of:= [.L28] + 1 -> 28 | N28: of:= [.M28] + 1 -> 29 | O28: of:= [.N28] + 1 -> 30 | P28: of:= [.O28] + 1 -> 31 | Q28: of:= [.P28] + 1 -> 32 | R28: of:= [.Q28] + 1 -> 33 | S28: of:= [.R28] + 1 -> 34 | T28: of:= [.S28] + 1 -> 35 | U28: of:= [.T28] + 1 -> 36 | V28: of:= [.U28] + 1 -> 37 | W28: of:= [.V28] + 1 -> 38 | X28: of:= [.W28] + 1 -> 39 | Y28: of:= [.X28] + 1 -> 40 | Z28: of:= [.Y28] + 1 -> 41 | AA28: of:= [.Z28] + 1 -> 42 | AB28: of:= [.AA28] + 1 -> 43 | AC28: of:= [.AB28] + 1 -> 44 | AD28: of:= [.AC28] + 1 -> 45 | AE28: of:= [.AD28] + 1 -> 46 | AF28: of:= [.AE28] + 1 -> 47 | AG28: of:= [.AF28] + 1 -> 48 | AH28: of:= [.AG28] + 1 -> 49 | AI28: of:= [.AH28] + 1 -> 50 | AJ28: of:= [.AI28] + 1 -> 51 | AK28: of:= [.AJ28] + 1 -> 52 | AL28: of:= [.AK28] + 1 -> 53 | AM28: of:= [.AL28] + 1 -> 54 | AN28: of:= [.AM28] + 1 -> 55 | AO28: of:= [.AN28] + 1 -> 56 | AP28: of:= [.AO28] + 1 -> 57 | AQ28: of:= [.AP28] + 1 -> 58 | AR28: of:= [.AQ28] + 1 -> 59 | AS28: of:= [.AR28] + 1 -> 60 | AT28: of:= [.AS28] + 1 -> 61 | AU28: of:= [.AT28] + 1 -> 62 | AV28: of:= [.AU28] + 1 -> 63 | AW28: of:= [.AV28] + 1 -> 64 | AX28: of:= [.AW28] + 1 -> 65 | AY28: of:= [.AX28] + 1 -> 66 | AZ28: of:= [.AY28] + 1 -> 67 | BA28: of:= [.AZ28] + 1 -> 68 | BB28: of:= [.BA28] + 1 -> 69 | BC28: of:= [.BB28] + 1 -> 70 | BD28: of:= [.BC28] + 1 -> 71 | BE28: of:= [.BD28] + 1 -> 72 | BF28: of:= [.BE28] + 1 -> 73 | BG28: of:= [.BF28] + 1 -> 74 | BH28: of:= [.BG28] + 1 -> 75 | BI28: of:= [.BH28] + 1 -> 76 | BJ28: of:= [.BI28] + 1 -> 77 | BK28: of:= [.BJ28] + 1 -> 78 | BL28: of:= [.BK28] + 1 -> 79
A29: of:= [.A28] + 1 -> 17 | B29: of:= [.A29] + 1 -> 18 | C29: of:= [.B29] + 1 -> 19 | D29: of:= [.C29] + 1 -> 20 | E29: of:= [.D29] + 1 -> 21 | F29: of:= [.E29] + 1 -> 22 | G29: of:= [.F29] + 1 -> 23 | H29: of:= [.G29] + 1 -> 24 | I29: of:= [.H29] + 1 -> 25 | J29: of:= [.I29] + 1 -> 26 | K29: of:= [.J29] + 1 -> 27 | L29: of:= [.K29] + 1 -> 28 | M29: of:= [.L29] + 1 -> 29 | N29: of:= [.M29] + 1 -> 30 | O29: of:= [.N29] + 1 -> 31 | P29: of:= [.O29] + 1 -> 32 | Q29: of:= [.P29] + 1 -> 33 | R29: of:= [.Q29] + 1 -> 34 | S29: of:= [.R29] + 1 -> 35 | T29: of:= [.S29] + 1 -> 36 | U29: of:= [.T29] + 1 -> 37 | V29: of:= [.U29] + 1 -> 38 | W29: of:= [.V29] + 1 -> 39 | X29: of:= [.W29] + 1 -> 40 | Y29: of:= [.X29] + 1 -> 41 | Z29: of:= [.Y29] + 1 -> 42 | AA29: of:= [.Z29] + 1 -> 43 | AB29: of:= [.AA29] + 1 -> 44 | AC29: of:= [.AB29] + 1 -> 45 | AD29: of:= [.AC29] + 1 -> 46 | AE29: of:= [.AD29] + 1 -> 47 | AF29: of:= [.AE29] + 1 -> 48 | AG29: of:= [.AF29] + 1 -> 49 | AH29: of:= [.AG29] + 1 -> 50 | AI29: of:= [.AH29] + 1 -> 51 | AJ29: of:= [.AI29] + 1 -> 52 | AK29: of:= [.AJ29] + 1 -> 53 | AL29: of:= [.AK29] + 1 -> 54 | AM29: of:= [.AL29] + 1 -> 55 | AN29: of:= [.AM29] + 1 -> 56 | AO29: of:= [.AN29] + 1 -> 57 | AP29: of:= [.AO29] + 1 -> 58 | AQ29: of:= [.AP29] + 1 -> 59 | AR29: of:= [.AQ29] + 1 -> 60 | AS29: of:= [.AR29] + 1 -> 61 | AT29: of:= [.AS29] + 1 -> 62 | AU29: of:= [.AT29] + 1 -> 63 | AV29: of:= [.AU29] + 1 -> 64 | AW29: of:= [.AV29] + 1 -> 65 | AX29: of:= [.AW29] + 1 -> 66 | AY29: of:= [.AX29] + 1 -> 67 | AZ29: of:= [.AY29] + 1 -> 68 | BA29: of:= [.AZ29] + 1 -> 69 | BB29: of:= [.BA29] + 1 -> 70 | BC29: of:= [.BB29] + 1 -> 71 | BD29: of:= [.BC29] + 1 -> 72 | BE29: of:= [.BD29] + 1 -> 73 | BF29: of:= [.BE29] + 1 -> 74 | BG29: of:= [.BF29] + 1 -> 75 | BH29: of:= [.BG29] + 1 -> 76 | BI29: of:= [.BH29] + 1 -> 77 | BJ29: of:= [.BI29] + 1 -> 78 | BK29: of:= [.BJ29] + 1 -> 79 | BL29: of:= [.BK29] + 1 -> 80
A30: of:= [.A29] + 1 -> 18 | B30: of:= [.A30] + 1 -> 19 | C30: of:= [.B30] + 1 -> 20 | D30: of:= [.C30] + 1 -> 21 | E30: of:= [.D30] + 1 -> 22 | F30: of:= [.E30] + 1 -> 23 | G30: of:= [.F30] + 1 -> 24 | H30: of:= [.G30] + 1 -> 25 | I30: of:= [.H30] + 1 -> 26 | J30: of:= [.I30] + 1 -> 27 | K30: of:= [.J30] + 1 -> 28 | L30: of:= [.K30] + 1 -> 29 | M30: of:= [.L30] + 1 -> 30 | N30: of:= [.M30] + 1 -> 31 | O30: of:= [.N30] + 1 -> 32 | P30: of:= [.O30] + 1 -> 33 | Q30: of:= [.P30] + 1 -> 34 | R30: of:= [.Q30] + 1 -> 35 | S30: of:= [.R30] + 1 -> 36 | T30: of:= [.S30] + 1 -> 37 | U30: of:= [.T30] + 1 -> 38 | V30: of:= [.U30] + 1 -> 39 | W30: of:= [.V30] + 1 -> 40 | X30: of:= [.W30] + 1 -> 41 | Y30: of:= [.X30] + 1 -> 42 | Z30: of:= [.Y30] + 1 -> 43 | AA30: of:= [.Z30] + 1 -> 44 | AB30: of:= [.AA30] + 1 -> 45 | AC30: of:= [.AB30] + 1 -> 46 | AD30: of:= [.AC30] + 1 -> 47 | AE30: of:= [.AD30] + 1 -> 48 | AF30: of:= [.AE30] + 1 -> 49 | AG30: of:= [.AF30] + 1 -> 50 | AH30: of:= [.AG30] + 1 -> 51 | AI30: of:= [.AH30] + 1 -> 52 | AJ30: of:= [.AI30] + 1 -> 53 | AK30: of:= [.AJ30] + 1 -> 54 | AL30: of:= [.AK30] + 1 -> 55 | AM30: of:= [.AL30] + 1 -> 56 | AN30: of:= [.AM30] + 1 -> 57 | AO30: of:= [.AN30] + 1 -> 58 | AP30: of:= [.AO30] + 1 -> 59 | AQ30: of:= [.AP30] + 1 -> 60 | AR30: of:= [.AQ30] + 1 -> 61 | AS30: of:= [.AR30] + 1 -> 62 | AT30: of:= [.AS30] + 1 -> 63 | AU30: of:= [.AT30] + 1 -> 64 | AV30: of:= [.AU30] + 1 -> 65 | AW30: of:= [.AV30] + 1 -> 66 | AX30: of:= [.AW30] + 1 -> 67 | AY30: of:= [.AX30] + 1 -> 68 | AZ30: of:= [.AY30] + 1 -> 69 | BA30: of:= [.AZ30] + 1 -> 70 | BB30: of:= [.BA30] + 1 -> 71 | BC30: of:= [.BB30] + 1 -> 72 | BD30: of:= [.BC30] + 1 -> 73 | BE30: of:= [.BD30] + 1 -> 74 | BF30: of:= [.BE30] + 1 -> 75 | BG30: of:= [.BF30] + 1 -> 76 | BH30: of:= [.BG30] + 1 -> 77 | BI30: of:= [.BH30] + 1 -> 78 | BJ30: of:= [.BI30] + 1 -> 79 | BK30: of:= [.BJ30] + 1 -> 80 | BL30: of:= [.BK30] + 1 -> 81
A31: of:= [.A30] + 1 -> 19 | B31: of:= [.A31] + 1 -> 20 | C31: of:= [.B31] + 1 -> 21 | D31: of:= [.C31] + 1 -> 22 | E31: of:= [.D31] + 1 -> 23 | F31: of:= [.E31] + 1 -> 24 | G31: of:= [.F31] + 1 -> 25 | H31: of:= [.G31] + 1 -> 26 | I31: of:= [.H31] + 1 -> 27 | J31: of:= [.I31] + 1 -> 28 | K31: of:= [.J31] + 1 -> 29 | L31: of:= [.K31] + 1 -> 30 | M31: of:= [.L31] + 1 -> 31 | N31: of:= [.M31] + 1 -> 32 | O31: of:= [.N31] + 1 -> 33 | P31: of:= [.O31] + 1 -> 34 | Q31: of:= [.P31] + 1 -> 35 | R31: of:= [.Q31] + 1 -> 36 | S31: of:= [.R31] + 1 -> 37 | T31: of:= [.S31] + 1 -> 38 | U31: of:= [.T31] + 1 -> 39 | V31: of:= [.U31] + 1 -> 40 | W31: of:= [.V31] + 1 -> 41 | X31: of:= [.W31] + 1 -> 42 | Y31: of:= [.X31] + 1 -> 43 | Z31: of:= [.Y31] + 1 -> 44 | AA31: of:= [.Z31] + 1 -> 45 | AB31: of:= [.AA31] + 1 -> 46 | AC31: of:= [.AB31] + 1 -> 47 | AD31: of:= [.AC31] + 1 -> 48 | AE31: of:= [.AD31] + 1 -> 49 | AF31: of:= [.AE31] + 1 -> 50 | AG31: of:= [.AF31] + 1 -> 51 | AH31: of:= [.AG31] + 1 -> 52 | AI31: of:= [.AH31] + 1 -> 53 | AJ31: of:= [.AI31] + 1 -> 54 | AK31: of:= [.AJ31] + 1 -> 55 | AL31: of:= [.AK31] + 1 -> 56 | AM31: of:= [.AL31] + 1 -> 57 | AN31: of:= [.AM31] + 1 -> 58 | AO31: of:= [.AN31] + 1 -> 59 | AP31: of:= [.AO31] + 1 -> 60 | AQ31: of:= [.AP31] + 1 -> 61 | AR31: of:= [.AQ31] + 1 -> 62 | AS31: of:= [.AR31] + 1 -> 63 | AT31: of:= [.AS31] + 1 -> 64 | AU31: of:= [.AT31] + 1 -> 65 | AV31: of:= [.AU31] + 1 -> 66 | AW31: of:= [.AV31] + 1 -> 67 | AX31: of:= [.AW31] + 1 -> 68 | AY31: of:= [.AX31] + 1 -> 69 | AZ31: of:= [.AY31] + 1 -> 70 | BA31: of:= [.AZ31] + 1 -> 71 | BB31: of:= [.BA31] + 1 -> 72 | BC31: of:= [.BB31] + 1 -> 73 | BD31: of:= [.BC31] + 1 -> 74 | BE31: of:= [.BD31] + 1 -> 75 | BF31: of:= [.BE31] + 1 -> 76 | BG31: of:= [.BF31] + 1 -> 77 | BH31: of:= [.BG31] + 1 -> 78 | BI31: of:= [.BH31] + 1 -> 79 | BJ31: of:= [.BI31] + 1 -> 80 | BK31: of:= [.BJ31] + 1 -> 81 | BL31: of:= [.BK31] + 1 -> 82
A32: of:= [.A31] + 1 -> 20 | B32: of:= [.A32] + 1 -> 21 | C32: of:= [.B32] + 1 -> 22 | D32: of:= [.C32] + 1 -> 23 | E32: of:= [.D32] + 1 -> 24 | F32: of:= [.E32] + 1 -> 25 | G32: of:= [.F32] + 1 -> 26 | H32: of:= [.G32] + 1 -> 27 | I32: of:= [.H32] + 1 -> 28 | J32: of:= [.I32] + 1 -> 29 | K32: of:= [.J32] + 1 -> 30 | L32: of:= [.K32] + 1 -> 31 | M32: of:= [.L32] + 1 -> 32 | N32: of:= [.M32] + 1 -> 33 | O32: of:= [.N32] + 1 -> 34 | P32: of:= [.O32] + 1 -> 35 | Q32: of:= [.P32] + 1 -> 36 | R32: of:= [.Q32] + 1 -> 37 | S32: of:= [.R32] + 1 -> 38 | T32: of:= [.S32] + 1 -> 39 | U32: of:= [.T32] + 1 -> 40 | V32: of:= [.U32] + 1 -> 41 | W32: of:= [.V32] + 1 -> 42 | X32: of:= [.W32] + 1 -> 43 | Y32: of:= [.X32] + 1 -> 44 | Z32: of:= [.Y32] + 1 -> 45 | AA32: of:= [.Z32] + 1 -> 46 | AB32: of:= [.AA32] + 1 -> 47 | AC32: of:= [.AB32] + 1 -> 48 | AD32: of:= [.AC32] + 1 -> 49 | AE32: of:= [.AD32] + 1 -> 50 | AF32: of:= [.AE32] + 1 -> 51 | AG32: of:= [.AF32] + 1 -> 52 | AH32: of:= [.AG32] + 1 -> 53 | AI32: of:= [.AH32] + 1 -> 54 | AJ32: of:= [.AI32] + 1 -> 55 | AK32: of:= [.AJ32] + 1 -> 56 | AL32: of:= [.AK32] + 1 -> 57 | AM32: of:= [.AL32] + 1 -> 58 | AN32: of:= [.AM32] + 1 -> 59 | AO32: of:= [.AN32] + 1 -> 60 | AP32: of:= [.AO32] + 1 -> 61 | AQ32: of:= [.AP32] + 1 -> 62 | AR32: of:= [.AQ32] + 1 -> 63 | AS32: of:= [.AR32] + 1 -> 64 | AT32: of:= [.AS32] + 1 -> 65 | AU32: of:= [.AT32] + 1 -> 66 | AV32: of:= [.AU32] + 1 -> 67 | AW32: of:= [.AV32] + 1 -> 68 | AX32: of:= [.AW32] + 1 -> 69 | AY32: of:= [.AX32] + 1 -> 70 | AZ32: of:= [.AY32] + 1 -> 71 | BA32: of:= [.AZ32] + 1 -> 72 | BB32: of:= [.BA32] + 1 -> 73 | BC32: of:= [.BB32] + 1 -> 74 | BD32: of:= [.BC32] + 1 -> 75 | BE32: of:= [.BD32] + 1 -> 76 | BF32: of:= [.BE32] + 1 -> 77 | BG32: of:= [.BF32] + 1 -> 78 | BH32: of:= [.BG32] + 1 -> 79 | BI32: of:= [.BH32] + 1 -> 80 | BJ32: of:= [.BI32] + 1 -> 81 | BK32: of:= [.BJ32] + 1 -> 82 | BL32: of:= [.BK32] + 1 -> 83
A33: of:= 5 -> 5 | B33: of:= [.A33] + 1 -> 6 | C33: of:= [.B33] + 1 -> 7 | D33: of:= [.C33] + 1 -> 8 | E33: of:= [.D33] + 1 -> 9 | F33: of:= [.E33] + 1 -> 10 | G33: of:= [.F33] + 1 -> 11 | H33: of:= [.G33] + 1 -> 12 | I33: of:= [.H33] + 1 -> 13 | J33: of:= [.I33] + 1 -> 14 | K33: of:= [.J33] + 1 -> 15 | L33: of:= [.K33] + 1 -> 16 | M33: of:= [.L33] + 1 -> 17 | N33: of:= [.M33] + 1 -> 18 | O33: of:= [.N33] + 1 -> 19 | P33: of:= [.O33] + 1 -> 20 | Q33: of:= [.P33] + 1 -> 21 | R33: of:= [.Q33] + 1 -> 22 | S33: of:= [.R33] + 1 -> 23 | T33: of:= [.S33] + 1 -> 24 | U33: of:= [.T33] + 1 -> 25 | V33: of:= [.U33] + 1 -> 26 | W33: of:= [.V33] + 1 -> 27 | X33: of:= [.W33] + 1 -> 28 | Y33: of:= [.X33] + 1 -> 29 | Z33: of:= [.Y33] + 1 -> 30 | AA33: of:= [.Z33] + 1 -> 31 | AB33: of:= [.AA33] + 1 -> 32 | AC33: of:= [.AB33] + 1 -> 33 | AD33: of:= [.AC33] + 1 -> 34 | AE33: of:= [.AD33] + 1 -> 35 | AF33: of:= [.AE33] + 1 -> 36 | AG33: of:= [.AF33] + 1 -> 37 | AH33: of:= [.AG33] + 1 -> 38 | AI33: of:= [.AH33] + 1 -> 39 | AJ33: of:= [.AI33] + 1 -> 40 | AK33: of:= [.AJ33] + 1 -> 41 | AL33: of:= [.AK33] + 1 -> 42 | AM33: of:= [.AL33] + 1 -> 43 | AN33: of:= [.AM33] + 1 -> 44 | AO33: of:= [.AN33] + 1 -> 45 | AP33: of:= [.AO33] + 1 -> 46 | AQ33: of:= [.AP33] + 1 -> 47 | AR33: of:= [.AQ33] + 1 -> 48 | AS33: of:= [.AR33] + 1 -> 49 | AT33: of:= [.AS33] + 1 -> 50 | AU33: of:= [.AT33] + 1 -> 51 | AV33: of:= [.AU33] + 1 -> 52 | AW33: of:= [.AV33] + 1 -> 53 | AX33: of:= [.AW33] + 1 -> 54 | AY33: of:= [.AX33] + 1 -> 55 | AZ33: of:= [.AY33] + 1 -> 56 | BA33: of:= [.AZ33] + 1 -> 57 | BB33: of:= [.BA33] + 1 -> 58 | BC33: of:= [.BB33] + 1 -> 59 | BD33: of:= [.BC33] + 1 -> 60 | BE33: of:= [.BD33] + 1 -> 61 | BF33: of:= [.BE33] + 1 -> 62 | BG33: of:= [.BF33] + 1 -> 63 | BH33: of:= [.BG33] + 1 -> 64 | BI33: of:= [.BH33] + 1 -> 65 | BJ33: of:= [.BI33] + 1 -> 66 | BK33: of:= [.BJ33] + 1 -> 67 | BL33: of:= [.BK33] + 1 -> 68
A34: of:= [.A33] + 1 -> 6 | B34: of:= [.A34] + 1 -> 7 | C34: of:= [.B34] + 1 -> 8 | D34: of:= [.C34] + 1 -> 9 | E34: of:= [.D34] + 1 -> 10 | F34: of:= [.E34] + 1 -> 11 | G34: of:= [.F34] + 1 -> 12 | H34: of:= [.G34] + 1 -> 13 | I34: of:= [.H34] + 1 -> 14 | J34: of:= [.I34] + 1 -> 15 | K34: of:= [.J34] + 1 -> 16 | L34: of:= [.K34] + 1 -> 17 | M34: of:= [.L34] + 1 -> 18 | N34: of:= [.M34] + 1 -> 19 | O34: of:= [.N34] + 1 -> 20 | P34: of:= [.O34] + 1 -> 21 | Q34: of:= [.P34] + 1 -> 22 | R34: of:= [.Q34] + 1 -> 23 | S34: of:= [.R34] + 1 -> 24 | T34: of:= [.S34] + 1 -> 25 | U34: of:= [.T34] + 1 -> 26 | V34: of:= [.U34] + 1 -> 27 | W34: of:= [.V34] + 1 -> 28 | X34: of:= [.W34] + 1 -> 29 | Y34: of:= [.X34] + 1 -> 30 | Z34: of:= [.Y34] + 1 -> 31 | AA34: of:= [.Z34] + 1 -> 32 | AB34: of:= [.AA34] + 1 -> 33 | AC34: of:= [.AB34] + 1 -> 34 | AD34: of:= [.AC34] + 1 -> 35 | AE34: of:= [.AD34] + 1 -> 36 | AF34: of:= [.AE34] + 1 -> 37 | AG34: of:= [.AF34] + 1 -> 38 | AH34: of:= [.AG34] + 1 -> 39 | AI34: of:= [.AH34] + 1 -> 40 | AJ34: of:= [.AI34] + 1 -> 41 | AK34: of:= [.AJ34] + 1 -> 42 | AL34: of:= [.AK34] + 1 -> 43 | AM34: of:= [.AL34] + 1 -> 44 | AN34: of:= [.AM34] + 1 -> 45 | AO34: of:= [.AN34] + 1 -> 46 | AP34: of:= [.AO34] + 1 -> 47 | AQ34: of:= [.AP34] + 1 -> 48 | AR34: of:= [.AQ34] + 1 -> 49 | AS34: of:= [.AR34] + 1 -> 50 | AT34: of:= [.AS34] + 1 -> 51 | AU34: of:= [.AT34] + 1 -> 52 | AV34: of:= [.AU34] + 1 -> 53 | AW34: of:= [.AV34] + 1 -> 54 | AX34: of:= [.AW34] + 1 -> 55 | AY34: of:= [.AX34] + 1 -> 56 | AZ34: of:= [.AY34] + 1 -> 57 | BA34: of:= [.AZ34] + 1 -> 58 | BB34: of:= [.BA34] + 1 -> 59 | BC34: of:= [.BB34] + 1 -> 60 | BD34: of:= [.BC34] + 1 -> 61 | BE34: of:= [.BD34] + 1 -> 62 | BF34: of:= [.BE34] + 1 -> 63 | BG34: of:= [.BF34] + 1 -> 64 | BH34: of:= [.BG34] + 1 -> 65 | BI34: of:= [.BH34] + 1 -> 66 | BJ34: of:= [.BI34] + 1 -> 67 | BK34: of:= [.BJ34] + 1 -> 68 | BL34: of:= [.BK34] + 1 -> 69
A35: of:= [.A34] + 1 -> 7 | B35: of:= [.A35] + 1 -> 8 | C35: of:= [.B35] + 1 -> 9 | D35: of:= [.C35] + 1 -> 10 | E35: of:= [.D35] + 1 -> 11 | F35: of:= [.E35] + 1 -> 12 | G35: of:= [.F35] + 1 -> 13 | H35: of:= [.G35] + 1 -> 14 | I35: of:= [.H35] + 1 -> 15 | J35: of:= [.I35] + 1 -> 16 | K35: of:= [.J35] + 1 -> 17 | L35: of:= [.K35] + 1 -> 18 | M35: of:= [.L35] + 1 -> 19 | N35: of:= [.M35] + 1 -> 20 | O35: of:= [.N35] + 1 -> 21 | P35: of:= [.O35] + 1 -> 22 | Q35: of:= [.P35] + 1 -> 23 | R35: of:= [.Q35] + 1 -> 24 | S35: of:= [.R35] + 1 -> 25 | T35: of:= [.S35] + 1 -> 26 | U35: of:= [.T35] + 1 -> 27 | V35: of:= [.U35] + 1 -> 28 | W35: of:= [.V35] + 1 -> 29 | X35: of:= [.W35] + 1 -> 30 | Y35: of:= [.X35] + 1 -> 31 | Z35: of:= [.Y35] + 1 -> 32 | AA35: of:= [.Z35] + 1 -> 33 | AB35: of:= [.AA35] + 1 -> 34 | AC35: of:= [.AB35] + 1 -> 35 | AD35: of:= [.AC35] + 1 -> 36 | AE35: of:= [.AD35] + 1 -> 37 | AF35: of:= [.AE35] + 1 -> 38 | AG35: of:= [.AF35] + 1 -> 39 | AH35: of:= [.AG35] + 1 -> 40 | AI35: of:= [.AH35] + 1 -> 41 | AJ35: of:= [.AI35] + 1 -> 42 | AK35: of:= [.AJ35] + 1 -> 43 | AL35: of:= [.AK35] + 1 -> 44 | AM35: of:= [.AL35] + 1 -> 45 | AN35: of:= [.AM35] + 1 -> 46 | AO35: of:= [.AN35] + 1 -> 47 | AP35: of:= [.AO35] + 1 -> 48 | AQ35: of:= [.AP35] + 1 -> 49 | AR35: of:= [.AQ35] + 1 -> 50 | AS35: of:= [.AR35] + 1 -> 51 | AT35: of:= [.AS35] + 1 -> 52 | AU35: of:= [.AT35] + 1 -> 53 | AV35: of:= [.AU35] + 1 -> 54 | AW35: of:= [.AV35] + 1 -> 55 | AX35: of:= [.AW35] + 1 -> 56 | AY35: of:= [.AX35] + 1 -> 57 | AZ35: of:= [.AY35] + 1 -> 58 | BA35: of:= [.AZ35] + 1 -> 59 | BB35: of:= [.BA35] + 1 -> 60 | BC35: of:= [.BB35] + 1 -> 61 | BD35: of:= [.BC35] + 1 -> 62 | BE35: of:= [.BD35] + 1 -> 63 | BF35: of:= [.BE35] + 1 -> 64 | BG35: of:= [.BF35] + 1 -> 65 | BH35: of:= [.BG35] + 1 -> 66 | BI35: of:= [.BH35] + 1 -> 67 | BJ35: of:= [.BI35] + 1 -> 68 | BK35: of:= [.BJ35] + 1 -> 69 | BL35: of:= [.BK35] + 1 -> 70
A36: of:= [.A35] + 1 -> 8 | B36: of:= [.A36] + 1 -> 9 | C36: of:= [.B36] + 1 -> 10 | D36: of:= [.C36] + 1 -> 11 | E36: of:= [.D36] + 1 -> 12 | F36: of:= [.E36] + 1 -> 13 | G36: of:= [.F36] + 1 -> 14 | H36: of:= [.G36] + 1 -> 15 | I36: of:= [.H36] + 1 -> 16 | J36: of:= [.I36] + 1 -> 17 | K36: of:= [.J36] + 1 -> 18 | L36: of:= [.K36] + 1 -> 19 | M36: of:= [.L36] + 1 -> 20 | N36: of:= [.M36] + 1 -> 21 | O36: of:= [.N36] + 1 -> 22 | P36: of:= [.O36] + 1 -> 23 | Q36: of:= [.P36] + 1 -> 24 | R36: of:= [.Q36] + 1 -> 25 | S36: of:= [.R36] + 1 -> 26 | T36: of:= [.S36] + 1 -> 27 | U36: of:= [.T36] + 1 -> 28 | V36: of:= [.U36] + 1 -> 29 | W36: of:= [.V36] + 1 -> 30 | X36: of:= [.W36] + 1 -> 31 | Y36: of:= [.X36] + 1 -> 32 | Z36: of:= [.Y36] + 1 -> 33 | AA36: of:= [.Z36] + 1 -> 34 | AB36: of:= [.AA36] + 1 -> 35 | AC36: of:= [.AB36] + 1 -> 36 | AD36: of:= [.AC36] + 1 -> 37 | AE36: of:= [.AD36] + 1 -> 38 | AF36: of:= [.AE36] + 1 -> 39 | AG36: of:= [.AF36] + 1 -> 40 | AH36: of:= [.AG36] + 1 -> 41 | AI36: of:= [.AH36] + 1 -> 42 | AJ36: of:= [.AI36] + 1 -> 43 | AK36: of:= [.AJ36] + 1 -> 44 | AL36: of:= [.AK36] + 1 -> 45 | AM36: of:= [.AL36] + 1 -> 46 | AN36: of:= [.AM36] + 1 -> 47 | AO36: of:= [.AN36] + 1 -> 48 | AP36: of:= [.AO36] + 1 -> 49 | AQ36: of:= [.AP36] + 1 -> 50 | AR36: of:= [.AQ36] + 1 -> 51 | AS36: of:= [.AR36] + 1 -> 52 | AT36: of:= [.AS36] + 1 -> 53 | AU36: of:= [.AT36] + 1 -> 54 | AV36: of:= [.AU36] + 1 -> 55 | AW36: of:= [.AV36] + 1 -> 56 | AX36: of:= [.AW36] + 1 -> 57 | AY36: of:= [.AX36] + 1 -> 58 | AZ36: of:= [.AY36] + 1 -> 59 | BA36: of:= [.AZ36] + 1 -> 60 | BB36: of:= [.BA36] + 1 -> 61 | BC36: of:= [.BB36] + 1 -> 62 | BD36: of:= [.BC36] + 1 -> 63 | BE36: of:= [.BD36] + 1 -> 64 | BF36: of:= [.BE36] + 1 -> 65 | BG36: of:= [.BF36] + 1 -> 66 | BH36: of:= [.BG36] + 1 -> 67 | BI36: of:= [.BH36] + 1 -> 68 | BJ36: of:= [.BI36] + 1 -> 69 | BK36: of:= [.BJ36] + 1 -> 70 | BL36: of:= [.BK36] + 1 -> 71
A37: of:= [.A36] + 1 -> 9 | B37: of:= [.A37] + 1 -> 10 | C37: of:= [.B37] + 1 -> 11 | D37: of:= [.C37] + 1 -> 12 | E37: of:= [.D37] + 1 -> 13 | F37: of:= [.E37] + 1 -> 14 | G37: of:= [.F37] + 1 -> 15 | H37: of:= [.G37] + 1 -> 16 | I37: of:= [.H37] + 1 -> 17 | J37: of:= [.I37] + 1 -> 18 | K37: of:= [.J37] + 1 -> 19 | L37: of:= [.K37] + 1 -> 20 | M37: of:= [.L37] + 1 -> 21 | N37: of:= [.M37] + 1 -> 22 | O37: of:= [.N37] + 1 -> 23 | P37: of:= [.O37] + 1 -> 24 | Q37: of:= [.P37] + 1 -> 25 | R37: of:= [.Q37] + 1 -> 26 | S37: of:= [.R37] + 1 -> 27 | T37: of:= [.S37] + 1 -> 28 | U37: of:= [.T37] + 1 -> 29 | V37: of:= [.U37] + 1 -> 30 | W37: of:= [.V37] + 1 -> 31 | X37: of:= [.W37] + 1 -> 32 | Y37: of:= [.X37] + 1 -> 33 | Z37: of:= [.Y37] + 1 -> 34 | AA37: of:= [.Z37] + 1 -> 35 | AB37: of:= [.AA37] + 1 -> 36 | AC37: of:= [.AB37] + 1 -> 37 | AD37: of:= [.AC37] + 1 -> 38 | AE37: of:= [.AD37] + 1 -> 39 | AF37: of:= [.AE37] + 1 -> 40 | AG37: of:= [.AF37] + 1 -> 41 | AH37: of:= [.AG37] + 1 -> 42 | AI37: of:= [.AH37] + 1 -> 43 | AJ37: of:= [.AI37] + 1 -> 44 | AK37: of:= [.AJ37] + 1 -> 45 | AL37: of:= [.AK37] + 1 -> 46 | AM37: of:= [.AL37] + 1 -> 47 | AN37: of:= [.AM37] + 1 -> 48 | AO37: of:= [.AN37] + 1 -> 49 | AP37: of:= [.AO37] + 1 -> 50 | AQ37: of:= [.AP37] + 1 -> 51 | AR37: of:= [.AQ37] + 1 -> 52 | AS37: of:= [.AR37] + 1 -> 53 | AT37: of:= [.AS37] + 1 -> 54 | AU37: of:= [.AT37] + 1 -> 55 | AV37: of:= [.AU37] + 1 -> 56 | AW37: of:= [.AV37] + 1 -> 57 | AX37: of:= [.AW37] + 1 -> 58 | AY37: of:= [.AX37] + 1 -> 59 | AZ37: of:= [.AY37] + 1 -> 60 | BA37: of:= [.AZ37] + 1 -> 61 | BB37: of:= [.BA37] + 1 -> 62 | BC37: of:= [.BB37] + 1 -> 63 | BD37: of:= [.BC37] + 1 -> 64 | BE37: of:= [.BD37] + 1 -> 65 | BF37: of:= [.BE37] + 1 -> 66 | BG37: of:= [.BF37] + 1 -> 67 | BH37: of:= [.BG37] + 1 -> 68 | BI37: of:= [.BH37] + 1 -> 69 | BJ37: of:= [.BI37] + 1 -> 70 | BK37: of:= [.BJ37] + 1 -> 71 | BL37: of:= [.BK37] + 1 -> 72
A38: of:= [.A37] + 1 -> 10 | B38: of:= [.A38] + 1 -> 11 | C38: of:= [.B38] + 1 -> 12 | D38: of:= [.C38] + 1 -> 13 | E38: of:= [.D38] + 1 -> 14 | F38: of:= [.E38] + 1 -> 15 | G38: of:= [.F38] + 1 -> 16 | H38: of:= [.G38] + 1 -> 17 | I38: of:= [.H38] + 1 -> 18 | J38: of:= [.I38] + 1 -> 19 | K38: of:= [.J38] + 1 -> 20 | L38: of:= [.K38] + 1 -> 21 | M38: of:= [.L38] + 1 -> 22 | N38: of:= [.M38] + 1 -> 23 | O38: of:= [.N38] + 1 -> 24 | P38: of:= [.O38] + 1 -> 25 | Q38: of:= [.P38] + 1 -> 26 | R38: of:= [.Q38] + 1 -> 27 | S38: of:= [.R38] + 1 -> 28 | T38: of:= [.S38] + 1 -> 29 | U38: of:= [.T38] + 1 -> 30 | V38: of:= [.U38] + 1 -> 31 | W38: of:= [.V38] + 1 -> 32 | X38: of:= [.W38] + 1 -> 33 | Y38: of:= [.X38] + 1 -> 34 | Z38: of:= [.Y38] + 1 -> 35 | AA38: of:= [.Z38] + 1 -> 36 | AB38: of:= [.AA38] + 1 -> 37 | AC38: of:= [.AB38] + 1 -> 38 | AD38: of:= [.AC38] + 1 -> 39 | AE38: of:= [.AD38] + 1 -> 40 | AF38: of:= [.AE38] + 1 -> 41 | AG38: of:= [.AF38] + 1 -> 42 | AH38: of:= [.AG38] + 1 -> 43 | AI38: of:= [.AH38] + 1 -> 44 | AJ38: of:= [.AI38] + 1 -> 45 | AK38: of:= [.AJ38] + 1 -> 46 | AL38: of:= [.AK38] + 1 -> 47 | AM38: of:= [.AL38] + 1 -> 48 | AN38: of:= [.AM38] + 1 -> 49 | AO38: of:= [.AN38] + 1 -> 50 | AP38: of:= [.AO38] + 1 -> 51 | AQ38: of:= [.AP38] + 1 -> 52 | AR38: of:= [.AQ38] + 1 -> 53 | AS38: of:= [.AR38] + 1 -> 54 | AT38: of:= [.AS38] + 1 -> 55 | AU38: of:= [.AT38] + 1 -> 56 | AV38: of:= [.AU38] + 1 -> 57 | AW38: of:= [.AV38] + 1 -> 58 | AX38: of:= [.AW38] + 1 -> 59 | AY38: of:= [.AX38] + 1 -> 60 | AZ38: of:= [.AY38] + 1 -> 61 | BA38: of:= [.AZ38] + 1 -> 62 | BB38: of:= [.BA38] + 1 -> 63 | BC38: of:= [.BB38] + 1 -> 64 | BD38: of:= [.BC38] + 1 -> 65 | BE38: of:= [.BD38] + 1 -> 66 | BF38: of:= [.BE38] + 1 -> 67 | BG38: of:= [.BF38] + 1 -> 68 | BH38: of:= [.BG38] + 1 -> 69 | BI38: of:= [.BH38] + 1 -> 70 | BJ38: of:= [.BI38] + 1 -> 71 | BK38: of:= [.BJ38] + 1 -> 72 | BL38: of:= [.BK38] + 1 -> 73
A39: of:= [.A38] + 1 -> 11 | B39: of:= [.A39] + 1 -> 12 | C39: of:= [.B39] + 1 -> 13 | D39: of:= [.C39] + 1 -> 14 | E39: of:= [.D39] + 1 -> 15 | F39: of:= [.E39] + 1 -> 16 | G39: of:= [.F39] + 1 -> 17 | H39: of:= [.G39] + 1 -> 18 | I39: of:= [.H39] + 1 -> 19 | J39: of:= [.I39] + 1 -> 20 | K39: of:= [.J39] + 1 -> 21 | L39: of:= [.K39] + 1 -> 22 | M39: of:= [.L39] + 1 -> 23 | N39: of:= [.M39] + 1 -> 24 | O39: of:= [.N39] + 1 -> 25 | P39: of:= [.O39] + 1 -> 26 | Q39: of:= [.P39] + 1 -> 27 | R39: of:= [.Q39] + 1 -> 28 | S39: of:= [.R39] + 1 -> 29 | T39: of:= [.S39] + 1 -> 30 | U39: of:= [.T39] + 1 -> 31 | V39: of:= [.U39] + 1 -> 32 | W39: of:= [.V39] + 1 -> 33 | X39: of:= [.W39] + 1 -> 34 | Y39: of:= [.X39] + 1 -> 35 | Z39: of:= [.Y39] + 1 -> 36 | AA39: of:= [.Z39] + 1 -> 37 | AB39: of:= [.AA39] + 1 -> 38 | AC39: of:= [.AB39] + 1 -> 39 | AD39: of:= [.AC39] + 1 -> 40 | AE39: of:= [.AD39] + 1 -> 41 | AF39: of:= [.AE39] + 1 -> 42 | AG39: of:= [.AF39] + 1 -> 43 | AH39: of:= [.AG39] + 1 -> 44 | AI39: of:= [.AH39] + 1 -> 45 | AJ39: of:= [.AI39] + 1 -> 46 | AK39: of:= [.AJ39] + 1 -> 47 | AL39: of:= [.AK39] + 1 -> 48 | AM39: of:= [.AL39] + 1 -> 49 | AN39: of:= [.AM39] + 1 -> 50 | AO39: of:= [.AN39] + 1 -> 51 | AP39: of:= [.AO39] + 1 -> 52 | AQ39: of:= [.AP39] + 1 -> 53 | AR39: of:= [.AQ39] + 1 -> 54 | AS39: of:= [.AR39] + 1 -> 55 | AT39: of:= [.AS39] + 1 -> 56 | AU39: of:= [.AT39] + 1 -> 57 | AV39: of:= [.AU39] + 1 -> 58 | AW39: of:= [.AV39] + 1 -> 59 | AX39: of:= [.AW39] + 1 -> 60 | AY39: of:= [.AX39] + 1 -> 61 | AZ39: of:= [.AY39] + 1 -> 62 | BA39: of:= [.AZ39] + 1 -> 63 | BB39: of:= [.BA39] + 1 -> 64 | BC39: of:= [.BB39] + 1 -> 65 | BD39: of:= [.BC39] + 1 -> 66 | BE39: of:= [.BD39] + 1 -> 67 | BF39: of:= [.BE39] + 1 -> 68 | BG39: of:= [.BF39] + 1 -> 69 | BH39: of:= [.BG39] + 1 -> 70 | BI39: of:= [.BH39] + 1 -> 71 | BJ39: of:= [.BI39] + 1 -> 72 | BK39: of:= [.BJ39] + 1 -> 73 | BL39: of:= [.BK39] + 1 -> 74
A40: of:= [.A39] + 1 -> 12 | B40: of:= [.A40] + 1 -> 13 | C40: of:= [.B40] + 1 -> 14 | D40: of:= [.C40] + 1 -> 15 | E40: of:= [.D40] + 1 -> 16 | F40: of:= [.E40] + 1 -> 17 | G40: of:= [.F40] + 1 -> 18 | H40: of:= [.G40] + 1 -> 19 | I40: of:= [.H40] + 1 -> 20 | J40: of:= [.I40] + 1 -> 21 | K40: of:= [.J40] + 1 -> 22 | L40: of:= [.K40] + 1 -> 23 | M40: of:= [.L40] + 1 -> 24 | N40: of:= [.M40] + 1 -> 25 | O40: of:= [.N40] + 1 -> 26 | P40: of:= [.O40] + 1 -> 27 | Q40: of:= [.P40] + 1 -> 28 | R40: of:= [.Q40] + 1 -> 29 | S40: of:= [.R40] + 1 -> 30 | T40: of:= [.S40] + 1 -> 31 | U40: of:= [.T40] + 1 -> 32 | V40: of:= [.U40] + 1 -> 33 | W40: of:= [.V40] + 1 -> 34 | X40: of:= [.W40] + 1 -> 35 | Y40: of:= [.X40] + 1 -> 36 | Z40: of:= [.Y40] + 1 -> 37 | AA40: of:= [.Z40] + 1 -> 38 | AB40: of:= [.AA40] + 1 -> 39 | AC40: of:= [.AB40] + 1 -> 40 | AD40: of:= [.AC40] + 1 -> 41 | AE40: of:= [.AD40] + 1 -> 42 | AF40: of:= [.AE40] + 1 -> 43 | AG40: of:= [.AF40] + 1 -> 44 | AH40: of:= [.AG40] + 1 -> 45 | AI40: of:= [.AH40] + 1 -> 46 | AJ40: of:= [.AI40] + 1 -> 47 | AK40: of:= [.AJ40] + 1 -> 48 | AL40: of:= [.AK40] + 1 -> 49 | AM40: of:= [.AL40] + 1 -> 50 | AN40: of:= [.AM40] + 1 -> 51 | AO40: of:= [.AN40] + 1 -> 52 | AP40: of:= [.AO40] + 1 -> 53 | AQ40: of:= [.AP40] + 1 -> 54 | AR40: of:= [.AQ40] + 1 -> 55 | AS40: of:= [.AR40] + 1 -> 56 | AT40: of:= [.AS40] + 1 -> 57 | AU40: of:= [.AT40] + 1 -> 58 | AV40: of:= [.AU40] + 1 -> 59 | AW40: of:= [.AV40] + 1 -> 60 | AX40: of:= [.AW40] + 1 -> 61 | AY40: of:= [.AX40] + 1 -> 62 | AZ40: of:= [.AY40] + 1 -> 63 | BA40: of:= [.AZ40] + 1 -> 64 | BB40: of:= [.BA40] + 1 -> 65 | BC40: of:= [.BB40] + 1 -> 66 | BD40: of:= [.BC40] + 1 -> 67 | BE40: of:= [.BD40] + 1 -> 68 | BF40: of:= [.BE40] + 1 -> 69 | BG40: of:= [.BF40] + 1 -> 70 | BH40: of:= [.BG40] + 1 -> 71 | BI40: of:= [.BH40] + 1 -> 72 | BJ40: of:= [.BI40] + 1 -> 73 | BK40: of:= [.BJ40] + 1 -> 74 | BL40: of:= [.BK40] + 1 -> 75
A41: of:= [.A40] + 1 -> 13 | B41: of:= [.A41] + 1 -> 14 | C41: of:= [.B41] + 1 -> 15 | D41: of:= [.C41] + 1 -> 16 | E41: of:= [.D41] + 1 -> 17 | F41: of:= [.E41] + 1 -> 18 | G41: of:= [.F41] + 1 -> 19 | H41: of:= [.G41] + 1 -> 20 | I41: of:= [.H41] + 1 -> 21 | J41: of:= [.I41] + 1 -> 22 | K41: of:= [.J41] + 1 -> 23 | L41: of:= [.K41] + 1 -> 24 | M41: of:= [.L41] + 1 -> 25 | N41: of:= [.M41] + 1 -> 26 | O41: of:= [.N41] + 1 -> 27 | P41: of:= [.O41] + 1 -> 28 | Q41: of:= [.P41] + 1 -> 29 | R41: of:= [.Q41] + 1 -> 30 | S41: of:= [.R41] + 1 -> 31 | T41: of:= [.S41] + 1 -> 32 | U41: of:= [.T41] + 1 -> 33 | V41: of:= [.U41] + 1 -> 34 | W41: of:= [.V41] + 1 -> 35 | X41: of:= [.W41] + 1 -> 36 | Y41: of:= [.X41] + 1 -> 37 | Z41: of:= [.Y41] + 1 -> 38 | AA41: of:= [.Z41] + 1 -> 39 | AB41: of:= [.AA41] + 1 -> 40 | AC41: of:= [.AB41] + 1 -> 41 | AD41: of:= [.AC41] + 1 -> 42 | AE41: of:= [.AD41] + 1 -> 43 | AF41: of:= [.AE41] + 1 -> 44 | AG41: of:= [.AF41] + 1 -> 45 | AH41: of:= [.AG41] + 1 -> 46 | AI41: of:= [.AH41] + 1 -> 47 | AJ41: of:= [.AI41] + 1 -> 48 | AK41: of:= [.AJ41] + 1 -> 49 | AL41: of:= [.AK41] + 1 -> 50 | AM41: of:= [.AL41] + 1 -> 51 | AN41: of:= [.AM41] + 1 -> 52 | AO41: of:= [.AN41] + 1 -> 53 | AP41: of:= [.AO41] + 1 -> 54 | AQ41: of:= [.AP41] + 1 -> 55 | AR41: of:= [.AQ41] + 1 -> 56 | AS41: of:= [.AR41] + 1 -> 57 | AT41: of:= [.AS41] + 1 -> 58 | AU41: of:= [.AT41] + 1 -> 59 | AV41: of:= [.AU41] + 1 -> 60 | AW41: of:= [.AV41] + 1 -> 61 | AX41: of:= [.AW41] + 1 -> 62 | AY41: of:= [.AX41] + 1 -> 63 | AZ41: of:= [.AY41] + 1 -> 64 | BA41: of:= [.AZ41] + 1 -> 65 | BB41: of:= [.BA41] + 1 -> 66 | BC41: of:= [.BB41] + 1 -> 67 | BD41: of:= [.BC41] + 1 -> 68 | BE41: of:= [.BD41] + 1 -> 69 | BF41: of:= [.BE41] + 1 -> 70 | BG41: of:= [.BF41] + 1 -> 71 | BH41: of:= [.BG41] + 1 -> 72 | BI41: of:= [.BH41] + 1 -> 73 | BJ41: of:= [.BI41] + 1 -> 74 | BK41: of:= [.BJ41] + 1 -> 75 | BL41: of:= [.BK41] + 1 -> 76
A42: of:= [.A41] + 1 -> 14 | B42: of:= [.A42] + 1 -> 15 | C42: of:= [.B42] + 1 -> 16 | D42: of:= [.C42] + 1 -> 17 | E42: of:= [.D42] + 1 -> 18 | F42: of:= [.E42] + 1 -> 19 | G42: of:= [.F42] + 1 -> 20 | H42: of:= [.G42] + 1 -> 21 | I42: of:= [.H42] + 1 -> 22 | J42: of:= [.I42] + 1 -> 23 | K42: of:= [.J42] + 1 -> 24 | L42: of:= [.K42] + 1 -> 25 | M42: of:= [.L42] + 1 -> 26 | N42: of:= [.M42] + 1 -> 27 | O42: of:= [.N42] + 1 -> 28 | P42: of:= [.O42] + 1 -> 29 | Q42: of:= [.P42] + 1 -> 30 | R42: of:= [.Q42] + 1 -> 31 | S42: of:= [.R42] + 1 -> 32 | T42: of:= [.S42] + 1 -> 33 | U42: of:= [.T42] + 1 -> 34 | V42: of:= [.U42] + 1 -> 35 | W42: of:= [.V42] + 1 -> 36 | X42: of:= [.W42] + 1 -> 37 | Y42: of:= [.X42] + 1 -> 38 | Z42: of:= [.Y42] + 1 -> 39 | AA42: of:= [.Z42] + 1 -> 40 | AB42: of:= [.AA42] + 1 -> 41 | AC42: of:= [.AB42] + 1 -> 42 | AD42: of:= [.AC42] + 1 -> 43 | AE42: of:= [.AD42] + 1 -> 44 | AF42: of:= [.AE42] + 1 -> 45 | AG42: of:= [.AF42] + 1 -> 46 | AH42: of:= [.AG42] + 1 -> 47 | AI42: of:= [.AH42] + 1 -> 48 | AJ42: of:= [.AI42] + 1 -> 49 | AK42: of:= [.AJ42] + 1 -> 50 | AL42: of:= [.AK42] + 1 -> 51 | AM42: of:= [.AL42] + 1 -> 52 | AN42: of:= [.AM42] + 1 -> 53 | AO42: of:= [.AN42] + 1 -> 54 | AP42: of:= [.AO42] + 1 -> 55 | AQ42: of:= [.AP42] + 1 -> 56 | AR42: of:= [.AQ42] + 1 -> 57 | AS42: of:= [.AR42] + 1 -> 58 | AT42: of:= [.AS42] + 1 -> 59 | AU42: of:= [.AT42] + 1 -> 60 | AV42: of:= [.AU42] + 1 -> 61 | AW42: of:= [.AV42] + 1 -> 62 | AX42: of:= [.AW42] + 1 -> 63 | AY42: of:= [.AX42] + 1 -> 64 | AZ42: of:= [.AY42] + 1 -> 65 | BA42: of:= [.AZ42] + 1 -> 66 | BB42: of:= [.BA42] + 1 -> 67 | BC42: of:= [.BB42] + 1 -> 68 | BD42: of:= [.BC42] + 1 -> 69 | BE42: of:= [.BD42] + 1 -> 70 | BF42: of:= [.BE42] + 1 -> 71 | BG42: of:= [.BF42] + 1 -> 72 | BH42: of:= [.BG42] + 1 -> 73 | BI42: of:= [.BH42] + 1 -> 74 | BJ42: of:= [.BI42] + 1 -> 75 | BK42: of:= [.BJ42] + 1 -> 76 | BL42: of:= [.BK42] + 1 -> 77
A43: of:= [.A42] + 1 -> 15 | B43: of:= [.A43] + 1 -> 16 | C43: of:= [.B43] + 1 -> 17 | D43: of:= [.C43] + 1 -> 18 | E43: of:= [.D43] + 1 -> 19 | F43: of:= [.E43] + 1 -> 20 | G43: of:= [.F43] + 1 -> 21 | H43: of:= [.G43] + 1 -> 22 | I43: of:= [.H43] + 1 -> 23 | J43: of:= [.I43] + 1 -> 24 | K43: of:= [.J43] + 1 -> 25 | L43: of:= [.K43] + 1 -> 26 | M43: of:= [.L43] + 1 -> 27 | N43: of:= [.M43] + 1 -> 28 | O43: of:= [.N43] + 1 -> 29 | P43: of:= [.O43] + 1 -> 30 | Q43: of:= [.P43] + 1 -> 31 | R43: of:= [.Q43] + 1 -> 32 | S43: of:= [.R43] + 1 -> 33 | T43: of:= [.S43] + 1 -> 34 | U43: of:= [.T43] + 1 -> 35 | V43: of:= [.U43] + 1 -> 36 | W43: of:= [.V43] + 1 -> 37 | X43: of:= [.W43] + 1 -> 38 | Y43: of:= [.X43] + 1 -> 39 | Z43: of:= [.Y43] + 1 -> 40 | AA43: of:= [.Z43] + 1 -> 41 | AB43: of:= [.AA43] + 1 -> 42 | AC43: of:= [.AB43] + 1 -> 43 | AD43: of:= [.AC43] + 1 -> 44 | AE43: of:= [.AD43] + 1 -> 45 | AF43: of:= [.AE43] + 1 -> 46 | AG43: of:= [.AF43] + 1 -> 47 | AH43: of:= [.AG43] + 1 -> 48 | AI43: of:= [.AH43] + 1 -> 49 | AJ43: of:= [.AI43] + 1 -> 50 | AK43: of:= [.AJ43] + 1 -> 51 | AL43: of:= [.AK43] + 1 -> 52 | AM43: of:= [.AL43] + 1 -> 53 | AN43: of:= [.AM43] + 1 -> 54 | AO43: of:= [.AN43] + 1 -> 55 | AP43: of:= [.AO43] + 1 -> 56 | AQ43: of:= [.AP43] + 1 -> 57 | AR43: of:= [.AQ43] + 1 -> 58 | AS43: of:= [.AR43] + 1 -> 59 | AT43: of:= [.AS43] + 1 -> 60 | AU43: of:= [.AT43] + 1 -> 61 | AV43: of:= [.AU43] + 1 -> 62 | AW43: of:= [.AV43] + 1 -> 63 | AX43: of:= [.AW43] + 1 -> 64 | AY43: of:= [.AX43] + 1 -> 65 | AZ43: of:= [.AY43] + 1 -> 66 | BA43: of:= [.AZ43] + 1 -> 67 | BB43: of:= [.BA43] + 1 -> 68 | BC43: of:= [.BB43] + 1 -> 69 | BD43: of:= [.BC43] + 1 -> 70 | BE43: of:= [.BD43] + 1 -> 71 | BF43: of:= [.BE43] + 1 -> 72 | BG43: of:= [.BF43] + 1 -> 73 | BH43: of:= [.BG43] + 1 -> 74 | BI43: of:= [.BH43] + 1 -> 75 | BJ43: of:= [.BI43] + 1 -> 76 | BK43: of:= [.BJ43] + 1 -> 77 | BL43: of:= [.BK43] + 1 -> 78
A44: of:= [.A43] + 1 -> 16 | B44: of:= [.A44] + 1 -> 17 | C44: of:= [.B44] + 1 -> 18 | D44: of:= [.C44] + 1 -> 19 | E44: of:= [.D44] + 1 -> 20 | F44: of:= [.E44] + 1 -> 21 | G44: of:= [.F44] + 1 -> 22 | H44: of:= [.G44] + 1 -> 23 | I44: of:= [.H44] + 1 -> 24 | J44: of:= [.I44] + 1 -> 25 | K44: of:= [.J44] + 1 -> 26 | L44: of:= [.K44] + 1 -> 27 | M44: of:= [.L44] + 1 -> 28 | N44: of:= [.M44] + 1 -> 29 | O44: of:= [.N44] + 1 -> 30 | P44: of:= [.O44] + 1 -> 31 | Q44: of:= [.P44] + 1 -> 32 | R44: of:= [.Q44] + 1 -> 33 | S44: of:= [.R44] + 1 -> 34 | T44: of:= [.S44] + 1 -> 35 | U44: of:= [.T44] + 1 -> 36 | V44: of:= [.U44] + 1 -> 37 | W44: of:= [.V44] + 1 -> 38 | X44: of:= [.W44] + 1 -> 39 | Y44: of:= [.X44] + 1 -> 40 | Z44: of:= [.Y44] + 1 -> 41 | AA44: of:= [.Z44] + 1 -> 42 | AB44: of:= [.AA44] + 1 -> 43 | AC44: of:= [.AB44] + 1 -> 44 | AD44: of:= [.AC44] + 1 -> 45 | AE44: of:= [.AD44] + 1 -> 46 | AF44: of:= [.AE44] + 1 -> 47 | AG44: of:= [.AF44] + 1 -> 48 | AH44: of:= [.AG44] + 1 -> 49 | AI44: of:= [.AH44] + 1 -> 50 | AJ44: of:= [.AI44] + 1 -> 51 | AK44: of:= [.AJ44] + 1 -> 52 | AL44: of:= [.AK44] + 1 -> 53 | AM44: of:= [.AL44] + 1 -> 54 | AN44: of:= [.AM44] + 1 -> 55 | AO44: of:= [.AN44] + 1 -> 56 | AP44: of:= [.AO44] + 1 -> 57 | AQ44: of:= [.AP44] + 1 -> 58 | AR44: of:= [.AQ44] + 1 -> 59 | AS44: of:= [.AR44] + 1 -> 60 | AT44: of:= [.AS44] + 1 -> 61 | AU44: of:= [.AT44] + 1 -> 62 | AV44: of:= [.AU44] + 1 -> 63 | AW44: of:= [.AV44] + 1 -> 64 | AX44: of:= [.AW44] + 1 -> 65 | AY44: of:= [.AX44] + 1 -> 66 | AZ44: of:= [.AY44] + 1 -> 67 | BA44: of:= [.AZ44] + 1 -> 68 | BB44: of:= [.BA44] + 1 -> 69 | BC44: of:= [.BB44] + 1 -> 70 | BD44: of:= [.BC44] + 1 -> 71 | BE44: of:= [.BD44] + 1 -> 72 | BF44: of:= [.BE44] + 1 -> 73 | BG44: of:= [.BF44] + 1 -> 74 | BH44: of:= [.BG44] + 1 -> 75 | BI44: of:= [.BH44] + 1 -> 76 | BJ44: of:= [.BI44] + 1 -> 77 | BK44: of:= [.BJ44] + 1 -> 78 | BL44: of:= [.BK44] + 1 -> 79
A45: of:= [.A44] + 1 -> 17 | B45: of:= [.A45] + 1 -> 18 | C45: of:= [.B45] + 1 -> 19 | D45: of:= [.C45] + 1 -> 20 | E45: of:= [.D45] + 1 -> 21 | F45: of:= [.E45] + 1 -> 22 | G45: of:= [.F45] + 1 -> 23 | H45: of:= [.G45] + 1 -> 24 | I45: of:= [.H45] + 1 -> 25 | J45: of:= [.I45] + 1 -> 26 | K45: of:= [.J45] + 1 -> 27 | L45: of:= [.K45] + 1 -> 28 | M45: of:= [.L45] + 1 -> 29 | N45: of:= [.M45] + 1 -> 30 | O45: of:= [.N45] + 1 -> 31 | P45: of:= [.O45] + 1 -> 32 | Q45: of:= [.P45] + 1 -> 33 | R45: of:= [.Q45] + 1 -> 34 | S45: of:= [.R45] + 1 -> 35 | T45: of:= [.S45] + 1 -> 36 | U45: of:= [.T45] + 1 -> 37 | V45: of:= [.U45] + 1 -> 38 | W45: of:= [.V45] + 1 -> 39 | X45: of:= [.W45] + 1 -> 40 | Y45: of:= [.X45] + 1 -> 41 | Z45: of:= [.Y45] + 1 -> 42 | AA45: of:= [.Z45] + 1 -> 43 | AB45: of:= [.AA45] + 1 -> 44 | AC45: of:= [.AB45] + 1 -> 45 | AD45: of:= [.AC45] + 1 -> 46 | AE45: of:= [.AD45] + 1 -> 47 | AF45: of:= [.AE45] + 1 -> 48 | AG45: of:= [.AF45] + 1 -> 49 | AH45: of:= [.AG45] + 1 -> 50 | AI45: of:= [.AH45] + 1 -> 51 | AJ45: of:= [.AI45] + 1 -> 52 | AK45: of:= [.AJ45] + 1 -> 53 | AL45: of:= [.AK45] + 1 -> 54 | AM45: of:= [.AL45] + 1 -> 55 | AN45: of:= [.AM45] + 1 -> 56 | AO45: of:= [.AN45] + 1 -> 57 | AP45: of:= [.AO45] + 1 -> 58 | AQ45: of:= [.AP45] + 1 -> 59 | AR45: of:= [.AQ45] + 1 -> 60 | AS45: of:= [.AR45] + 1 -> 61 | AT45: of:= [.AS45] + 1 -> 62 | AU45: of:= [.AT45] + 1 -> 63 | AV45: of:= [.AU45] + 1 -> 64 | AW45: of:= [.AV45] + 1 -> 65 | AX45: of:= [.AW45] + 1 -> 66 | AY45: of:= [.AX45] + 1 -> 67 | AZ45: of:= [.AY45] + 1 -> 68 | BA45: of:= [.AZ45] + 1 -> 69 | BB45: of:= [.BA45] + 1 -> 70 | BC45: of:= [.BB45] + 1 -> 71 | BD45: of:= [.BC45] + 1 -> 72 | BE45: of:= [.BD45] + 1 -> 73 | BF45: of:= [.BE45] + 1 -> 74 | BG45: of:= [.BF45] + 1 -> 75 | BH45: of:= [.BG45] + 1 -> 76 | BI45: of:= [.BH45] + 1 -> 77 | BJ45: of:= [.BI45] + 1 -> 78 | BK45: of:= [.BJ45] + 1 -> 79 | BL45: of:= [.BK45] + 1 -> 80
A46: of:= [.A45] + 1 -> 18 | B46: of:= [.A46] + 1 -> 19 | C46: of:= [.B46] + 1 -> 20 | D46: of:= [.C46] + 1 -> 21 | E46: of:= [.D46] + 1 -> 22 | F46: of:= [.E46] + 1 -> 23 | G46: of:= [.F46] + 1 -> 24 | H46: of:= [.G46] + 1 -> 25 | I46: of:= [.H46] + 1 -> 26 | J46: of:= [.I46] + 1 -> 27 | K46: of:= [.J46] + 1 -> 28 | L46: of:= [.K46] + 1 -> 29 | M46: of:= [.L46] + 1 -> 30 | N46: of:= [.M46] + 1 -> 31 | O46: of:= [.N46] + 1 -> 32 | P46: of:= [.O46] + 1 -> 33 | Q46: of:= [.P46] + 1 -> 34 | R46: of:= [.Q46] + 1 -> 35 | S46: of:= [.R46] + 1 -> 36 | T46: of:= [.S46] + 1 -> 37 | U46: of:= [.T46] + 1 -> 38 | V46: of:= [.U46] + 1 -> 39 | W46: of:= [.V46] + 1 -> 40 | X46: of:= [.W46] + 1 -> 41 | Y46: of:= [.X46] + 1 -> 42 | Z46: of:= [.Y46] + 1 -> 43 | AA46: of:= [.Z46] + 1 -> 44 | AB46: of:= [.AA46] + 1 -> 45 | AC46: of:= [.AB46] + 1 -> 46 | AD46: of:= [.AC46] + 1 -> 47 | AE46: of:= [.AD46] + 1 -> 48 | AF46: of:= [.AE46] + 1 -> 49 | AG46: of:= [.AF46] + 1 -> 50 | AH46: of:= [.AG46] + 1 -> 51 | AI46: of:= [.AH46] + 1 -> 52 | AJ46: of:= [.AI46] + 1 -> 53 | AK46: of:= [.AJ46] + 1 -> 54 | AL46: of:= [.AK46] + 1 -> 55 | AM46: of:= [.AL46] + 1 -> 56 | AN46: of:= [.AM46] + 1 -> 57 | AO46: of:= [.AN46] + 1 -> 58 | AP46: of:= [.AO46] + 1 -> 59 | AQ46: of:= [.AP46] + 1 -> 60 | AR46: of:= [.AQ46] + 1 -> 61 | AS46: of:= [.AR46] + 1 -> 62 | AT46: of:= [.AS46] + 1 -> 63 | AU46: of:= [.AT46] + 1 -> 64 | AV46: of:= [.AU46] + 1 -> 65 | AW46: of:= [.AV46] + 1 -> 66 | AX46: of:= [.AW46] + 1 -> 67 | AY46: of:= [.AX46] + 1 -> 68 | AZ46: of:= [.AY46] + 1 -> 69 | BA46: of:= [.AZ46] + 1 -> 70 | BB46: of:= [.BA46] + 1 -> 71 | BC46: of:= [.BB46] + 1 -> 72 | BD46: of:= [.BC46] + 1 -> 73 | BE46: of:= [.BD46] + 1 -> 74 | BF46: of:= [.BE46] + 1 -> 75 | BG46: of:= [.BF46] + 1 -> 76 | BH46: of:= [.BG46] + 1 -> 77 | BI46: of:= [.BH46] + 1 -> 78 | BJ46: of:= [.BI46] + 1 -> 79 | BK46: of:= [.BJ46] + 1 -> 80 | BL46: of:= [.BK46] + 1 -> 81
A47: of:= [.A46] + 1 -> 19 | B47: of:= [.A47] + 1 -> 20 | C47: of:= [.B47] + 1 -> 21 | D47: of:= [.C47] + 1 -> 22 | E47: of:= [.D47] + 1 -> 23 | F47: of:= [.E47] + 1 -> 24 | G47: of:= [.F47] + 1 -> 25 | H47: of:= [.G47] + 1 -> 26 | I47: of:= [.H47] + 1 -> 27 | J47: of:= [.I47] + 1 -> 28 | K47: of:= [.J47] + 1 -> 29 | L47: of:= [.K47] + 1 -> 30 | M47: of:= [.L47] + 1 -> 31 | N47: of:= [.M47] + 1 -> 32 | O47: of:= [.N47] + 1 -> 33 | P47: of:= [.O47] + 1 -> 34 | Q47: of:= [.P47] + 1 -> 35 | R47: of:= [.Q47] + 1 -> 36 | S47: of:= [.R47] + 1 -> 37 | T47: of:= [.S47] + 1 -> 38 | U47: of:= [.T47] + 1 -> 39 | V47: of:= [.U47] + 1 -> 40 | W47: of:= [.V47] + 1 -> 41 | X47: of:= [.W47] + 1 -> 42 | Y47: of:= [.X47] + 1 -> 43 | Z47: of:= [.Y47] + 1 -> 44 | AA47: of:= [.Z47] + 1 -> 45 | AB47: of:= [.AA47] + 1 -> 46 | AC47: of:= [.AB47] + 1 -> 47 | AD47: of:= [.AC47] + 1 -> 48 | AE47: of:= [.AD47] + 1 -> 49 | AF47: of:= [.AE47] + 1 -> 50 | AG47: of:= [.AF47] + 1 -> 51 | AH47: of:= [.AG47] + 1 -> 52 | AI47: of:= [.AH47] + 1 -> 53 | AJ47: of:= [.AI47] + 1 -> 54 | AK47: of:= [.AJ47] + 1 -> 55 | AL47: of:= [.AK47] + 1 -> 56 | AM47: of:= [.AL47] + 1 -> 57 | AN47: of:= [.AM47] + 1 -> 58 | AO47: of:= [.AN47] + 1 -> 59 | AP47: of:= [.AO47] + 1 -> 60 | AQ47: of:= [.AP47] + 1 -> 61 | AR47: of:= [.AQ47] + 1 -> 62 | AS47: of:= [.AR47] + 1 -> 63 | AT47: of:= [.AS47] + 1 -> 64 | AU47: of:= [.AT47] + 1 -> 65 | AV47: of:= [.AU47] + 1 -> 66 | AW47: of:= [.AV47] + 1 -> 67 | AX47: of:= [.AW47] + 1 -> 68 | AY47: of:= [.AX47] + 1 -> 69 | AZ47: of:= [.AY47] + 1 -> 70 | BA47: of:= [.AZ47] + 1 -> 71 | BB47: of:= [.BA47] + 1 -> 72 | BC47: of:= [.BB47] + 1 -> 73 | BD47: of:= [.BC47] + 1 -> 74 | BE47: of:= [.BD47] + 1 -> 75 | BF47: of:= [.BE47] + 1 -> 76 | BG47: of:= [.BF47] + 1 -> 77 | BH47: of:= [.BG47] + 1 -> 78 | BI47: of:= [.BH47] + 1 -> 79 | BJ47: of:= [.BI47] + 1 -> 80 | BK47: of:= [.BJ47] + 1 -> 81 | BL47: of:= [.BK47] + 1 -> 82
A48: of:= [.A47] + 1 -> 20 | B48: of:= [.A48] + 1 -> 21 | C48: of:= [.B48] + 1 -> 22 | D48: of:= [.C48] + 1 -> 23 | E48: of:= [.D48] + 1 -> 24 | F48: of:= [.E48] + 1 -> 25 | G48: of:= [.F48] + 1 -> 26 | H48: of:= [.G48] + 1 -> 27 | I48: of:= [.H48] + 1 -> 28 | J48: of:= [.I48] + 1 -> 29 | K48: of:= [.J48] + 1 -> 30 | L48: of:= [.K48] + 1 -> 31 | M48: of:= [.L48] + 1 -> 32 | N48: of:= [.M48] + 1 -> 33 | O48: of:= [.N48] + 1 -> 34 | P48: of:= [.O48] + 1 -> 35 | Q48: of:= [.P48] + 1 -> 36 | R48: of:= [.Q48] + 1 -> 37 | S48: of:= [.R48] + 1 -> 38 | T48: of:= [.S48] + 1 -> 39 | U48: of:= [.T48] + 1 -> 40 | V48: of:= [.U48] + 1 -> 41 | W48: of:= [.V48] + 1 -> 42 | X48: of:= [.W48] + 1 -> 43 | Y48: of:= [.X48] + 1 -> 44 | Z48: of:= [.Y48] + 1 -> 45 | AA48: of:= [.Z48] + 1 -> 46 | AB48: of:= [.AA48] + 1 -> 47 | AC48: of:= [.AB48] + 1 -> 48 | AD48: of:= [.AC48] + 1 -> 49 | AE48: of:= [.AD48] + 1 -> 50 | AF48: of:= [.AE48] + 1 -> 51 | AG48: of:= [.AF48] + 1 -> 52 | AH48: of:= [.AG48] + 1 -> 53 | AI48: of:= [.AH48] + 1 -> 54 | AJ48: of:= [.AI48] + 1 -> 55 | AK48: of:= [.AJ48] + 1 -> 56 | AL48: of:= [.AK48] + 1 -> 57 | AM48: of:= [.AL48] + 1 -> 58 | AN48: of:= [.AM48] + 1 -> 59 | AO48: of:= [.AN48] + 1 -> 60 | AP48: of:= [.AO48] + 1 -> 61 | AQ48: of:= [.AP48] + 1 -> 62 | AR48: of:= [.AQ48] + 1 -> 63 | AS48: of:= [.AR48] + 1 -> 64 | AT48: of:= [.AS48] + 1 -> 65 | AU48: of:= [.AT48] + 1 -> 66 | AV48: of:= [.AU48] + 1 -> 67 | AW48: of:= [.AV48] + 1 -> 68 | AX48: of:= [.AW48] + 1 -> 69 | AY48: of:= [.AX48] + 1 -> 70 | AZ48: of:= [.AY48] + 1 -> 71 | BA48: of:= [.AZ48] + 1 -> 72 | BB48: of:= [.BA48] + 1 -> 73 | BC48: of:= [.BB48] + 1 -> 74 | BD48: of:= [.BC48] + 1 -> 75 | BE48: of:= [.BD48] + 1 -> 76 | BF48: of:= [.BE48] + 1 -> 77 | BG48: of:= [.BF48] + 1 -> 78 | BH48: of:= [.BG48] + 1 -> 79 | BI48: of:= [.BH48] + 1 -> 80 | BJ48: of:= [.BI48] + 1 -> 81 | BK48: of:= [.BJ48] + 1 -> 82 | BL48: of:= [.BK48] + 1 -> 83
A49: of:= 5 -> 5 | B49: of:= [.A49] + 1 -> 6 | C49: of:= [.B49] + 1 -> 7 | D49: of:= [.C49] + 1 -> 8 | E49: of:= [.D49] + 1 -> 9 | F49: of:= [.E49] + 1 -> 10 | G49: of:= [.F49] + 1 -> 11 | H49: of:= [.G49] + 1 -> 12 | I49: of:= [.H49] + 1 -> 13 | J49: of:= [.I49] + 1 -> 14 | K49: of:= [.J49] + 1 -> 15 | L49: of:= [.K49] + 1 -> 16 | M49: of:= [.L49] + 1 -> 17 | N49: of:= [.M49] + 1 -> 18 | O49: of:= [.N49] + 1 -> 19 | P49: of:= [.O49] + 1 -> 20 | Q49: of:= [.P49] + 1 -> 21 | R49: of:= [.Q49] + 1 -> 22 | S49: of:= [.R49] + 1 -> 23 | T49: of:= [.S49] + 1 -> 24 | U49: of:= [.T49] + 1 -> 25 | V49: of:= [.U49] + 1 -> 26 | W49: of:= [.V49] + 1 -> 27 | X49: of:= [.W49] + 1 -> 28 | Y49: of:= [.X49] + 1 -> 29 | Z49: of:= [.Y49] + 1 -> 30 | AA49: of:= [.Z49] + 1 -> 31 | AB49: of:= [.AA49] + 1 -> 32 | AC49: of:= [.AB49] + 1 -> 33 | AD49: of:= [.AC49] + 1 -> 34 | AE49: of:= [.AD49] + 1 -> 35 | AF49: of:= [.AE49] + 1 -> 36 | AG49: of:= [.AF49] + 1 -> 37 | AH49: of:= [.AG49] + 1 -> 38 | AI49: of:= [.AH49] + 1 -> 39 | AJ49: of:= [.AI49] + 1 -> 40 | AK49: of:= [.AJ49] + 1 -> 41 | AL49: of:= [.AK49] + 1 -> 42 | AM49: of:= [.AL49] + 1 -> 43 | AN49: of:= [.AM49] + 1 -> 44 | AO49: of:= [.AN49] + 1 -> 45 | AP49: of:= [.AO49] + 1 -> 46 | AQ49: of:= [.AP49] + 1 -> 47 | AR49: of:= [.AQ49] + 1 -> 48 | AS49: of:= [.AR49] + 1 -> 49 | AT49: of:= [.AS49] + 1 -> 50 | AU49: of:= [.AT49] + 1 -> 51 | AV49: of:= [.AU49] + 1 -> 52 | AW49: of:= [.AV49] + 1 -> 53 | AX49: of:= [.AW49] + 1 -> 54 | AY49: of:= [.AX49] + 1 -> 55 | AZ49: of:= [.AY49] + 1 -> 56 | BA49: of:= [.AZ49] + 1 -> 57 | BB49: of:= [.BA49] + 1 -> 58 | BC49: of:= [.BB49] + 1 -> 59 | BD49: of:= [.BC49] + 1 -> 60 | BE49: of:= [.BD49] + 1 -> 61 | BF49: of:= [.BE49] + 1 -> 62 | BG49: of:= [.BF49] + 1 -> 63 | BH49: of:= [.BG49] + 1 -> 64 | BI49: of:= [.BH49] + 1 -> 65 | BJ49: of:= [.BI49] + 1 -> 66 | BK49: of:= [.BJ49] + 1 -> 67 | BL49: of:= [.BK49] + 1 -> 68
A50: of:= [.A49] + 1 -> 6 | B50: of:= [.A50] + 1 -> 7 | C50: of:= [.B50] + 1 -> 8 | D50: of:= [.C50] + 1 -> 9 | E50: of:= [.D50] + 1 -> 10 | F50: of:= [.E50] + 1 -> 11 | G50: of:= [.F50] + 1 -> 12 | H50: of:= [.G50] + 1 -> 13 | I50: of:= [.H50] + 1 -> 14 | J50: of:= [.I50] + 1 -> 15 | K50: of:= [.J50] + 1 -> 16 | L50: of:= [.K50] + 1 -> 17 | M50: of:= [.L50] + 1 -> 18 | N50: of:= [.M50] + 1 -> 19 | O50: of:= [.N50] + 1 -> 20 | P50: of:= [.O50] + 1 -> 21 | Q50: of:= [.P50] + 1 -> 22 | R50: of:= [.Q50] + 1 -> 23 | S50: of:= [.R50] + 1 -> 24 | T50: of:= [.S50] + 1 -> 25 | U50: of:= [.T50] + 1 -> 26 | V50: of:= [.U50] + 1 -> 27 | W50: of:= [.V50] + 1 -> 28 | X50: of:= [.W50] + 1 -> 29 | Y50: of:= [.X50] + 1 -> 30 | Z50: of:= [.Y50] + 1 -> 31 | AA50: of:= [.Z50] + 1 -> 32 | AB50: of:= [.AA50] + 1 -> 33 | AC50: of:= [.AB50] + 1 -> 34 | AD50: of:= [.AC50] + 1 -> 35 | AE50: of:= [.AD50] + 1 -> 36 | AF50: of:= [.AE50] + 1 -> 37 | AG50: of:= [.AF50] + 1 -> 38 | AH50: of:= [.AG50] + 1 -> 39 | AI50: of:= [.AH50] + 1 -> 40 | AJ50: of:= [.AI50] + 1 -> 41 | AK50: of:= [.AJ50] + 1 -> 42 | AL50: of:= [.AK50] + 1 -> 43 | AM50: of:= [.AL50] + 1 -> 44 | AN50: of:= [.AM50] + 1 -> 45 | AO50: of:= [.AN50] + 1 -> 46 | AP50: of:= [.AO50] + 1 -> 47 | AQ50: of:= [.AP50] + 1 -> 48 | AR50: of:= [.AQ50] + 1 -> 49 | AS50: of:= [.AR50] + 1 -> 50 | AT50: of:= [.AS50] + 1 -> 51 | AU50: of:= [.AT50] + 1 -> 52 | AV50: of:= [.AU50] + 1 -> 53 | AW50: of:= [.AV50] + 1 -> 54 | AX50: of:= [.AW50] + 1 -> 55 | AY50: of:= [.AX50] + 1 -> 56 | AZ50: of:= [.AY50] + 1 -> 57 | BA50: of:= [.AZ50] + 1 -> 58 | BB50: of:= [.BA50] + 1 -> 59 | BC50: of:= [.BB50] + 1 -> 60 | BD50: of:= [.BC50] + 1 -> 61 | BE50: of:= [.BD50] + 1 -> 62 | BF50: of:= [.BE50] + 1 -> 63 | BG50: of:= [.BF50] + 1 -> 64 | BH50: of:= [.BG50] + 1 -> 65 | BI50: of:= [.BH50] + 1 -> 66 | BJ50: of:= [.BI50] + 1 -> 67 | BK50: of:= [.BJ50] + 1 -> 68 | BL50: of:= [.BK50] + 1 -> 69
A51: of:= [.A50] + 1 -> 7 | B51: of:= [.A51] + 1 -> 8 | C51: of:= [.B51] + 1 -> 9 | D51: of:= [.C51] + 1 -> 10 | E51: of:= [.D51] + 1 -> 11 | F51: of:= [.E51] + 1 -> 12 | G51: of:= [.F51] + 1 -> 13 | H51: of:= [.G51] + 1 -> 14 | I51: of:= [.H51] + 1 -> 15 | J51: of:= [.I51] + 1 -> 16 | K51: of:= [.J51] + 1 -> 17 | L51: of:= [.K51] + 1 -> 18 | M51: of:= [.L51] + 1 -> 19 | N51: of:= [.M51] + 1 -> 20 | O51: of:= [.N51] + 1 -> 21 | P51: of:= [.O51] + 1 -> 22 | Q51: of:= [.P51] + 1 -> 23 | R51: of:= [.Q51] + 1 -> 24 | S51: of:= [.R51] + 1 -> 25 | T51: of:= [.S51] + 1 -> 26 | U51: of:= [.T51] + 1 -> 27 | V51: of:= [.U51] + 1 -> 28 | W51: of:= [.V51] + 1 -> 29 | X51: of:= [.W51] + 1 -> 30 | Y51: of:= [.X51] + 1 -> 31 | Z51: of:= [.Y51] + 1 -> 32 | AA51: of:= [.Z51] + 1 -> 33 | AB51: of:= [.AA51] + 1 -> 34 | AC51: of:= [.AB51] + 1 -> 35 | AD51: of:= [.AC51] + 1 -> 36 | AE51: of:= [.AD51] + 1 -> 37 | AF51: of:= [.AE51] + 1 -> 38 | AG51: of:= [.AF51] + 1 -> 39 | AH51: of:= [.AG51] + 1 -> 40 | AI51: of:= [.AH51] + 1 -> 41 | AJ51: of:= [.AI51] + 1 -> 42 | AK51: of:= [.AJ51] + 1 -> 43 | AL51: of:= [.AK51] + 1 -> 44 | AM51: of:= [.AL51] + 1 -> 45 | AN51: of:= [.AM51] + 1 -> 46 | AO51: of:= [.AN51] + 1 -> 47 | AP51: of:= [.AO51] + 1 -> 48 | AQ51: of:= [.AP51] + 1 -> 49 | AR51: of:= [.AQ51] + 1 -> 50 | AS51: of:= [.AR51] + 1 -> 51 | AT51: of:= [.AS51] + 1 -> 52 | AU51: of:= [.AT51] + 1 -> 53 | AV51: of:= [.AU51] + 1 -> 54 | AW51: of:= [.AV51] + 1 -> 55 | AX51: of:= [.AW51] + 1 -> 56 | AY51: of:= [.AX51] + 1 -> 57 | AZ51: of:= [.AY51] + 1 -> 58 | BA51: of:= [.AZ51] + 1 -> 59 | BB51: of:= [.BA51] + 1 -> 60 | BC51: of:= [.BB51] + 1 -> 61 | BD51: of:= [.BC51] + 1 -> 62 | BE51: of:= [.BD51] + 1 -> 63 | BF51: of:= [.BE51] + 1 -> 64 | BG51: of:= [.BF51] + 1 -> 65 | BH51: of:= [.BG51] + 1 -> 66 | BI51: of:= [.BH51] + 1 -> 67 | BJ51: of:= [.BI51] + 1 -> 68 | BK51: of:= [.BJ51] + 1 -> 69 | BL51: of:= [.BK51] + 1 -> 70
A52: of:= [.A51] + 1 -> 8 | B52: of:= [.A52] + 1 -> 9 | C52: of:= [.B52] + 1 -> 10 | D52: of:= [.C52] + 1 -> 11 | E52: of:= [.D52] + 1 -> 12 | F52: of:= [.E52] + 1 -> 13 | G52: of:= [.F52] + 1 -> 14 | H52: of:= [.G52] + 1 -> 15 | I52: of:= [.H52] + 1 -> 16 | J52: of:= [.I52] + 1 -> 17 | K52: of:= [.J52] + 1 -> 18 | L52: of:= [.K52] + 1 -> 19 | M52: of:= [.L52] + 1 -> 20 | N52: of:= [.M52] + 1 -> 21 | O52: of:= [.N52] + 1 -> 22 | P52: of:= [.O52] + 1 -> 23 | Q52: of:= [.P52] + 1 -> 24 | R52: of:= [.Q52] + 1 -> 25 | S52: of:= [.R52] + 1 -> 26 | T52: of:= [.S52] + 1 -> 27 | U52: of:= [.T52] + 1 -> 28 | V52: of:= [.U52] + 1 -> 29 | W52: of:= [.V52] + 1 -> 30 | X52: of:= [.W52] + 1 -> 31 | Y52: of:= [.X52] + 1 -> 32 | Z52: of:= [.Y52] + 1 -> 33 | AA52: of:= [.Z52] + 1 -> 34 | AB52: of:= [.AA52] + 1 -> 35 | AC52: of:= [.AB52] + 1 -> 36 | AD52: of:= [.AC52] + 1 -> 37 | AE52: of:= [.AD52] + 1 -> 38 | AF52: of:= [.AE52] + 1 -> 39 | AG52: of:= [.AF52] + 1 -> 40 | AH52: of:= [.AG52] + 1 -> 41 | AI52: of:= [.AH52] + 1 -> 42 | AJ52: of:= [.AI52] + 1 -> 43 | AK52: of:= [.AJ52] + 1 -> 44 | AL52: of:= [.AK52] + 1 -> 45 | AM52: of:= [.AL52] + 1 -> 46 | AN52: of:= [.AM52] + 1 -> 47 | AO52: of:= [.AN52] + 1 -> 48 | AP52: of:= [.AO52] + 1 -> 49 | AQ52: of:= [.AP52] + 1 -> 50 | AR52: of:= [.AQ52] + 1 -> 51 | AS52: of:= [.AR52] + 1 -> 52 | AT52: of:= [.AS52] + 1 -> 53 | AU52: of:= [.AT52] + 1 -> 54 | AV52: of:= [.AU52] + 1 -> 55 | AW52: of:= [.AV52] + 1 -> 56 | AX52: of:= [.AW52] + 1 -> 57 | AY52: of:= [.AX52] + 1 -> 58 | AZ52: of:= [.AY52] + 1 -> 59 | BA52: of:= [.AZ52] + 1 -> 60 | BB52: of:= [.BA52] + 1 -> 61 | BC52: of:= [.BB52] + 1 -> 62 | BD52: of:= [.BC52] + 1 -> 63 | BE52: of:= [.BD52] + 1 -> 64 | BF52: of:= [.BE52] + 1 -> 65 | BG52: of:= [.BF52] + 1 -> 66 | BH52: of:= [.BG52] + 1 -> 67 | BI52: of:= [.BH52] + 1 -> 68 | BJ52: of:= [.BI52] + 1 -> 69 | BK52: of:= [.BJ52] + 1 -> 70 | BL52: of:= [.BK52] + 1 -> 71
A53: of:= [.A52] + 1 -> 9 | B53: of:= [.A53] + 1 -> 10 | C53: of:= [.B53] + 1 -> 11 | D53: of:= [.C53] + 1 -> 12 | E53: of:= [.D53] + 1 -> 13 | F53: of:= [.E53] + 1 -> 14 | G53: of:= [.F53] + 1 -> 15 | H53: of:= [.G53] + 1 -> 16 | I53: of:= [.H53] + 1 -> 17 | J53: of:= [.I53] + 1 -> 18 | K53: of:= [.J53] + 1 -> 19 | L53: of:= [.K53] + 1 -> 20 | M53: of:= [.L53] + 1 -> 21 | N53: of:= [.M53] + 1 -> 22 | O53: of:= [.N53] + 1 -> 23 | P53: of:= [.O53] + 1 -> 24 | Q53: of:= [.P53] + 1 -> 25 | R53: of:= [.Q53] + 1 -> 26 | S53: of:= [.R53] + 1 -> 27 | T53: of:= [.S53] + 1 -> 28 | U53: of:= [.T53] + 1 -> 29 | V53: of:= [.U53] + 1 -> 30 | W53: of:= [.V53] + 1 -> 31 | X53: of:= [.W53] + 1 -> 32 | Y53: of:= [.X53] + 1 -> 33 | Z53: of:= [.Y53] + 1 -> 34 | AA53: of:= [.Z53] + 1 -> 35 | AB53: of:= [.AA53] + 1 -> 36 | AC53: of:= [.AB53] + 1 -> 37 | AD53: of:= [.AC53] + 1 -> 38 | AE53: of:= [.AD53] + 1 -> 39 | AF53: of:= [.AE53] + 1 -> 40 | AG53: of:= [.AF53] + 1 -> 41 | AH53: of:= [.AG53] + 1 -> 42 | AI53: of:= [.AH53] + 1 -> 43 | AJ53: of:= [.AI53] + 1 -> 44 | AK53: of:= [.AJ53] + 1 -> 45 | AL53: of:= [.AK53] + 1 -> 46 | AM53: of:= [.AL53] + 1 -> 47 | AN53: of:= [.AM53] + 1 -> 48 | AO53: of:= [.AN53] + 1 -> 49 | AP53: of:= [.AO53] + 1 -> 50 | AQ53: of:= [.AP53] + 1 -> 51 | AR53: of:= [.AQ53] + 1 -> 52 | AS53: of:= [.AR53] + 1 -> 53 | AT53: of:= [.AS53] + 1 -> 54 | AU53: of:= [.AT53] + 1 -> 55 | AV53: of:= [.AU53] + 1 -> 56 | AW53: of:= [.AV53] + 1 -> 57 | AX53: of:= [.AW53] + 1 -> 58 | AY53: of:= [.AX53] + 1 -> 59 | AZ53: of:= [.AY53] + 1 -> 60 | BA53: of:= [.AZ53] + 1 -> 61 | BB53: of:= [.BA53] + 1 -> 62 | BC53: of:= [.BB53] + 1 -> 63 | BD53: of:= [.BC53] + 1 -> 64 | BE53: of:= [.BD53] + 1 -> 65 | BF53: of:= [.BE53] + 1 -> 66 | BG53: of:= [.BF53] + 1 -> 67 | BH53: of:= [.BG53] + 1 -> 68 | BI53: of:= [.BH53] + 1 -> 69 | BJ53: of:= [.BI53] + 1 -> 70 | BK53: of:= [.BJ53] + 1 -> 71 | BL53: of:= [.BK53] + 1 -> 72
A54: of:= [.A53] + 1 -> 10 | B54: of:= [.A54] + 1 -> 11 | C54: of:= [.B54] + 1 -> 12 | D54: of:= [.C54] + 1 -> 13 | E54: of:= [.D54] + 1 -> 14 | F54: of:= [.E54] + 1 -> 15 | G54: of:= [.F54] + 1 -> 16 | H54: of:= [.G54] + 1 -> 17 | I54: of:= [.H54] + 1 -> 18 | J54: of:= [.I54] + 1 -> 19 | K54: of:= [.J54] + 1 -> 20 | L54: of:= [.K54] + 1 -> 21 | M54: of:= [.L54] + 1 -> 22 | N54: of:= [.M54] + 1 -> 23 | O54: of:= [.N54] + 1 -> 24 | P54: of:= [.O54] + 1 -> 25 | Q54: of:= [.P54] + 1 -> 26 | R54: of:= [.Q54] + 1 -> 27 | S54: of:= [.R54] + 1 -> 28 | T54: of:= [.S54] + 1 -> 29 | U54: of:= [.T54] + 1 -> 30 | V54: of:= [.U54] + 1 -> 31 | W54: of:= [.V54] + 1 -> 32 | X54: of:= [.W54] + 1 -> 33 | Y54: of:= [.X54] + 1 -> 34 | Z54: of:= [.Y54] + 1 -> 35 | AA54: of:= [.Z54] + 1 -> 36 | AB54: of:= [.AA54] + 1 -> 37 | AC54: of:= [.AB54] + 1 -> 38 | AD54: of:= [.AC54] + 1 -> 39 | AE54: of:= [.AD54] + 1 -> 40 | AF54: of:= [.AE54] + 1 -> 41 | AG54: of:= [.AF54] + 1 -> 42 | AH54: of:= [.AG54] + 1 -> 43 | AI54: of:= [.AH54] + 1 -> 44 | AJ54: of:= [.AI54] + 1 -> 45 | AK54: of:= [.AJ54] + 1 -> 46 | AL54: of:= [.AK54] + 1 -> 47 | AM54: of:= [.AL54] + 1 -> 48 | AN54: of:= [.AM54] + 1 -> 49 | AO54: of:= [.AN54] + 1 -> 50 | AP54: of:= [.AO54] + 1 -> 51 | AQ54: of:= [.AP54] + 1 -> 52 | AR54: of:= [.AQ54] + 1 -> 53 | AS54: of:= [.AR54] + 1 -> 54 | AT54: of:= [.AS54] + 1 -> 55 | AU54: of:= [.AT54] + 1 -> 56 | AV54: of:= [.AU54] + 1 -> 57 | AW54: of:= [.AV54] + 1 -> 58 | AX54: of:= [.AW54] + 1 -> 59 | AY54: of:= [.AX54] + 1 -> 60 | AZ54: of:= [.AY54] + 1 -> 61 | BA54: of:= [.AZ54] + 1 -> 62 | BB54: of:= [.BA54] + 1 -> 63 | BC54: of:= [.BB54] + 1 -> 64 | BD54: of:= [.BC54] + 1 -> 65 | BE54: of:= [.BD54] + 1 -> 66 | BF54: of:= [.BE54] + 1 -> 67 | BG54: of:= [.BF54] + 1 -> 68 | BH54: of:= [.BG54] + 1 -> 69 | BI54: of:= [.BH54] + 1 -> 70 | BJ54: of:= [.BI54] + 1 -> 71 | BK54: of:= [.BJ54] + 1 -> 72 | BL54: of:= [.BK54] + 1 -> 73
A55: of:= [.A54] + 1 -> 11 | B55: of:= [.A55] + 1 -> 12 | C55: of:= [.B55] + 1 -> 13 | D55: of:= [.C55] + 1 -> 14 | E55: of:= [.D55] + 1 -> 15 | F55: of:= [.E55] + 1 -> 16 | G55: of:= [.F55] + 1 -> 17 | H55: of:= [.G55] + 1 -> 18 | I55: of:= [.H55] + 1 -> 19 | J55: of:= [.I55] + 1 -> 20 | K55: of:= [.J55] + 1 -> 21 | L55: of:= [.K55] + 1 -> 22 | M55: of:= [.L55] + 1 -> 23 | N55: of:= [.M55] + 1 -> 24 | O55: of:= [.N55] + 1 -> 25 | P55: of:= [.O55] + 1 -> 26 | Q55: of:= [.P55] + 1 -> 27 | R55: of:= [.Q55] + 1 -> 28 | S55: of:= [.R55] + 1 -> 29 | T55: of:= [.S55] + 1 -> 30 | U55: of:= [.T55] + 1 -> 31 | V55: of:= [.U55] + 1 -> 32 | W55: of:= [.V55] + 1 -> 33 | X55: of:= [.W55] + 1 -> 34 | Y55: of:= [.X55] + 1 -> 35 | Z55: of:= [.Y55] + 1 -> 36 | AA55: of:= [.Z55] + 1 -> 37 | AB55: of:= [.AA55] + 1 -> 38 | AC55: of:= [.AB55] + 1 -> 39 | AD55: of:= [.AC55] + 1 -> 40 | AE55: of:= [.AD55] + 1 -> 41 | AF55: of:= [.AE55] + 1 -> 42 | AG55: of:= [.AF55] + 1 -> 43 | AH55: of:= [.AG55] + 1 -> 44 | AI55: of:= [.AH55] + 1 -> 45 | AJ55: of:= [.AI55] + 1 -> 46 | AK55: of:= [.AJ55] + 1 -> 47 | AL55: of:= [.AK55] + 1 -> 48 | AM55: of:= [.AL55] + 1 -> 49 | AN55: of:= [.AM55] + 1 -> 50 | AO55: of:= [.AN55] + 1 -> 51 | AP55: of:= [.AO55] + 1 -> 52 | AQ55: of:= [.AP55] + 1 -> 53 | AR55: of:= [.AQ55] + 1 -> 54 | AS55: of:= [.AR55] + 1 -> 55 | AT55: of:= [.AS55] + 1 -> 56 | AU55: of:= [.AT55] + 1 -> 57 | AV55: of:= [.AU55] + 1 -> 58 | AW55: of:= [.AV55] + 1 -> 59 | AX55: of:= [.AW55] + 1 -> 60 | AY55: of:= [.AX55] + 1 -> 61 | AZ55: of:= [.AY55] + 1 -> 62 | BA55: of:= [.AZ55] + 1 -> 63 | BB55: of:= [.BA55] + 1 -> 64 | BC55: of:= [.BB55] + 1 -> 65 | BD55: of:= [.BC55] + 1 -> 66 | BE55: of:= [.BD55] + 1 -> 67 | BF55: of:= [.BE55] + 1 -> 68 | BG55: of:= [.BF55] + 1 -> 69 | BH55: of:= [.BG55] + 1 -> 70 | BI55: of:= [.BH55] + 1 -> 71 | BJ55: of:= [.BI55] + 1 -> 72 | BK55: of:= [.BJ55] + 1 -> 73 | BL55: of:= [.BK55] + 1 -> 74
A56: of:= [.A55] + 1 -> 12 | B56: of:= [.A56] + 1 -> 13 | C56: of:= [.B56] + 1 -> 14 | D56: of:= [.C56] + 1 -> 15 | E56: of:= [.D56] + 1 -> 16 | F56: of:= [.E56] + 1 -> 17 | G56: of:= [.F56] + 1 -> 18 | H56: of:= [.G56] + 1 -> 19 | I56: of:= [.H56] + 1 -> 20 | J56: of:= [.I56] + 1 -> 21 | K56: of:= [.J56] + 1 -> 22 | L56: of:= [.K56] + 1 -> 23 | M56: of:= [.L56] + 1 -> 24 | N56: of:= [.M56] + 1 -> 25 | O56: of:= [.N56] + 1 -> 26 | P56: of:= [.O56] + 1 -> 27 | Q56: of:= [.P56] + 1 -> 28 | R56: of:= [.Q56] + 1 -> 29 | S56: of:= [.R56] + 1 -> 30 | T56: of:= [.S56] + 1 -> 31 | U56: of:= [.T56] + 1 -> 32 | V56: of:= [.U56] + 1 -> 33 | W56: of:= [.V56] + 1 -> 34 | X56: of:= [.W56] + 1 -> 35 | Y56: of:= [.X56] + 1 -> 36 | Z56: of:= [.Y56] + 1 -> 37 | AA56: of:= [.Z56] + 1 -> 38 | AB56: of:= [.AA56] + 1 -> 39 | AC56: of:= [.AB56] + 1 -> 40 | AD56: of:= [.AC56] + 1 -> 41 | AE56: of:= [.AD56] + 1 -> 42 | AF56: of:= [.AE56] + 1 -> 43 | AG56: of:= [.AF56] + 1 -> 44 | AH56: of:= [.AG56] + 1 -> 45 | AI56: of:= [.AH56] + 1 -> 46 | AJ56: of:= [.AI56] + 1 -> 47 | AK56: of:= [.AJ56] + 1 -> 48 | AL56: of:= [.AK56] + 1 -> 49 | AM56: of:= [.AL56] + 1 -> 50 | AN56: of:= [.AM56] + 1 -> 51 | AO56: of:= [.AN56] + 1 -> 52 | AP56: of:= [.AO56] + 1 -> 53 | AQ56: of:= [.AP56] + 1 -> 54 | AR56: of:= [.AQ56] + 1 -> 55 | AS56: of:= [.AR56] + 1 -> 56 | AT56: of:= [.AS56] + 1 -> 57 | AU56: of:= [.AT56] + 1 -> 58 | AV56: of:= [.AU56] + 1 -> 59 | AW56: of:= [.AV56] + 1 -> 60 | AX56: of:= [.AW56] + 1 -> 61 | AY56: of:= [.AX56] + 1 -> 62 | AZ56: of:= [.AY56] + 1 -> 63 | BA56: of:= [.AZ56] + 1 -> 64 | BB56: of:= [.BA56] + 1 -> 65 | BC56: of:= [.BB56] + 1 -> 66 | BD56: of:= [.BC56] + 1 -> 67 | BE56: of:= [.BD56] + 1 -> 68 | BF56: of:= [.BE56] + 1 -> 69 | BG56: of:= [.BF56] + 1 -> 70 | BH56: of:= [.BG56] + 1 -> 71 | BI56: of:= [.BH56] + 1 -> 72 | BJ56: of:= [.BI56] + 1 -> 73 | BK56: of:= [.BJ56] + 1 -> 74 | BL56: of:= [.BK56] + 1 -> 75
A57: of:= [.A56] + 1 -> 13 | B57: of:= [.A57] + 1 -> 14 | C57: of:= [.B57] + 1 -> 15 | D57: of:= [.C57] + 1 -> 16 | E57: of:= [.D57] + 1 -> 17 | F57: of:= [.E57] + 1 -> 18 | G57: of:= [.F57] + 1 -> 19 | H57: of:= [.G57] + 1 -> 20 | I57: of:= [.H57] + 1 -> 21 | J57: of:= [.I57] + 1 -> 22 | K57: of:= [.J57] + 1 -> 23 | L57: of:= [.K57] + 1 -> 24 | M57: of:= [.L57] + 1 -> 25 | N57: of:= [.M57] + 1 -> 26 | O57: of:= [.N57] + 1 -> 27 | P57: of:= [.O57] + 1 -> 28 | Q57: of:= [.P57] + 1 -> 29 | R57: of:= [.Q57] + 1 -> 30 | S57: of:= [.R57] + 1 -> 31 | T57: of:= [.S57] + 1 -> 32 | U57: of:= [.T57] + 1 -> 33 | V57: of:= [.U57] + 1 -> 34 | W57: of:= [.V57] + 1 -> 35 | X57: of:= [.W57] + 1 -> 36 | Y57: of:= [.X57] + 1 -> 37 | Z57: of:= [.Y57] + 1 -> 38 | AA57: of:= [.Z57] + 1 -> 39 | AB57: of:= [.AA57] + 1 -> 40 | AC57: of:= [.AB57] + 1 -> 41 | AD57: of:= [.AC57] + 1 -> 42 | AE57: of:= [.AD57] + 1 -> 43 | AF57: of:= [.AE57] + 1 -> 44 | AG57: of:= [.AF57] + 1 -> 45 | AH57: of:= [.AG57] + 1 -> 46 | AI57: of:= [.AH57] + 1 -> 47 | AJ57: of:= [.AI57] + 1 -> 48 | AK57: of:= [.AJ57] + 1 -> 49 | AL57: of:= [.AK57] + 1 -> 50 | AM57: of:= [.AL57] + 1 -> 51 | AN57: of:= [.AM57] + 1 -> 52 | AO57: of:= [.AN57] + 1 -> 53 | AP57: of:= [.AO57] + 1 -> 54 | AQ57: of:= [.AP57] + 1 -> 55 | AR57: of:= [.AQ57] + 1 -> 56 | AS57: of:= [.AR57] + 1 -> 57 | AT57: of:= [.AS57] + 1 -> 58 | AU57: of:= [.AT57] + 1 -> 59 | AV57: of:= [.AU57] + 1 -> 60 | AW57: of:= [.AV57] + 1 -> 61 | AX57: of:= [.AW57] + 1 -> 62 | AY57: of:= [.AX57] + 1 -> 63 | AZ57: of:= [.AY57] + 1 -> 64 | BA57: of:= [.AZ57] + 1 -> 65 | BB57: of:= [.BA57] + 1 -> 66 | BC57: of:= [.BB57] + 1 -> 67 | BD57: of:= [.BC57] + 1 -> 68 | BE57: of:= [.BD57] + 1 -> 69 | BF57: of:= [.BE57] + 1 -> 70 | BG57: of:= [.BF57] + 1 -> 71 | BH57: of:= [.BG57] + 1 -> 72 | BI57: of:= [.BH57] + 1 -> 73 | BJ57: of:= [.BI57] + 1 -> 74 | BK57: of:= [.BJ57] + 1 -> 75 | BL57: of:= [.BK57] + 1 -> 76
A58: of:= [.A57] + 1 -> 14 | B58: of:= [.A58] + 1 -> 15 | C58: of:= [.B58] + 1 -> 16 | D58: of:= [.C58] + 1 -> 17 | E58: of:= [.D58] + 1 -> 18 | F58: of:= [.E58] + 1 -> 19 | G58: of:= [.F58] + 1 -> 20 | H58: of:= [.G58] + 1 -> 21 | I58: of:= [.H58] + 1 -> 22 | J58: of:= [.I58] + 1 -> 23 | K58: of:= [.J58] + 1 -> 24 | L58: of:= [.K58] + 1 -> 25 | M58: of:= [.L58] + 1 -> 26 | N58: of:= [.M58] + 1 -> 27 | O58: of:= [.N58] + 1 -> 28 | P58: of:= [.O58] + 1 -> 29 | Q58: of:= [.P58] + 1 -> 30 | R58: of:= [.Q58] + 1 -> 31 | S58: of:= [.R58] + 1 -> 32 | T58: of:= [.S58] + 1 -> 33 | U58: of:= [.T58] + 1 -> 34 | V58: of:= [.U58] + 1 -> 35 | W58: of:= [.V58] + 1 -> 36 | X58: of:= [.W58] + 1 -> 37 | Y58: of:= [.X58] + 1 -> 38 | Z58: of:= [.Y58] + 1 -> 39 | AA58: of:= [.Z58] + 1 -> 40 | AB58: of:= [.AA58] + 1 -> 41 | AC58: of:= [.AB58] + 1 -> 42 | AD58: of:= [.AC58] + 1 -> 43 | AE58: of:= [.AD58] + 1 -> 44 | AF58: of:= [.AE58] + 1 -> 45 | AG58: of:= [.AF58] + 1 -> 46 | AH58: of:= [.AG58] + 1 -> 47 | AI58: of:= [.AH58] + 1 -> 48 | AJ58: of:= [.AI58] + 1 -> 49 | AK58: of:= [.AJ58] + 1 -> 50 | AL58: of:= [.AK58] + 1 -> 51 | AM58: of:= [.AL58] + 1 -> 52 | AN58: of:= [.AM58] + 1 -> 53 | AO58: of:= [.AN58] + 1 -> 54 | AP58: of:= [.AO58] + 1 -> 55 | AQ58: of:= [.AP58] + 1 -> 56 | AR58: of:= [.AQ58] + 1 -> 57 | AS58: of:= [.AR58] + 1 -> 58 | AT58: of:= [.AS58] + 1 -> 59 | AU58: of:= [.AT58] + 1 -> 60 | AV58: of:= [.AU58] + 1 -> 61 | AW58: of:= [.AV58] + 1 -> 62 | AX58: of:= [.AW58] + 1 -> 63 | AY58: of:= [.AX58] + 1 -> 64 | AZ58: of:= [.AY58] + 1 -> 65 | BA58: of:= [.AZ58] + 1 -> 66 | BB58: of:= [.BA58] + 1 -> 67 | BC58: of:= [.BB58] + 1 -> 68 | BD58: of:= [.BC58] + 1 -> 69 | BE58: of:= [.BD58] + 1 -> 70 | BF58: of:= [.BE58] + 1 -> 71 | BG58: of:= [.BF58] + 1 -> 72 | BH58: of:= [.BG58] + 1 -> 73 | BI58: of:= [.BH58] + 1 -> 74 | BJ58: of:= [.BI58] + 1 -> 75 | BK58: of:= [.BJ58] + 1 -> 76 | BL58: of:= [.BK58] + 1 -> 77
A59: of:= [.A58] + 1 -> 15 | B59: of:= [.A59] + 1 -> 16 | C59: of:= [.B59] + 1 -> 17 | D59: of:= [.C59] + 1 -> 18 | E59: of:= [.D59] + 1 -> 19 | F59: of:= [.E59] + 1 -> 20 | G59: of:= [.F59] + 1 -> 21 | H59: of:= [.G59] + 1 -> 22 | I59: of:= [.H59] + 1 -> 23 | J59: of:= [.I59] + 1 -> 24 | K59: of:= [.J59] + 1 -> 25 | L59: of:= [.K59] + 1 -> 26 | M59: of:= [.L59] + 1 -> 27 | N59: of:= [.M59] + 1 -> 28 | O59: of:= [.N59] + 1 -> 29 | P59: of:= [.O59] + 1 -> 30 | Q59: of:= [.P59] + 1 -> 31 | R59: of:= [.Q59] + 1 -> 32 | S59: of:= [.R59] + 1 -> 33 | T59: of:= [.S59] + 1 -> 34 | U59: of:= [.T59] + 1 -> 35 | V59: of:= [.U59] + 1 -> 36 | W59: of:= [.V59] + 1 -> 37 | X59: of:= [.W59] + 1 -> 38 | Y59: of:= [.X59] + 1 -> 39 | Z59: of:= [.Y59] + 1 -> 40 | AA59: of:= [.Z59] + 1 -> 41 | AB59: of:= [.AA59] + 1 -> 42 | AC59: of:= [.AB59] + 1 -> 43 | AD59: of:= [.AC59] + 1 -> 44 | AE59: of:= [.AD59] + 1 -> 45 | AF59: of:= [.AE59] + 1 -> 46 | AG59: of:= [.AF59] + 1 -> 47 | AH59: of:= [.AG59] + 1 -> 48 | AI59: of:= [.AH59] + 1 -> 49 | AJ59: of:= [.AI59] + 1 -> 50 | AK59: of:= [.AJ59] + 1 -> 51 | AL59: of:= [.AK59] + 1 -> 52 | AM59: of:= [.AL59] + 1 -> 53 | AN59: of:= [.AM59] + 1 -> 54 | AO59: of:= [.AN59] + 1 -> 55 | AP59: of:= [.AO59] + 1 -> 56 | AQ59: of:= [.AP59] + 1 -> 57 | AR59: of:= [.AQ59] + 1 -> 58 | AS59: of:= [.AR59] + 1 -> 59 | AT59: of:= [.AS59] + 1 -> 60 | AU59: of:= [.AT59] + 1 -> 61 | AV59: of:= [.AU59] + 1 -> 62 | AW59: of:= [.AV59] + 1 -> 63 | AX59: of:= [.AW59] + 1 -> 64 | AY59: of:= [.AX59] + 1 -> 65 | AZ59: of:= [.AY59] + 1 -> 66 | BA59: of:= [.AZ59] + 1 -> 67 | BB59: of:= [.BA59] + 1 -> 68 | BC59: of:= [.BB59] + 1 -> 69 | BD59: of:= [.BC59] + 1 -> 70 | BE59: of:= [.BD59] + 1 -> 71 | BF59: of:= [.BE59] + 1 -> 72 | BG59: of:= [.BF59] + 1 -> 73 | BH59: of:= [.BG59] + 1 -> 74 | BI59: of:= [.BH59] + 1 -> 75 | BJ59: of:= [.BI59] + 1 -> 76 | BK59: of:= [.BJ59] + 1 -> 77 | BL59: of:= [.BK59] + 1 -> 78
A60: of:= [.A59] + 1 -> 16 | B60: of:= [.A60] + 1 -> 17 | C60: of:= [.B60] + 1 -> 18 | D60: of:= [.C60] + 1 -> 19 | E60: of:= [.D60] + 1 -> 20 | F60: of:= [.E60] + 1 -> 21 | G60: of:= [.F60] + 1 -> 22 | H60: of:= [.G60] + 1 -> 23 | I60: of:= [.H60] + 1 -> 24 | J60: of:= [.I60] + 1 -> 25 | K60: of:= [.J60] + 1 -> 26 | L60: of:= [.K60] + 1 -> 27 | M60: of:= [.L60] + 1 -> 28 | N60: of:= [.M60] + 1 -> 29 | O60: of:= [.N60] + 1 -> 30 | P60: of:= [.O60] + 1 -> 31 | Q60: of:= [.P60] + 1 -> 32 | R60: of:= [.Q60] + 1 -> 33 | S60: of:= [.R60] + 1 -> 34 | T60: of:= [.S60] + 1 -> 35 | U60: of:= [.T60] + 1 -> 36 | V60: of:= [.U60] + 1 -> 37 | W60: of:= [.V60] + 1 -> 38 | X60: of:= [.W60] + 1 -> 39 | Y60: of:= [.X60] + 1 -> 40 | Z60: of:= [.Y60] + 1 -> 41 | AA60: of:= [.Z60] + 1 -> 42 | AB60: of:= [.AA60] + 1 -> 43 | AC60: of:= [.AB60] + 1 -> 44 | AD60: of:= [.AC60] + 1 -> 45 | AE60: of:= [.AD60] + 1 -> 46 | AF60: of:= [.AE60] + 1 -> 47 | AG60: of:= [.AF60] + 1 -> 48 | AH60: of:= [.AG60] + 1 -> 49 | AI60: of:= [.AH60] + 1 -> 50 | AJ60: of:= [.AI60] + 1 -> 51 | AK60: of:= [.AJ60] + 1 -> 52 | AL60: of:= [.AK60] + 1 -> 53 | AM60: of:= [.AL60] + 1 -> 54 | AN60: of:= [.AM60] + 1 -> 55 | AO60: of:= [.AN60] + 1 -> 56 | AP60: of:= [.AO60] + 1 -> 57 | AQ60: of:= [.AP60] + 1 -> 58 | AR60: of:= [.AQ60] + 1 -> 59 | AS60: of:= [.AR60] + 1 -> 60 | AT60: of:= [.AS60] + 1 -> 61 | AU60: of:= [.AT60] + 1 -> 62 | AV60: of:= [.AU60] + 1 -> 63 | AW60: of:= [.AV60] + 1 -> 64 | AX60: of:= [.AW60] + 1 -> 65 | AY60: of:= [.AX60] + 1 -> 66 | AZ60: of:= [.AY60] + 1 -> 67 | BA60: of:= [.AZ60] + 1 -> 68 | BB60: of:= [.BA60] + 1 -> 69 | BC60: of:= [.BB60] + 1 -> 70 | BD60: of:= [.BC60] + 1 -> 71 | BE60: of:= [.BD60] + 1 -> 72 | BF60: of:= [.BE60] + 1 -> 73 | BG60: of:= [.BF60] + 1 -> 74 | BH60: of:= [.BG60] + 1 -> 75 | BI60: of:= [.BH60] + 1 -> 76 | BJ60: of:= [.BI60] + 1 -> 77 | BK60: of:= [.BJ60] + 1 -> 78 | BL60: of:= [.BK60] + 1 -> 79
A61: of:= [.A60] + 1 -> 17 | B61: of:= [.A61] + 1 -> 18 | C61: of:= [.B61] + 1 -> 19 | D61: of:= [.C61] + 1 -> 20 | E61: of:= [.D61] + 1 -> 21 | F61: of:= [.E61] + 1 -> 22 | G61: of:= [.F61] + 1 -> 23 | H61: of:= [.G61] + 1 -> 24 | I61: of:= [.H61] + 1 -> 25 | J61: of:= [.I61] + 1 -> 26 | K61: of:= [.J61] + 1 -> 27 | L61: of:= [.K61] + 1 -> 28 | M61: of:= [.L61] + 1 -> 29 | N61: of:= [.M61] + 1 -> 30 | O61: of:= [.N61] + 1 -> 31 | P61: of:= [.O61] + 1 -> 32 | Q61: of:= [.P61] + 1 -> 33 | R61: of:= [.Q61] + 1 -> 34 | S61: of:= [.R61] + 1 -> 35 | T61: of:= [.S61] + 1 -> 36 | U61: of:= [.T61] + 1 -> 37 | V61: of:= [.U61] + 1 -> 38 | W61: of:= [.V61] + 1 -> 39 | X61: of:= [.W61] + 1 -> 40 | Y61: of:= [.X61] + 1 -> 41 | Z61: of:= [.Y61] + 1 -> 42 | AA61: of:= [.Z61] + 1 -> 43 | AB61: of:= [.AA61] + 1 -> 44 | AC61: of:= [.AB61] + 1 -> 45 | AD61: of:= [.AC61] + 1 -> 46 | AE61: of:= [.AD61] + 1 -> 47 | AF61: of:= [.AE61] + 1 -> 48 | AG61: of:= [.AF61] + 1 -> 49 | AH61: of:= [.AG61] + 1 -> 50 | AI61: of:= [.AH61] + 1 -> 51 | AJ61: of:= [.AI61] + 1 -> 52 | AK61: of:= [.AJ61] + 1 -> 53 | AL61: of:= [.AK61] + 1 -> 54 | AM61: of:= [.AL61] + 1 -> 55 | AN61: of:= [.AM61] + 1 -> 56 | AO61: of:= [.AN61] + 1 -> 57 | AP61: of:= [.AO61] + 1 -> 58 | AQ61: of:= [.AP61] + 1 -> 59 | AR61: of:= [.AQ61] + 1 -> 60 | AS61: of:= [.AR61] + 1 -> 61 | AT61: of:= [.AS61] + 1 -> 62 | AU61: of:= [.AT61] + 1 -> 63 | AV61: of:= [.AU61] + 1 -> 64 | AW61: of:= [.AV61] + 1 -> 65 | AX61: of:= [.AW61] + 1 -> 66 | AY61: of:= [.AX61] + 1 -> 67 | AZ61: of:= [.AY61] + 1 -> 68 | BA61: of:= [.AZ61] + 1 -> 69 | BB61: of:= [.BA61] + 1 -> 70 | BC61: of:= [.BB61] + 1 -> 71 | BD61: of:= [.BC61] + 1 -> 72 | BE61: of:= [.BD61] + 1 -> 73 | BF61: of:= [.BE61] + 1 -> 74 | BG61: of:= [.BF61] + 1 -> 75 | BH61: of:= [.BG61] + 1 -> 76 | BI61: of:= [.BH61] + 1 -> 77 | BJ61: of:= [.BI61] + 1 -> 78 | BK61: of:= [.BJ61] + 1 -> 79 | BL61: of:= [.BK61] + 1 -> 80
A62: of:= [.A61] + 1 -> 18 | B62: of:= [.A62] + 1 -> 19 | C62: of:= [.B62] + 1 -> 20 | D62: of:= [.C62] + 1 -> 21 | E62: of:= [.D62] + 1 -> 22 | F62: of:= [.E62] + 1 -> 23 | G62: of:= [.F62] + 1 -> 24 | H62: of:= [.G62] + 1 -> 25 | I62: of:= [.H62] + 1 -> 26 | J62: of:= [.I62] + 1 -> 27 | K62: of:= [.J62] + 1 -> 28 | L62: of:= [.K62] + 1 -> 29 | M62: of:= [.L62] + 1 -> 30 | N62: of:= [.M62] + 1 -> 31 | O62: of:= [.N62] + 1 -> 32 | P62: of:= [.O62] + 1 -> 33 | Q62: of:= [.P62] + 1 -> 34 | R62: of:= [.Q62] + 1 -> 35 | S62: of:= [.R62] + 1 -> 36 | T62: of:= [.S62] + 1 -> 37 | U62: of:= [.T62] + 1 -> 38 | V62: of:= [.U62] + 1 -> 39 | W62: of:= [.V62] + 1 -> 40 | X62: of:= [.W62] + 1 -> 41 | Y62: of:= [.X62] + 1 -> 42 | Z62: of:= [.Y62] + 1 -> 43 | AA62: of:= [.Z62] + 1 -> 44 | AB62: of:= [.AA62] + 1 -> 45 | AC62: of:= [.AB62] + 1 -> 46 | AD62: of:= [.AC62] + 1 -> 47 | AE62: of:= [.AD62] + 1 -> 48 | AF62: of:= [.AE62] + 1 -> 49 | AG62: of:= [.AF62] + 1 -> 50 | AH62: of:= [.AG62] + 1 -> 51 | AI62: of:= [.AH62] + 1 -> 52 | AJ62: of:= [.AI62] + 1 -> 53 | AK62: of:= [.AJ62] + 1 -> 54 | AL62: of:= [.AK62] + 1 -> 55 | AM62: of:= [.AL62] + 1 -> 56 | AN62: of:= [.AM62] + 1 -> 57 | AO62: of:= [.AN62] + 1 -> 58 | AP62: of:= [.AO62] + 1 -> 59 | AQ62: of:= [.AP62] + 1 -> 60 | AR62: of:= [.AQ62] + 1 -> 61 | AS62: of:= [.AR62] + 1 -> 62 | AT62: of:= [.AS62] + 1 -> 63 | AU62: of:= [.AT62] + 1 -> 64 | AV62: of:= [.AU62] + 1 -> 65 | AW62: of:= [.AV62] + 1 -> 66 | AX62: of:= [.AW62] + 1 -> 67 | AY62: of:= [.AX62] + 1 -> 68 | AZ62: of:= [.AY62] + 1 -> 69 | BA62: of:= [.AZ62] + 1 -> 70 | BB62: of:= [.BA62] + 1 -> 71 | BC62: of:= [.BB62] + 1 -> 72 | BD62: of:= [.BC62] + 1 -> 73 | BE62: of:= [.BD62] + 1 -> 74 | BF62: of:= [.BE62] + 1 -> 75 | BG62: of:= [.BF62] + 1 -> 76 | BH62: of:= [.BG62] + 1 -> 77 | BI62: of:= [.BH62] + 1 -> 78 | BJ62: of:= [.BI62] + 1 -> 79 | BK62: of:= [.BJ62] + 1 -> 80 | BL62: of:= [.BK62] + 1 -> 81
A63: of:= [.A62] + 1 -> 19 | B63: of:= [.A63] + 1 -> 20 | C63: of:= [.B63] + 1 -> 21 | D63: of:= [.C63] + 1 -> 22 | E63: of:= [.D63] + 1 -> 23 | F63: of:= [.E63] + 1 -> 24 | G63: of:= [.F63] + 1 -> 25 | H63: of:= [.G63] + 1 -> 26 | I63: of:= [.H63] + 1 -> 27 | J63: of:= [.I63] + 1 -> 28 | K63: of:= [.J63] + 1 -> 29 | L63: of:= [.K63] + 1 -> 30 | M63: of:= [.L63] + 1 -> 31 | N63: of:= [.M63] + 1 -> 32 | O63: of:= [.N63] + 1 -> 33 | P63: of:= [.O63] + 1 -> 34 | Q63: of:= [.P63] + 1 -> 35 | R63: of:= [.Q63] + 1 -> 36 | S63: of:= [.R63] + 1 -> 37 | T63: of:= [.S63] + 1 -> 38 | U63: of:= [.T63] + 1 -> 39 | V63: of:= [.U63] + 1 -> 40 | W63: of:= [.V63] + 1 -> 41 | X63: of:= [.W63] + 1 -> 42 | Y63: of:= [.X63] + 1 -> 43 | Z63: of:= [.Y63] + 1 -> 44 | AA63: of:= [.Z63] + 1 -> 45 | AB63: of:= [.AA63] + 1 -> 46 | AC63: of:= [.AB63] + 1 -> 47 | AD63: of:= [.AC63] + 1 -> 48 | AE63: of:= [.AD63] + 1 -> 49 | AF63: of:= [.AE63] + 1 -> 50 | AG63: of:= [.AF63] + 1 -> 51 | AH63: of:= [.AG63] + 1 -> 52 | AI63: of:= [.AH63] + 1 -> 53 | AJ63: of:= [.AI63] + 1 -> 54 | AK63: of:= [.AJ63] + 1 -> 55 | AL63: of:= [.AK63] + 1 -> 56 | AM63: of:= [.AL63] + 1 -> 57 | AN63: of:= [.AM63] + 1 -> 58 | AO63: of:= [.AN63] + 1 -> 59 | AP63: of:= [.AO63] + 1 -> 60 | AQ63: of:= [.AP63] + 1 -> 61 | AR63: of:= [.AQ63] + 1 -> 62 | AS63: of:= [.AR63] + 1 -> 63 | AT63: of:= [.AS63] + 1 -> 64 | AU63: of:= [.AT63] + 1 -> 65 | AV63: of:= [.AU63] + 1 -> 66 | AW63: of:= [.AV63] + 1 -> 67 | AX63: of:= [.AW63] + 1 -> 68 | AY63: of:= [.AX63] + 1 -> 69 | AZ63: of:= [.AY63] + 1 -> 70 | BA63: of:= [.AZ63] + 1 -> 71 | BB63: of:= [.BA63] + 1 -> 72 | BC63: of:= [.BB63] + 1 -> 73 | BD63: of:= [.BC63] + 1 -> 74 | BE63: of:= [.BD63] + 1 -> 75 | BF63: of:= [.BE63] + 1 -> 76 | BG63: of:= [.BF63] + 1 -> 77 | BH63: of:= [.BG63] + 1 -> 78 | BI63: of:= [.BH63] + 1 -> 79 | BJ63: of:= [.BI63] + 1 -> 80 | BK63: of:= [.BJ63] + 1 -> 81 | BL63: of:= [.BK63] + 1 -> 82
A64: of:= [.A63] + 1 -> 20 | B64: of:= [.A64] + 1 -> 21 | C64: of:= [.B64] + 1 -> 22 | D64: of:= [.C64] + 1 -> 23 | E64: of:= [.D64] + 1 -> 24 | F64: of:= [.E64] + 1 -> 25 | G64: of:= [.F64] + 1 -> 26 | H64: of:= [.G64] + 1 -> 27 | I64: of:= [.H64] + 1 -> 28 | J64: of:= [.I64] + 1 -> 29 | K64: of:= [.J64] + 1 -> 30 | L64: of:= [.K64] + 1 -> 31 | M64: of:= [.L64] + 1 -> 32 | N64: of:= [.M64] + 1 -> 33 | O64: of:= [.N64] + 1 -> 34 | P64: of:= [.O64] + 1 -> 35 | Q64: of:= [.P64] + 1 -> 36 | R64: of:= [.Q64] + 1 -> 37 | S64: of:= [.R64] + 1 -> 38 | T64: of:= [.S64] + 1 -> 39 | U64: of:= [.T64] + 1 -> 40 | V64: of:= [.U64] + 1 -> 41 | W64: of:= [.V64] + 1 -> 42 | X64: of:= [.W64] + 1 -> 43 | Y64: of:= [.X64] + 1 -> 44 | Z64: of:= [.Y64] + 1 -> 45 | AA64: of:= [.Z64] + 1 -> 46 | AB64: of:= [.AA64] + 1 -> 47 | AC64: of:= [.AB64] + 1 -> 48 | AD64: of:= [.AC64] + 1 -> 49 | AE64: of:= [.AD64] + 1 -> 50 | AF64: of:= [.AE64] + 1 -> 51 | AG64: of:= [.AF64] + 1 -> 52 | AH64: of:= [.AG64] + 1 -> 53 | AI64: of:= [.AH64] + 1 -> 54 | AJ64: of:= [.AI64] + 1 -> 55 | AK64: of:= [.AJ64] + 1 -> 56 | AL64: of:= [.AK64] + 1 -> 57 | AM64: of:= [.AL64] + 1 -> 58 | AN64: of:= [.AM64] + 1 -> 59 | AO64: of:= [.AN64] + 1 -> 60 | AP64: of:= [.AO64] + 1 -> 61 | AQ64: of:= [.AP64] + 1 -> 62 | AR64: of:= [.AQ64] + 1 -> 63 | AS64: of:= [.AR64] + 1 -> 64 | AT64: of:= [.AS64] + 1 -> 65 | AU64: of:= [.AT64] + 1 -> 66 | AV64: of:= [.AU64] + 1 -> 67 | AW64: of:= [.AV64] + 1 -> 68 | AX64: of:= [.AW64] + 1 -> 69 | AY64: of:= [.AX64] + 1 -> 70 | AZ64: of:= [.AY64] + 1 -> 71 | BA64: of:= [.AZ64] + 1 -> 72 | BB64: of:= [.BA64] + 1 -> 73 | BC64: of:= [.BB64] + 1 -> 74 | BD64: of:= [.BC64] + 1 -> 75 | BE64: of:= [.BD64] + 1 -> 76 | BF64: of:= [.BE64] + 1 -> 77 | BG64: of:= [.BF64] + 1 -> 78 | BH64: of:= [.BG64] + 1 -> 79 | BI64: of:= [.BH64] + 1 -> 80 | BJ64: of:= [.BI64] + 1 -> 81 | BK64: of:= [.BJ64] + 1 -> 82 | BL64: of:= [.BK64] + 1 -> 83